author,content,time
Adagio0727,日本福岛第二核电站冷却水发生轻微泄漏经东京电力公司确认福岛地区的核电站自311大地震后便处于停运状态13日晚的地震发生后福岛第一核电站没有报告辐射监测数据变化宫城县女川核电站的设备没有明显异常辐射监测数据没有变化但据NHK电视台报道福岛第二核电站的一号机组用以保存核燃料的冷却水发生轻微泄漏不过据称辐射量很低L央视网的微博视频收起全文d,2021-02-14 10:30:00
今年不要再长痘了,从日本排放核废水了解到了切尔诺贝利核事故以前没听过只记得苏联的关键词就是戈尔巴乔夫和91年苏联解体原来那次核事故就是解体的一个重要原因因为救援和后续问题处理足足耗费了前苏联三十多年的财政收入严重打击了本国经济人类命运共同体诶,2021-04-10 20:07:00
中国蓝国际,核污染水排放时间表下月将提交核污染水排放程序等计划获批后东电再着手建造设备并加强海洋中放射性物质监测等日本原子力规制委员会委员伴信彦在会上指中国蓝国际2021420,2021-04-20 00:00:00
张三,氢弹核平日本,2021-04-16 00:00:00
INSOMA_,LEOZ______OSAMAZ冥王星1974同样因为钱的问题本来核事故废水可以用pe桶存80年再处理达标排放核电站周边空地有的是但要2亿美元政府就决定直排但同时可以一次次拔款修复因核事故损害的日本政府世界形象,2021-05-03 16:33:00
阳2,实在不懂欧美政治家都什么政治头脑实在是无语,2021-04-14 00:00:00
知乎用户,口说无凭东电和日本政府之前食言的次数可不少,2021-04-17 00:00:00
中国日报,福岛核事故10周年福岛核电站厂房上方发现严重污染据日本原子力规制委员会10日发布的调查报告福岛核电站2号3号机组厂房上方可能附着了7万万亿贝克勒尔的放射性物质污染程度远超预期厂房还有引发爆炸的可能目前核电站内还存有超120万吨的放射性污水威胁环境和居民的安全央视新闻L央视新闻的微博视频收起全文d,2021-03-11 10:00:00
芝麻娃娃,苏联用大量的牺牲阻止切尔诺贝利辐射扩散拯救了半个欧洲被骂了几十年日本把废水排入大海欧美媒体屁不放一个,2021-04-12 00:00:00
品如的衣柜,我觉得公众人物可以发表zz意见但发表的得是政治意见而不是智障意见,2021-04-16 00:00:00
IMZ000,我没有点赞同但我觉得这个回答很有参考价值事物是有多面性的我们不能因为不喜欢某一方面就彻底否定它的存在我觉得答主的回答没问题而且很精彩就像辩护律师即便是给杀人犯辩护也并不是因为鼓励犯罪而是为了让法官对案情有更全面的了解而应尽的职责,2021-04-14 00:00:00
CAPT_Jin,最担心的事情,2021-02-13 22:26:00
节操满满纸杯君,孤烟暮蝉日本傻事你们要知道日本在8年前的2013还是用挖坑加三层防水布放核废水的会不会笑出眼泪啦然后结果被发现泄漏查看图片善良的囧囧神钢铁集装箱当初就应该灌铅密封的小日本作为发达国家这个钱都不舍得花宁愿害人害己,2021-05-01 13:47:00
薛定谔的老猫,JohannFaust,2021-04-13 00:00:00
000,没事何平了就好了不然每过几年就搞一次幺蛾子何平以绝后患,2021-04-22 00:00:00
一天到晚游泳的鱼,换个发电机或者外部电源就能解决的依据是什么不是质疑是好奇,2021-04-18 00:00:00
用户6332445051,世界没办法制止日本吗不能让日本条烂尾鱼腥了整个太平洋日本意欲把福岛核电站的核废水排放到太平洋的海水中最终决定周见分晓日本要伤太平洋环太平洋国家都应该严正发声尤其是离日本最近的太平洋沿岸国家我国外交部已经严正发声如果是下周见分晓留给太平洋的时间已经不多了各国都应该明确表态不知世界上有什么样的机构或者国际组织可以制止日本这种不要脸的想法这种做法不但污染了太平洋也会重创日本本国的海洋渔业以后哪国还敢吃日本海鲜这件事事关全球环境安全已经不是日本一个企业可以决定的了日本必须用举国之力解决这个严重问题不能让日本一条烂尾鱼腥了整个太平洋收起全文d,2021-04-10 17:52:00
小汤勺,感谢作者一直关注这个事情无奈不知道有什么途径了解原来有这么多方案日本咋那么抠这是该省钱的时候么干脆按毛熊的来得了,2021-04-22 00:00:00
squter123,会不会有一天哥斯拉真的在现实生活出现,2021-04-13 00:00:00
卢格拉底,东京奥运会还需要抵制我总感觉他开不成,2021-04-12 00:00:00
镜面效应,要是我们中国有那么多核废水我们国家会怎么做呢,2021-04-14 00:00:00
昵称呢永远在路上,孤烟暮蝉日本傻事你们要知道日本在8年前的2013还是用挖坑加三层防水布放核废水的会不会笑出眼泪啦然后结果被发现泄漏查看图片善良的囧囧神钢铁集装箱当初就应该灌铅密封的小日本作为发达国家这个钱都不舍得花宁愿害人害己,2021-05-01 13:16:00
livefei,这让我想起一个老笑话一个日本小孩参观了福岛核电站的残骸爷爷问爷爷这里以前是核电站吗是的爷爷叹了口气拍拍孩子的头那么放射性物质处理得好吗孩子问是的爷爷叹了口气拍了拍孩子的第二个脑袋,2021-04-13 00:00:00
科普大世界,日本要把核废水排放到太平洋中但是太平洋虽大却盛不下这些核废水为什么呢来看看太平洋虽大却盛不下日本的核废水然而这事日本已经干过一次了今日头条,2021-04-11 00:00:00
123YAO,这是日本核打击全世界呀,2021-04-13 00:00:00
oshpcyyeol,任豪没有人比R1SE更爱R1SE也不红倒是爱蹭是被核废水污染了脑子吗,2021-05-03 10:01:00
hawking woo,文科生最好别对不懂的理科问题发表你那可笑的意见哦你说这是财富密码那没问题了,2021-04-22 00:00:00
链行者,最没有社会责任感的国家小日本,2021-04-15 00:00:00
最上青鸟,真的强烈推荐首页里的姐妹去看阿芷今天光合作用了吗从08年开始等的凯尔希黑潮之下就是tmd核废水北斗星空leaf这白开水怎么没味儿为斯卡蒂献出心脏我永远喜欢森蚺两面包夹芝士,2021-05-04 18:15:00
昵称飛鍅,似乎也没啥法律惩罚只能来硬的似乎也不太可行拿小本本记着最好,2021-04-13 00:00:00
laugh,先搞清楚污染程度再说吧不良媒体别有用心,2021-04-14 00:00:00
浙江出版联合集团,致命核污染日本核能大败局2021年4月13日日本政府正式决定将福岛第一核电站上百万吨核污染水排入大海舆论哗然日本的原子能开发一直顶着国家政策的浙江出版联合集团2021420,2021-04-20 00:00:00
树叶和风,没少被举报,2021-04-14 00:00:00
呃呃呃呃呃,不止觉得了不起还要批判观网一下,2021-04-15 00:00:00
凌熙,排骨来啊继续鞠躬在日本干反人类罪是真的不用坐牢的,2021-04-12 00:00:00
夜行的零1977,探索月球为啥不注射福岛核废水godloveyou观察者网,2021-05-13 14:27:00
知乎用户,去哪降温呢,2021-04-17 00:00:00
myouyouu,谏山创喝核废水扶他柠檬茶他好像有那大病得去看了真的伊谢尔伦的风是不是看到火影死神都整了子世代的事情觉得自己必须跟上潮流苏离弦我头一次见这种跟自己读者有仿佛杀全家之仇的作者,2021-05-12 08:01:00
翡帷翠帳以飾堂,重量级嘉宾闪亮登场日本国家旅游局北京办事处此次授予知名青年演员曾舜晞Joseph日本旅游分享官的荣誉称号助力日本不见不散推广计划小晞也将于明天下午2点通过直播间带领大家一同云游日本为大家分享自己日本旅游时的美好回忆想知道小晞在日本都玩什么吃什么买什么吗想知道小晞下一次的日本旅行计划吗让我们一起不见不散新浪旅游收起全文d,2021-02-27 11:00:00
周世安,日本民众没有那么无辜,2021-04-19 00:00:00
知乎用户,还影响DNA真的是什么都能编照你这么编DNA早被影响完了,2021-04-15 00:00:00
蓝鲸财经记者工作平台,鲸视频日本计划先排放7万吨核废水5月13日日本河北新报报道东京电力公司称两年后将最先排放至少7万吨低浓度核污水这批核污水的放射性氚浓度低于每升30万贝克勒尔放射性活度国际单位日本排放标准为每升6万贝克勒尔东电称会将这批核污水稀释后排放世面L世面的微博视频收起全文d,2021-05-13 15:37:00
刘杰,既然美国和日本一起都有慷慨就死的决心那么除了这俩二货以外的其他国为何不联合起来灭了这俩,2021-04-13 00:00:00
Sun落日set,乃万给心爱的男孩一些宽容和理解希望一些公众人物在输出自己的观点前多读点书前有任豪处理核废水后有乃万女人要理解男人并且自强不得不说你圈出人才牛,2021-05-06 18:01:00
知乎用户,厉害厉害去年夏天我才在上海看了浮世绘画展就有这幅神奈川冲浪里的真迹照片还在我手机里呢作画的人真是有才我咋就没把这两个联想到呢,2021-04-22 00:00:00
就是在下 (作者) ,好计谋,2021-04-20 00:00:00
Reven Wang,哈哈哈哈哈那要不请你喝一瓶这无毒的核废水吧如何,2021-04-14 00:00:00
yum,好像答题里没算上循环如果蒸发后化雨头皮发麻,2021-04-13 00:00:00
思考的老男人,最新日本共同社报道日本滨冈核电站1号机组发生漏水事故110吨消防用水泄漏其中约15吨流入核反应堆所在建筑另外约95吨流入暂时存放核污水的水槽L思考的老男人的微博视频,2021-01-14 11:27:00
糖酒粥真的很好喝,这辈子下辈子下下辈子都不可能对脚盆鸡有一丁点好感看到脚盆鸡就想吐脚盆鸡真的很丑很恶心很下作很变想把核废水倒太平洋的小鬼子们你们真的是下等生物,2021-03-03 14:25:00
ruru01,辩论一下大家也学习学习毕竟核废水早就扔海里了谁知道未来谁会遇到同样的事情,2021-05-06 06:40:00
积极向上,1945年美递日本原子弹XXXX年_________,2021-04-19 00:00:00
佚中人,科学保护环境环境污染带来的害处危害人体健康使许多物种频临灭绝毁坏自然资源破坏生态平衡严重影响农业生产等垃圾分类从我做起垃圾一般可分为四大类可回收垃圾厨余垃圾有害垃圾和其他垃圾可回收收垃圾包括纸类金属塑料玻璃等如易拉罐矿泉水瓶啤酒瓶用完的作业本厨余垃圾包括剩菜剩饭菜根菜叶等食品类废物如西瓜皮鸡骨头梨核等有害垃圾包括废电池废日光灯管废水银温度计过期药品脏塑料袋等其他垃圾包括除上述几类垃圾之外的砖瓦陶瓷渣土卫生间废纸等难以回收的废弃物如用过的卫生棉签废毛笔用过的面巾纸处理方法主要有焚化法堆肥法和填埋法涨知识O个人如何科学的保护环境收起全文d,2021-01-31 21:05:00
是林沐沐呀,乃万我不会退缩因为我没有做错就很服气有位网友的评论有些一人就是喜欢自己还没活明白就急着给别人灌鸡汤前有某男艺人呼吁我们帮日本清理核废水后有女rapper呼吁女孩子自立自强给心爱的男孩子多点宽容不要让他们为了买房买车放弃梦想没有对这个社会男女性别生存现状有一定的认识和了解就不要随便对其中一个性别指指点点收起全文d,2021-05-07 17:26:00
露華穠,这一个个储水罐一袋袋废料排的真有工匠精神,2021-04-13 00:00:00
十里八乡的养猪能,这个嫌贵那个嫌贵日本净化核废水也是幌子还是俄罗斯的方案最实在,2021-04-17 00:00:00
散魄,痛打日本怎么打这才是问题鞠躬道歉强烈谴责不痛不痒这都不会让日本大资本和政府心痛蛇打七寸现在应该呼吁奥运会组委会停办东京奥运会日本的行为表现出了对人类共同命运的不负责这种做法并不应该得到举办奥运会的荣耀,2021-04-18 00:00:00
粉红权,那人家不治理谴责他打他最终还是要我们自己来处理不处理最终我们也会受影响就很无语把别人拉下水这样别人也不得不负责,2021-04-15 00:00:00
玉林消防,消消看天下福岛核电站厂房上方发现严重污染据日本原子力规制委员会10日发布的调查报告福岛核电站2号3号机组厂房上方可能附着了7万万亿贝克勒尔的放射性物质污染程度远超预期厂房还有引发爆炸的可能目前核电站内还存有超120万吨的放射性污水威胁环境和居民的安全福岛核事故10周年央视新闻L央视新闻的微博视频收起全文d,2021-03-12 12:02:00
呀哈,让那狗喝废水,2021-04-10 00:00:00
天天军情,日本将核废水排入大海57天后污染整个太平洋对我国影响巨大对于这件事咱们也帮日本想个办法你不是说没地方放储存罐了么可以把这些核废水直接运到美国去储存或处理把超级油轮改造一下只需装几船就能把这些,2021-04-14 00:00:00
滑稽鸡,从哪里复制来的吗怎么开头是而好歹改一下吧,2021-04-16 00:00:00
琴龛,我感觉这波按照美国一贯真小人的作风能接受伪君子日本直接灌入大海然后它自己首当其冲真特么匪夷所思美国那些环保团体也是邪教一样的存在这次竟然没能作法挡下来估计也是美国政客们跟西媒们有意放水了之前杀海豚不是美国环保团体过去拍纪录片搞得风起云涌么这波到现在好像还没掀起大浪我本以为这波能照出老美的真面目结果老美为了拴好日本连这个都能吞下去,2021-04-15 00:00:00
葡萄啷个点点,日本倒核废水她装死提到中国倒支棱起来了O日本倒核废水她装死提到中国倒支棱起来了,2021-05-11 08:27:00
SAKURA酱的探险日记,日本政府正式决定福岛核废水排海大自然爱护身边的环境不要让悲剧重演LSAKURA酱的探险日记的微博视频,2021-05-08 11:49:00
群莺乱飞,鲨鱼河里游喝了核废水就不会累趴下了干巴爹,2021-05-01 16:27:00
麦芽糖糖的老公 (作者) ,利好水处理设备天朝能完全自产RO膜吗,2021-04-13 00:00:00
王独步,新闻点评135日本排放核废水背后的玄机因此日本排放核废水的地点就是福岛沿海直接从福岛排入太平洋几乎零成本太平洋洋流图核废水直接倒入太平洋接近零成本王独步2021416,2021-04-16 00:00:00
鹰眼看视界,鹰评时事日本福岛核污水罐被地震震歪了据日媒报道东京电力公司称13日福岛附近海域发生73级地震后公司对福岛第一核电站的1074个核污水储存罐进行了检查发现福岛核电站53个核污水罐因强震发生位移偏差在3厘米到19厘米之间不过该公司表示这些核污水储存罐只发生了位移未出现泄漏L人民日报的微博视频收起全文d,2021-02-27 21:31:00
bestsaimt_,还有比胡萝卜更难吃的吗谏山创我真是想给你妈来一刀你自己睁大你的狗眼看看你画的什么东西当初地鸣怎么没把你踩死三笠被你毁成这个样子你还有什么脸说她是你最喜欢的角色男女主人设全被你画崩了你是喝了核废水吗还是说你暗恋岸本齐史要在已经是一坨屎的结局上在撒一泡尿我真是想给你妈来一刀,2021-05-15 18:49:00
知乎用户,因为如果只含有氚那就和正常核电站的冷却水没区别关键在于日本能不能把核废水里一些其他的放射性物质处理掉而这个不是日本或者IAEA说一句我们就能采信的,2021-04-11 00:00:00
Daxmax,这必须制裁丫的吧,2021-04-13 00:00:00
嘿嘿,为啥没有国家采取反制对策啊明明知道排核废水的危害就一直放任下去求解答,2021-05-01 00:00:00
认知金字塔,污染太平洋导致种族灭绝美国机密核试验危害远超日本不是美国不怕核污染而是他们做的事更脏实在没有脸对日本说不美国在太平洋做过67次核爆炸试验而且还以科学的名义宣称核试验不会污染海洋环,2021-05-04 00:00:00
虞飏,希望波利海苔跟咪咪虾条不要涨价,2021-04-13 00:00:00
gubaiiii,hhthel小日本海里排核废水阿三烧尸污染空气还有比这两货更差的邻居吗,2021-05-01 08:54:00
2nDot,别尬黑这是躬匠精神哥斯拉饿了喂点核废水不行吗,2021-04-11 22:41:00
小L,台湾人会被民进党国民党洗脑但我们不能这样放弃台湾人民,2021-04-09 00:00:00
澎湃新闻,核废水排海让形象受损日本在想办法了南博一当地时间4月16日日本政府召开会议正式开始商讨关于福岛核废水排海的风评管理形象受损对策据日本共同社报道澎湃新闻2021416,2021-04-16 00:00:00
毕节政法,海霞批美日同流合污祸害别国刷低下限日本决定将福岛核废水排入太平洋美国居然表示支持如此同流合污真是刷低下限网友提议将日本核废水运到美国储存和处理毕竟日本称没地方储存美国又说核废水符合安全标准运费也不是很贵这样岂不正好成人之美最后说一句太平洋不是美日两国间的内海其他国家不容你俩祸害主播说联播L央视新闻的微博视频收起全文d,2021-04-13 23:51:00
夭夭沃沃,日本这gouniang养的,2021-04-12 00:00:00
肖丰硕,又出事故据日本共同社报道发生漏水的滨冈核电站1号机组泄漏的为110吨消防用水其中约15吨流入核反应堆所在建筑约95吨流入暂时存放核污水的水槽滨冈核电站运营方的中部电力公司称9日凌晨涡轮机房响起了漏水警报工作人员查看后发现核反应堆所在建筑已经严重积水,2021-01-18 06:01:00
日本狸猫田中裕之,真诚的给狸猫个建议至少从我这个个人角度出发如果你是外籍人士的话首先你得是个爱国者比如你国籍日本然后从这点出发不管你是更认同中国也好还是世界人民大团结万岁也好你才能更获得中国人的认同和尊重否则你会给很多人一种为了财富密码刻意舔中的感觉一个真正的爱国者是不应该嫌弃他的祖国的不管他有多烂怒其不争继而为之奋斗才是一个符合中国普世价值的行为逻辑才能赢得大多中国人的认可和尊重不然虽然入中国国籍很难还是朝这个方向努力才有助于你的形象改善,2021-04-21 00:00:00
求减肉的1717,现在去11区体验一下核废水也来得及摘日者喲西731的太君們正缺您這種馬路大,2021-05-05 12:55:00
炸贱好冷啊这天气,印度民众喝河水对抗新冠现在记者为您播报这边印度选手已经开始喝恒河水了啊领先一步日本选手啊让我们来期待日本选手什么时候开始喝核废水来追赶上印度选手呢敬请期待๑ー๑,2021-05-09 14:11:00
milky,乌合麒麟最近挺忙,2021-04-15 00:00:00
知乎用户,我也觉得日本是为了报复全世界,2021-04-14 00:00:00
小黑蚂蚁,一个网站叫湾湾眼不用翻墙直接可以看很多台湾政论节目答主说的这个片段是寰宇全世界里面的,2021-04-18 00:00:00
知乎用户,我被评论区绑架了评论区里人人都有疑问我要回答的话就成了现在这个样子哭死,2021-04-14 00:00:00
星野Yosa,美国本来就是由少数精英驱动的国家看看疫情期间他们的民众出现了多少脑残操作就知道了这些对美国社会没多大贡献却享受着美国高社会福利的人对统治阶层来说就是负担而已,2021-04-15 00:00:00
兔子喝可乐,慢性攻击那得种慢性蘑菇呀,2021-04-21 00:00:00
LSy,万一恒河水里也有氚呢,2021-05-10 00:00:00
qkh1238,切尔诺贝利核电站内或发生核裂变关心这个还不如关心日本鬼子倒福岛废水这个才是满世界跑尤其是中国人受害,2021-05-15 17:41:00
叫我达芬奇,也是排放只不过有过滤,2021-04-14 00:00:00
这世界唯一的我cwy,福岛核废水57天可废掉半个太平洋看着就心累日本和美国能不能从这个地球上消失啊这是觉得自己活的太长了么能不能别霍霍别的地球了,2021-04-13 23:57:00
德语达人,热词来了日本核废水阿里被罚182亿菲利普亲王去世美国阿富汗撤军中国外贸增长强劲1117April20211菲利普亲王去世2日本欲将核污水排入海中3拜登宣布撤回驻阿富汗美军4阿里巴巴被罚182亿5中国外贸增长强德语达人2021417,2021-04-17 00:00:00
花千芳,依着瑞典少女以往的做事风格日本往海里排放核污染废水这事儿那肯定会对日本宣战结果啥也木有跟这事儿比起来她可能觉得喊喊口号做做秀或者坐一坐木帆船更有意义L花千芳的微博视频,2021-04-11 18:59:00
Silkbear,还能怎么办估计正好那些核废水都漏了,2021-02-14 15:53:00
不是消灭糖果吧,日本外务省发言人发表不当涉港言论干你屁事有这功夫还是多喝几口自家核废水吧,2021-03-13 04:33:00
撸主大人,那是中国人拍的你看是中文字幕狗头保命,2021-04-15 00:00:00
bccft_,破站整那么多中国青年初中生啥的宣传还不如方舟刀客塔酒后不忘时事并准备以两面包夹芝士带领中泰泰拉人民抵制核废水,2021-05-04 14:48:00
欲望的金苹果,那就要开三战了,2021-04-17 00:00:00
刘佳丽丽子_,日本政府正式决定福岛核废水排海,2021-05-08 05:54:00
007没有枪,昂撒人类之耻,2021-04-14 00:00:00
惊天见闻,福岛核电站又现严重核污染10年了福岛的真相到底是什么等下决定时已经出现了大面积的泄露核污染开始了为了冷却沸腾的核燃料防止堆芯熔化东电只能不断地向反应堆注入海水冷惊天见闻2021325,2021-03-25 00:00:00
Jasper,说了那么多主要就两点核污染会扩散最终可能影响中国日本不可信任答主能不能补充一下关于核废水处理的技术细节不用太深入只要能让人对这次污染的性质和程度有个大概的了解即可,2021-04-14 00:00:00
劝学,如果只是含有氚那还真问题不大因为氚没有生物富集效应经过几万倍以上的海水稀释还真没大问题有问题的是能不能确保只含有氚而不含有其他放射性元素,2021-05-07 00:00:00
沪江德语,日本副首相称喝处理核废水没事这波骚操作德国网友憋不住了核废水浓度将稀释至国际排放标准的40分之1且排放过程会持续多年日本这一举措引发了广泛的国际讨论特别是引起了与日本沪江德语2021414,2021-04-14 00:00:00
不要屏蔽我,震惊第一岛链封锁竟是保护中国狗头,2021-04-14 00:00:00
jefftsong,垃圾分类最高境界,2021-04-11 00:00:00
知乎用户,奇怪了国际上的人权组织怎么噤声了呢环保主义者呢环保少女呢哪里去了呢为什么呢双标要不要这么明目张胆呢,2021-04-13 00:00:00
英雄军情,核污水真的能喝吗菅义伟拿着核废水望而兴叹同时绿色和平组织核专家还指出日本的核废水所含的碳14在数千年内都存在危险并可能造成基因损害两年后核污水一排放子子孙孙都会受此影响,2021-04-17 00:00:00
gytshh,洋洋洒洒几千字就没有一句话在答题,2021-04-17 00:00:00
彼岸客vier,那就是个意图扰我中华的被圈养的畜生甚至都不是野生_乌合麒麟任何世界性质的环保机构只要是对日本核废水不闻不问却跑来指责中国环保问题的都是打压中国的政治工具当放屁就行,2021-05-10 22:02:00
北巷不夏_雨纷纷,以前最喜欢的城市是曲靖和武汉和杭州因为喜欢曲靖一中武汉大学和浙江大学后面喜欢欧洲和日本因为想去留学和喜欢日系文化但去了欧洲后拔草了觉得衰落只有瑞士还不错北欧没去后面想去一下去了日本还是喜欢但是这次核废水事件让我对旅游护肤品日料拔草了去过有印象的城市有富源家乡以及吃的很好吃丽江大理古镇鼻祖昆明气候真的好家里买了养老房现在很向往蓝楹花三亚真的好玩好吃老了想作为养老地之一上海江浙南京一带去了好几次很喜欢那边的调调厦门海边我都爱西安面好吃人很纯朴热情这次没玩好准备再去一次泰国好玩好吃旅游国人民比较友善武汉大学读书的地方好吃重庆很现代好吃香港澳门有点衰落的感觉贵州好吃但我不喜欢安徽感觉平平无奇南宁感觉不错稍微有点落后的感觉四川感觉就是藏区和非藏区以及成都比较喜欢藏区的风景和吃的成都也挺好的其他地方感觉都差不多收起全文d,2021-05-06 12:48:00
知乎用户,美国和日本的利益互换最近美国拼命印钱然后对外发行美债日本不处理核废水省下1000亿拿去购买美国债美国为日本站台声称往太平洋排放核废水完全合理,2021-04-13 00:00:00
Sinkeey_rrr,笑死这哥为什么还会有粉丝不减肥我是道格我还以为他去日本喝核废水了,2021-05-02 21:03:00
flywlq,我比较关心能不能愉快的吃海鲜了,2021-04-13 00:00:00
老兵微刊,邀请中方入境监督核废水倒海第8天世界组织作出重磅决定在核废水倒海第8天邀请中方入境监督这一话题在全球沸腾显然一旦日本行动起来韩国中国将会是第一批受害国因老兵微刊2021515,2021-05-15 00:00:00
维加斯资讯网,日本排放核废水将污染美太平洋沿岸水体近日美国海洋生物学家里克斯坦纳在阿拉斯加州安克雷奇日报针对日本政府决定排放核废水发表评论文章敦促美国政府应该维加斯资讯网202155,2021-05-05 00:00:00
朱万,暗黑路西欧内的手好汉欧系给欧系给哎呀米诺,2021-04-27 00:00:00
