author,content,time
中医爱好者963,10年前日本为证明福岛净化的核废水让官员喝下后来怎样了快资讯O网页链接,2021-05-10 22:36:00
土豆小朋友,此刻好希望海洋里有真正的海王出现保护海洋教训某些人类,2021-04-13 00:00:00
读缘,日本百万吨核废水将入海被污染的海鲜正在恶心千万中国人但核废水太多了东京电力储备了约1000个储水罐9成已装满污水罐眼看着摆不下了形势岌岌可危对此日方不想再拿钱买地读缘2021416,2021-04-16 00:00:00
roberts,倒吧呼吁全球禁止一切对日本的鱼业产品与农产品采购,2021-04-10 00:00:00
李德贵,是日文汉字日语里好多中文的变形字,2021-04-13 00:00:00
章鱼精,橘生淮南则为橘生于淮北则为枳叶徒相似其实味不同所以然者何水土异也,2021-04-14 00:00:00
笑阳,之前看纪录片海豚肉是有毒素堆积的而且等级高高堆积的就越多日本一样捕杀了卖给民众吃,2021-04-15 00:00:00
alan,2025年日本被种大蘑菇,2021-04-22 00:00:00
阿斯顿马丁,所以说我们揪着二战不是无理取闹要不然他们学不会反省以后还能弄出很多事,2021-04-13 00:00:00
刘娜,环保少女是有转发但是不确定是不是像很多人说的只是走个过场还是她其实很多环保新闻也是只转发,2021-04-18 00:00:00
蒙阴环境,海洋那么美拒绝核废水请别伤害它,2021-04-22 23:55:00
fu tab,海水怎么争夺现在美国海军在全球横行霸道还想怎么争夺说不定日本这么搞就是美国授意的当不了世界老大就把全世界搞烂掉谁当老大谁就要收拾烂摊子就像大家争一个蛋糕的分配权美国不能保证自己继续掌握权力就往蛋糕里吐口水,2021-04-10 00:00:00
鹧鸪歌,哈哈哈哈笑死我了这些人啊平时在匿名区一口一个鼠偷姐骂五悠骂得来劲现在跑来蹭五悠的双人吧唧开团买不到又跑去对太太指手画脚颐指气使真就饿成这样吗你们都得是路有饿殍了吧脸这么大建议去帮日本兜一下核污水私以为你们面皮之厚连辐射都透不出去这样也能为你们这愚蠢至极的人生中画出几分杰出贡献不至于让爹妈蒙羞觉得自己养大了一块尿布收起全文d,2021-04-10 21:16:00
沐珩小企鹅,那些给yjt洗地的粉丝要不带着你们家yjt和他父母一起投入大海的怀抱用你们的鲜血稀释一下核废水拯救全人类没准到时候成功洗白还能写入史册,2021-05-02 23:30:00
Linlinjing1,刷到个视频国人在日本采访路人问对于核废水排大海怎么看福岛周围的海产你们还会吃吗真尬到我了一个外国人问这种问题别人能说什么啊不要为难普通人了吧实在没事做找个班上,2021-05-10 19:48:00
累上流云借月章,拖就嗯拖,2021-04-13 00:00:00
找呀找呀找朋友202009,我们把你台湾当同属中华的兄弟认为你是传承了中华文明的同根同源但是有的人仅仅是因为日本殖民过就认宗主国为日本核废水讹诈全世界,2021-03-25 16:24:00
啦啦啦啦啦啦啦啦,核废水是一直在循环冷却的问题是地下水福岛地势低地下水一直过来就被污染了,2021-04-13 00:00:00
黑眼睛,赞,2021-04-13 00:00:00
海洋生态大讲堂,观点不能允许日本福岛核废水排放的真正理由xx2021年4月13日日本政府做出决定将福岛核电站废水排放入大海引发全球轩然大波人们在网上讨论了很多很多但有一些真正海洋生态大讲堂2021416,2021-04-16 00:00:00
遗落嵩任Sophia,福岛核废水57天可废掉半个太平洋大核民族,2021-04-13 23:52:00
普通人拖肥_二周目,梓殒不是我杞人忧天赶紧监控附近海域海水放射性元素含量这特么别到时候说核废水震漏了妈的正中下怀,2021-05-14 09:04:00
有声有味,丧心病狂日本决定将福岛核废水排放太平洋这或将影响每一个人蒸发释放电解排放稀释入海地下掩埋以及注入地层在了解这些方案的利弊之前我们先了解哪些是核废料1核垃圾物体2有声有味2021411,2021-04-11 00:00:00
无隅,日本排放福岛核废水及福岛核事故笑话日本排放核废水面临的主要障碍是什么主要的障碍有四个春天夏天秋天和冬天能减少一个障碍吗那么还剩三个昨天今无隅2021417,2021-04-17 00:00:00
Miss_loading,日本番茄酱大王停止进口新疆番茄停止任何农产品向日本输入等他们喝福岛核废水过日子,2021-04-14 23:59:00
灵性导师丛森,核废水倾倒太平洋畜生国家恶鬼行径倭人科技发达人伦却如此不堪2齐齐哈尔克山县,2021-04-10 17:10:00
知乎用户,凤凰传奇,2021-04-22 00:00:00
海外网,日媒曝福岛核污水排放方案就近或离岸排放海外网5月11日电据日本产经新闻10日报道有关福岛核污水排放入海问题相关人士透露称东京电力公司正在重点考虑两套方案在核电站东侧海岸上就近,2021-05-11 00:00:00
素烧饼有要的吗,日本福岛第一核电站反应堆厂房上方发现严重污染据日本放送协会NHK3月10日报道日本原子力规制委员会10日公布的一份福岛第一核电站事故调查报告显示因在反应堆厂房上方发现严重污染今后需就反应堆报废工作与东京电力公司进行研讨原子力规制委员会从两年前开始以辐射量下降的地点为中心重启对福岛第一核电站事故的调查于10日发布调查报告报告显示新发现在位于二号机组和三号机组厂房上方被称为屏蔽塞的混凝土盖子上可能共附着有7万万亿贝克勒尔的放射性物质相当于在十年前核泄漏事故中曾发生堆芯熔毁的一二三号机组三座反应堆内放射性物质的10原子力规制委员会认为该污染严重程度远超预期即使在报废反应堆过程中需要拆除屏蔽塞也极难实现在安全前提下让人员靠近施工现场进行操作原子力规制委员会将就如何防辐射等今后的反应堆报废实施方法与东京电力公司进行商讨此外为保护反应堆安全壳一号机组和三号机组曾尝试将安全壳内部的气体排出调查发现部分气体通过管道倒流进厂房可能是造成厂房内污染扩散的主要原因同时可能因倒流气体中含有氢气导致发生氢气爆炸今后相关方面需对设备进行进一步验证研究人员通过分析氢气爆炸发生时的录像资料进行了首次详细验证指出三号机组在发生第一次爆炸后可能还因混入了氢气以外的其他可燃性气体而连续发生爆炸性燃烧原子力规制委员会表示今后还将继续开展相关调查央视新闻收起全文d,2021-03-10 21:10:00
全欣鑫,五岳散人至少也算是挣到了钱没有挣到钱也去了日本的例如性感玉米不知代购生意还做得动不,2021-04-18 00:00:00
halvess,High_ghil回复一起去流浪_zyx丢脸都她妈丢国外去了你不知道日本人看笑话说啥我看你真的是追星追傻了多读点书看点实时给国丢脸还没做错什么真是一个疯批养一群疯批你还这么脱颖而出哇唧唧哇倒毙了让任桑和他的nt粉丝先把这些泄露的核废水喝掉R1SE任豪,2021-05-17 01:00:00
知乎用户,美国当然不会反对啊毕竟小日本离我们最近啊,2021-04-12 00:00:00
蹦极的长颈鹿,中国不会死的顶多来一次世界核平,2021-04-14 00:00:00
股市女人,捞上来的鱼都辐射超标更何况那个核废水了排到海里只会污染整个太平洋日本19日宣布因被检测出放射性物质超标福岛县海域黑鲉被禁止上市本月1日在距福岛县南相马市13公里的37米水深处捕捞的一条黑鲉体内被检,2021-04-21 00:00:00
财商视野全解,日本将排放福岛核废水A股这个板块严重异动在日本将排放核废水的影响下A股水产板块今日再度爆发截至收盘Wind水产指数上涨926板块内国联水产涨20好当家财商视野全解2天前,2021-05-25 00:00:00
歪男,当日本人对你说麻烦你了别觉得他们是礼貌他们真的会麻烦你,2021-04-13 00:00:00
慕强椰椰嘻嘻,香薰脆饼关于我作为小事儿磕壶酒吧一定要嘴遍8粉圈那档事隔壁首相秘书们太过可爱怎么办qi7椰会说多说点星球失速脱轨论核废水怎么喝不会变成哥斯拉,2021-05-14 20:01:00
乐呵2222222,全球155亿人面临重度粮食不安全倒牛奶吧再不行就倒核废水2广州京溪,2021-05-06 08:25:00
青和的小宝箱,这篇回答我老感觉有一部分有点问题米国小弟韩国和有一部分国家还是发声了的总感觉没有数据的分析有很多不合理的地方文章我赞同不反对但是有些观点我想看看数据,2021-04-17 00:00:00
木羽,一问就是后悔一劝就是不回,2021-04-21 00:00:00
麦莎,氢弹不可能能减少核废料但是至于往那边扔氢弹我双手赞成,2021-04-14 00:00:00
星环视角,日本核废水57天废掉太平洋同样会祸害美国西方选择性忽视此前德国海洋机构的一种电脑模拟结果显示在57天时间内太平洋大半区域中的核废水将受到放射性物质扩散的影响3年后核废水就将影响到北美地区最,2021-04-16 00:00:00
马关ty1895,致敬每一位不平凡的中国人我爱你中国我和我的祖国实干兴邦我们都是奋斗者只争朝夕不负韶华幸福都是奋斗出来的教师队伍建设健康中国日本福岛核污水可能损害人类dna美国发展史就是一部印第安人血泪史西方民主是屎坑中国去年输出国际移民超千万我国单身成年人口24亿人2020年注定是中国历史上不平凡的一年这是脱贫攻坚的决胜之年这是十三五规划收官之年中国人千年期盼的全面小康社会正迎面走来然而前进的道路总是充满坎坷新冠肺炎O致敬每一位不平凡的中国人收起全文d,2021-01-02 16:43:00
董晓,说点和自己生活有关的吧要不要屯盐啊,2021-04-14 00:00:00
奥尔加先辈,沈逸老师说的话但凡在这个问题上保持沉默的所谓环保组织就是靠着环保吃饭的组织而不是真正关心环保问题的,2021-04-14 00:00:00
啷个哩个啷,核弹太多了维护太费钱了我觉得我们需要把二次打击做好就能够保持威慑了像俄罗斯核潜艇破冰上浮威慑可太大了,2021-04-14 00:00:00
万能人物,现在就算强大但强大与否跟正义与否没有直接联系,2021-04-12 00:00:00
女高中生罗琳,哈哈哈哈哈哈哈哈哈评论都太好笑了哈哈哈哈哈哈哈哈哈哈哈故梦承欢吴亦凡真晦气榊榊超帅气核废水喝一吨都到不了那程度乌裳待雨不合适不合适吴亦凡的长相得基因变异成什么样才能生出哈人啊,2021-05-19 16:53:00
我的名字叫刘淼,巨恶心的国家,2021-04-12 00:00:00
旅游咨询师,这个创意好啊,2021-04-22 00:00:00
宝贝ANN2015,福岛核废水57天可废掉半个太平洋联合国的作用不大吗任由日本胡作非为,2021-04-13 23:50:00
开视界,美国缘何感谢日本排放核废水因为它一直偷偷干还想公开这么干从排放之日起57天内放射性物质将扩散至太平洋大半区域10年后蔓延全球海域绿色和平组织核专家指出日核废水所含碳14在开视界2021414,2021-04-14 00:00:00
飞机耳懵妹,估计就是那个核废水导致的,2021-05-01 22:33:00
偏分草泥马,老高高相奎日本的说辞有严重的逻辑矛盾还有精日说国际组织建议日本排放大海是撒谎国际原子能组织官网内容是日本向IAEA提供了福岛核废水信息按照日本给的数据符合TEPCO的标准乍一看好像是符合国际标准TEPCO是什么TEPCO就是东京电力这就是日本自己按照自己的标准测的数据和报告,2021-04-11 22:59:00
卡卡卡卡西西大人,我们也可以把核废料倒进大西洋大家一起完成全人类的免疫事业,2021-04-13 00:00:00
Kay0916,所以说要多读书,2021-05-17 00:00:00
CUTHERE,冈本可还行,2021-05-01 00:00:00
红星闪闪的溜达是dolphin,快到饭点需要琢磨吃什么的时候想吃蒜蓉蒸生蚝白灼鱿鱼须一想到日本核废水赶紧劝退想去菜市场自己买菜做饭又觉得身体好累不想动尤其厌恶洗碗劝退想吃香辣的湘菜川菜最近胃不太好劝退结果我现在来吃云吞,2021-05-06 11:14:00
瑞士任,帝吧官微估计日本几年前就开始偷偷往太平洋里排核废水了,2021-04-11 20:37:00
土工材料生产代加工,在福岛核废水附近海域建造一座边滩水库用以储存核废水边滩水库围堤可以采用吹泥管袋方案直接从海中吸泥入袋泌水固结后成堤库内侧铺复合防渗土工膜封底封坡然后排入核废水库内可建若干隔堤根据核废水排放计划分期排入达到衰减周期后再排入大海这样核废水就可以在日本家门口自行消化因为他们说没啥污染风险了也许有少量渗漏但与全部排入大海比浓度就小的多了本方案的关键是在海里做水库不影响他们的陆域使用核废水排入后在表面设置轻质浮动盖板密封下雨的雨水可以通过设在围堤上的排水孔排入太平洋收起全文d,2021-05-19 08:36:00
謙愚,這次事件的唯一問題在於多覈素移除裝置是否可靠在祇剩下氫同位素的情況下排放也不會造成什麼影響但是萬一覈素分離不完全那就不好說了最穩妥的做法是建設儲水罐等待冷卻水自然衰變膽肥的話乾脆用計算好當量的氫彈引爆也可以,2021-04-13 00:00:00
Win10正在更新,行啦赛前赛后核废水骂c就是退国籍,2021-05-17 20:15:00
前田敦茄,霓虹饭怪不得日本排放核废水第一波就要正面承受的美国西海岸环保组织不放屁原来自己就在这么干呢秀非Laevatain因为我自己就这么干所以我当然同意自己家的狗也这么干,2021-04-13 23:53:00
延吉新闻网,日本倒核废水她装死提到中国倒支棱起来了O日本倒核废水她装死提到中国倒支棱起来了,2021-05-10 09:00:00
盆一锅,核废水ggcw,2021-02-18 21:53:00
小错误,为什么太宰治能够出名一种浓缩形象不觉得太japan范了吗过于任性了好像体现出来了又傲慢又无能又任性的感觉给别人造成麻烦也无所谓的厚脸皮功能,2021-04-10 00:00:00
闲雲野鹤,日本真是反人类,2021-04-14 00:00:00
岚烽,氢弹烧一下就好了嘛毛子的提议就很有效,2021-04-15 00:00:00
陈思王,好多戏,2021-05-15 00:00:00
泥腿看客,日本要向太平洋倾倒核废水西方闭声了美国为何还支持近期日本向大海排放核废水一事成为网络热点毕竟这是关乎沿海国家民众生命健康和安全的大事因此高度关注很正常如果不关注就不正常了中国和韩国,2021-04-19 00:00:00
LoKiala,自信点把估计去了偷国人早就掌握他们偷排核废水的证据了早前油管上都炸天的了而且有板有眼应该是掌握了大量事实证据的帝吧官微估计日本几年前就开始偷偷往太平洋里排核废水了,2021-04-11 20:40:00
yehuu133,日本要当氢弹第一人,2021-04-20 00:00:00
窗户朝太阳,公知们该出来洗地了,2021-04-13 00:00:00
一号哨所,日本排放核废水印度网友加入骂战我敢喝恒河水你喝核废水吗近来因为日本无视多国反对公然将多年无法解决的核废水排放到海洋之中引起了全球互联网的关注最开始还是周边几个国家一号哨所2021415,2021-04-15 00:00:00
空山鸟语v,很可能早就偷偷摸摸暗地里在往其他地方转移和排泄了只是媒体没有曝光而已只有等哪一天实在是瞒不住了才逼不得已强行狡辩有人看过海豚湾这部纪录片吗,2021-04-10 00:00:00
安农大轻纺工程与艺术学院团委,核污染危害核污染核辐射是非常严重的一种现象辐射是放射性物质通过微利或者放射的形式发出来的一种能量如果人体受到辐射性的伤害安农大轻纺工程与艺术学院团委202153,2021-05-03 00:00:00
18048858692Tel,发布了头条文章上海智蚁理财正规吗能追回吗能退吗老师带单合法吗被骗了股票被骗的经历现货交易黄金超话骗局防骗套路房地产房产股票超话房产微博日本福岛核废水排海借势炒作股票百度快照顾问追损白银超话现货交易黄金超话你有哪些被骗的经历O上海智蚁理财正规吗能追回吗能退吗老师带单合法吗被骗了收起全文d,2021-05-01 11:59:00
七里辰光,有当然有就是费钱有5种方案呢这是TM最省钱的方案,2021-04-14 00:00:00
志斌课堂,坚决反对日本排放核废水日本排放核废水的事排放的废水肯定是达标的这是由国际原子能机构批准的全世界那么多媒体盯着需要注意的是达标达的是发志斌课堂2021413,2021-04-13 00:00:00
第一财经,日本核污染水背后有哪些信息黑洞日本政府日前决定将福岛第一核电站事故处理产生的上百万吨核污染水排入大海这一史无前例的举动引发世人广泛担忧日本当第一财经2021421,2021-04-21 00:00:00
言和今天更可爱了,这玩意要是真排入太平洋以后日本农产品水产品食品会在世界市场上绝迹寿司销量可能都得腰斩,2021-04-15 00:00:00
喜鹊深树鸣,真的很烦了住在东海边上一会担心日本倒核废水一会儿担心福建引进台毒就是要把我们整死干脆拼了吧真的大家抱着一起死,2021-05-02 16:39:00
原非纨,一起喝核废水来一杯冰阔乐吗真双向奔赴M大王叫我来巡山好一个双向奔赴真十内只要胆子大朝辞夏双向奔赴感人啊,2021-05-09 14:36:00
罗斯林的轻语,日本人的脑回路确实是与众不同初看起来彬彬有礼但经常干些既啥又啥的事人性中的黑暗的一面其实与民族和国家无关但是不愿意面对和没有担当是会持续放大问题,2021-04-14 00:00:00
资本侦探,日本核废水还没倒A股先起飞了资本侦探原创作者郭瑞灵尽管面对种种争议日本政府还是做出了将核废水排入大海的决定在4月13日的内阁会议上日本首资本侦探2021413,2021-04-13 00:00:00
班中红花88395,日本政府基本决定将福岛核污水排入大海2杭州,2021-04-10 16:38:00
虚无缥缈的梦,大不了鞠躬弧度大一点,2021-04-13 00:00:00
天之馥,我就想知道那个瑞典女孩呢那个环境守护大使呢快出来骂几句啊姑娘,2021-04-14 00:00:00
临汾美食君,日本137万吨核废水将如何处理核废水处理之困距离日本311大地震10周年这场日本地震记录史上震级最高的一次地震引发了继切尔诺贝利核事故之后最严重的核泄漏事件眼下核废水储存空间即将饱和137万吨核废水将何去何从尽管过去了十年时间核废水处理问题仍未得到妥善解决其间关于日本政府要将核废水排入太平洋的论调多次出现引发当地居民及周边国家对海洋污染的担忧洞见计划O日本311大地震十年核废水处理之困收起全文d,2021-03-14 15:32:00
爱上_cheesecake,日本73级强震或为2011年大地震余震昨晚日本发生73级强震据日媒地震已造成福岛县宫城县等地超100人受伤福岛第二核电站的一号机组用以保存核燃料的冷却水发生轻微泄漏但辐射量很低日本气象厅认为这次地震可能是2011年311大地震的余震近期仍可能发生强震L央视新闻的微博视频收起全文d,2021-02-14 07:49:00
点点滴滴,可是这一把日本都把shi拉他们头上了他们还搁那叫好看不懂啊,2021-04-13 00:00:00
淨墨燕子,赵盛烨凭我对日本人的了解一味强调氚目的是掩饰其它放射物就像珍珠港那样明修栈道暗渡陈仓战略安全与军控在线日本福岛核废水中不仅含氚而且还含62种金属放射性同位素它们存在时间长有化学毒性此外废水中的碳14半衰期为5700年,2021-05-03 09:17:00
服装定制Sophie,新华国际时评排放核废水入海日方不可一意孤行O网页链接,2021-04-13 23:58:00
目前是单QAQ眼皮,日本是一个病态的国家没有什么他们不敢做的,2021-04-14 00:00:00
Xray killer (作者) ,台湾其实早就在考虑了可以实现核子群体免疫顺便实现生殖隔离,2021-04-14 00:00:00
辉仔,貌似污染不到熊大的水域要是熊大能给福岛来个大伊万就好了,2021-04-12 00:00:00
RUNNING,大核名族的劣根性,2021-04-16 00:00:00
我不是果子哥哥,福岛核电站储水罐已多次泄漏我就拍完了现在就找个借口什么醒了咋就把这个废水排完了现在有个理由戏弄了泄露了2重庆,2021-05-17 08:49:00
少有人走的路,禽兽就是禽兽,2021-04-13 00:00:00
电影DJ蛋神,反对一切浪费何止是粮食很快饮用水资源也要警惕了你看最近发现日本东京饮用水检验出放射性物质还有日本政府正式决定福岛核废水排海的威胁台湾省干旱或许要输水到中国台湾今天起自己家里的洗菜水都要二次利用节省水资源就是救人救己,2021-05-07 08:17:00
顶级毛豆圣代,艹好可爱的漫画賣羊肉的咩咩咩早早就预言了核废水导致的海洋生物变异是神作没错,2021-05-12 08:51:00
「已注销」,起码第六条我就想骂人且不说那个十年以后是否科学问题是这十年内怎么办咱们都被动辐射十年先我可不想在若干年后在祖国见到因辐射造成的各种稀奇古怪生物自己家人以后因为这些得稀奇古怪的怪病切尔诺贝利那个我之前还挺愤怒北极熊官僚主义啊前期隐瞒啊啥的没想到啊两脚兽居然能无耻到如此地步没有最坏只有更坏一次次不断刷新下限现在看来苏联之前的做法已经算是够不错够负责任的了俄罗斯方案就是好一颗已经不够了起码要十颗做个罩子砸锅卖铁咱们做罩子把那几个岛罩起来然后往里扔氢弹十颗起步好了世界清净了大家都方便,2021-04-15 00:00:00
我好想取一个中二的名字,我参与了鍋盖頭司令发起的投票你觉得日本应该为核废水排泄赔偿么我投给了应该这个选项你也快来表态吧,2021-05-17 00:45:00
启航1949,观察风险话语与规则福岛核废水排放事件的另一个视角另一方面则抓住目前国际法领域尚无直接规制排放核废水的有关条约法律规则的空白期用国家实践和盟国的外交支持造成排放而不启航19492021415,2021-04-15 00:00:00
我的山茶树,福岛核电站4000个废弃物集装箱信息不明我特么疯了整个人焦虑13号开始排放核废水怎么关注的人都不多啊没看到有国际上的反对我感觉我快死了还能活到老死吗毁灭吧烦了,2021-04-11 20:47:00
云渊sytswei,抛开情绪冷静谈谈日本将核废水排入海中一事这种问题一句话就堵死精日的嘴了处理这么干净的水为什么不直接当工业或生活用水反正一百多万吨很快就用光了,2021-04-15 00:00:00
木易子旭,大自然对福岛排放核废水的第一次惩罚开始了地震下一次惩罚福岛就是海啸了,2021-05-14 09:06:00
黑兔81192,总有沙币说福岛核废水无害既然无害日本鬼子为什么自己不喝下去非要往海里倒呢,2021-04-10 17:21:00
静谧中流逝年华,回复lunahhi母蛙好好享受岛蛙目前的绿娃时代不是不是吃死就是撞死哈哈哈哈哈lunahhi回复静谧中流逝年华也就你这台蛙和鬼子的狗杂种才是在这里呱呱呱叫吧回你井里喝你鬼子野爹家的核废水吧搜破曼这些鬼子和青蛙真是讲笑话的高手,2021-04-10 14:54:00
yangguangbuxiua,日本地震灾区将迎狂风暴雨两眼一抹黑日本又可以偷偷排放核废水了,2021-02-15 18:37:00
啥都不是,不要混淆概念也不要把事情搞那么复杂作者很有带节奏的嫌疑请明确表达你对日本排污的态度支持还是反对另外这是日本人排放而不是咱们排放不要什么都往我们身上扯ok,2021-04-15 00:00:00
亲一口懒虫虫就跑的海燕,通贝里还挺会怼人2019年联合国气候峰会上通贝里批评各国领袖对全球暖化问题上空口讲白话著名的howdareyou就是那时候来的而当时特朗普发推特暗讽她怒气冲冲的样子说她看来像一位非常快乐的少女期待一个光明美好的未来很高兴看到图1结果1月20日特朗普卸时通贝里发条推特嘲讽了回去他看来像一位非常快乐的老人期待一个光明美好的未来很高兴看到图2不止这些这两天拜登上台后重返巴黎气候协定刚被我国宣布制裁的共和党参议员克鲁兹自然是反对他在推特上说重返巴黎气候协定显示出总统拜登重视巴黎人胜过匹兹堡人的工作机会这项协定对改善气候问题只是杯水车薪却会损害美国人的生计图3于是通贝里又在推特上阴阳怪气了一番说真高兴美国重返匹兹堡协定欢迎回来她故意把巴黎气候协定说成匹兹堡协定收起全文d,2021-01-22 17:47:00
邵永灵,日本核污水排入大海影响有多大一国倒霉全世界买单日本政府或铸成历史大错日前日本政府发布公告称已决定将福岛核电站的核废水排放到大海中两年后将开始这一计划其特地提到一点即这些经过处理后的核废水已经不具备明显的放射性也不含有,2021-04-12 00:00:00
知乎用户,既然能喝那就好办了做成桶装水日本国内一人发10升完美解决问题,2021-04-19 00:00:00
Litchiham,应该先研究氚残留对人体的危害以及是否净化完毕再下结论,2021-05-04 00:00:00
热点时局,白宫为自己开脱日本排放核污水后美海岸发现27万个毒桶在日本曝出排放核污水后有媒体披露在美国海岸发现27万个毒桶这些可能装有有毒化学品DDT的废弃桶从外表观察热点时局202156,2021-05-06 00:00:00
柳晓,环团反对是什么意思,2021-04-12 00:00:00
Kunda,我有一个不成熟的想法台独不是很精日吗现在台湾也很缺水直接运到台湾不是很好吃莱猪饮废水,2021-04-17 00:00:00
