author,content,time
软0小严其实是0点5,StarryNightForYou韩国有骨气偷我们这么多东西文化遗产日本人有礼德核废水给你排水里我中华泱泱五千年从来都不屈不挠哪里被压迫哪里挺起脊梁承认我们自己民族确实很优秀很难吗很难吗在我心里我中华民族就是优秀_苔上_韩国是做的对但也不必吹捧为有,2021-04-13 23:57:00
xxby,只不过是资本的傀儡罢了,2021-04-18 00:00:00
长命百岁,劝酒词都出来了,2021-04-18 00:00:00
狙击手伍德,日本修改震级为73级日本强震震动福岛百万吨核污水O日本强震震动福岛百万吨核污水,2021-02-15 00:14:00
LittleDuckYo,现在知道为啥美国政府会对tiktok下狠手了吧因为googleYouTubeFacebookTW这一众货色都是美国资本控制住的连最贴心的走狗之一土澳想坐地起价都照敲不误,2021-04-12 00:00:00
财经杂志,日本排放福岛核废水决定触犯众怒美国政府力挺不过由于排放计划将在两年后才开始执行反对核废水排放的公民团体和环保团体计划联合日本周边国家在日本国内外提起诉讼财经杂志2021413,2021-04-13 00:00:00
用户6134128655,分享网易新闻排入大海不核废水还可以这样处理O排入大海不核废水还可以这样处理来自网易新闻客户端网易新闻,2021-05-07 07:21:00
三三,还能有6就nm离谱儿命拔要辣,2021-04-20 00:00:00
Miyaaaaaaaa竹付,牛壮壮wuu排放了核废水哪还能看的到了,2021-05-06 11:07:00
elljjjhkk,鱼和水产是到处游的海水都连着的你能不让水和鱼游过来啊,2021-04-12 00:00:00
「已注销」,没有美国的默许日本敢排小国家不敢得罪这两国至于韩国也是死骂日本,2021-04-13 00:00:00
木木的世界,美国人也不傻西方主流媒体没有报但有报道的媒体下面都是骂声一片,2021-04-15 00:00:00
「已注销」,毕竟是日本天皇肯定是经过他首肯的,2021-04-14 00:00:00
丑国驻华大便馆,你们的精神母国很不堪啊樊建川地瓜_N号简单按网上查询到的数据做了个计算福岛核废水137万吨体积约合13立方公里太平洋海水估算70710万立方公里核废水按含1放射性物质计算混合均匀后太平洋中放射性物质增加131011作为参考香蕉中放射性钾的含量大约是25105,2021-04-10 19:40:00
嘿摸你穷,直接用氢弹把福岛炸干净,2021-04-10 00:00:00
追损小分队,发布了头条文章锐联资本赵焱唐浩然机构通道打新被骗不能提现如何追回损失骗局日本政府正式决定福岛核废水排海O锐联资本赵焱唐浩然机构通道打新被骗不能提现如何追回损失骗局,2021-04-13 23:52:00
风落一地猫,微博辟谣给日本核废水洗白,2021-05-19 13:49:00
晓风残月,所以说也许真理真的永远在少数人手中支持答主,2021-04-15 00:00:00
嗨翻兰州,核废水处理之困日本137万吨核废水将如何处理距离日本311大地震10周年这场日本地震记录史上震级最高的一次地震引发了继切尔诺贝利核事故之后最严重的核泄漏事件眼下核废水储存空间即将饱和137万吨核废水将何去何从尽管过去了十年时间核废水处理问题仍未得到妥善解决其间关于日本政府要将核废水排入太平洋的论调多次出现引发当地居民及周边国家对海洋污染的担忧洞见计划O日本311大地震十年核废水处理之困收起全文d,2021-03-11 23:28:00
愉城雅道,环保少女道德绑架中国对中国环保少女开始道德绑架了Archangel96环保政治乌合麒麟任何世界性质的环保机构只要是对日本核废水不闻不问却跑来指责中国环保问题的都是打压中国的政治工具当放屁就行,2021-05-10 02:36:00
李美娴6868,有5种处理核废水的方式日本选择了对人类伤害最大的方式排污入海就是反人类日本终将被钉在历史的耻辱柱上穷游旅行家最早的时候因为不想报废反应堆错过了最佳的救援时机现在废料桶快装满了又嫌土地贵不愿意新建储存桶就想直接排进大海让全世界帮你一起买单,2021-05-13 19:17:00
Chocological,本来还挺慌一听说可能排完了就没啥想法了,2021-04-12 00:00:00
柏舟20202019,迷惑评论核废水文化,2021-01-22 19:28:00
Cliff-H,绝大多数人对于这个世界正在发生的一切是不关心的他们只关心眼前的苟且这使得内外的政策和计划得以顺利推行就拿日本核废水排海这事来说绝大多数人已经忘记了还有这回事也不关心有没有这回事几年后海鲜该吃还是吃日本核废水排海将会推进的非常顺利,2021-05-15 09:12:00
孟墨,看了半天你的论证日本排核废水还是有问题再看你一开始的表态对日本的检测结果持乐观态度能相信日本看来还是立场问题嘛看来之前日本辛辛苦苦攒下的先验在你眼中不值一提当然也不违法你开心就好数据可能是真的但解释不一定是真的毕竟立场也不一定是对吧是吧,2021-04-14 00:00:00
知乎用户,澳大利亚沙漠无人区深埋,2021-04-14 00:00:00
蓝天62347,日本核废水排入海洋太平洋灰鲸正在大规模死亡这仅是巧合吗不仅如此还有一个令人惋惜的悲剧也在发生那就是太平洋出现了灰鲸大量死亡的情况日本核废水排入海洋太平洋灰鲸正在大规模死亡这仅是巧合吗O网页链接,2021-05-15 21:57:00
饮水机富硒,建议你看下沈逸老师的最新期逸语道破看完你就知道IAEA有没同意了,2021-04-16 00:00:00
小菊花课堂,我之前认为中国应该对日本威慑开战这也没办法的不这样根本解决不了问题,2021-04-22 00:00:00
正商参考,日本正式排核废水入海多国反对美国却支持加感谢今年4月13日日本政府召开相关阁僚会议正式决定将东京电力公司福岛第一核电站内持续增加的核废水排放入海日本首相菅义伟正商参考2021414,2021-04-14 00:00:00
城郊街道,日本倒核废水她装死提到中国倒支棱起来了O日本倒核废水她装死提到中国倒支棱起来了2榆树市,2021-05-09 18:34:00
般吉,我比较喜欢就事论事只探讨NHK的行为不做诛心之论,2021-04-30 00:00:00
pkut,日本终于拥有使用核武器的权利并且率先对大洋彼岸的美国进行了投放,2021-04-15 00:00:00
埃及一朵花,分享一句李敖说的话富兰克林说哪里有自由哪里就是我的祖国但是我不是这样我是这是我的祖国我要让她自由我认为自由也可以换成另外美好的词语,2021-04-13 00:00:00
伍吴列,你等着这就给你念300遍不干涉内政,2021-04-17 00:00:00
保险经纪 不知君,当看一场戏吧你看欧洲五眼联盟那些根本不表态美国来煽风点火欧洲那边大体知道是场闹剧所以无所谓毕竟就为了疫苗这事他们已经自顾不暇对于美国和欧洲巴不得亚洲地区越乱越好咱们小老百姓相信党相信中国政府就好咱们政府代表的是人民遵循的是客观规律作为中国人外交大事安心听党指挥就好,2021-04-17 00:00:00
Editline7,Quora上关于日本核废水的几个问题都仅有两三个回答观点基本都是太平洋那么大稀释后没有任何影响的,2021-04-12 00:00:00
猎魔杀手克格勃,想起来还有硬洗的都在偷偷做呢太坏了,2021-04-10 00:00:00
乌鸦校尉,喝了也不能证明核废水安全所以没必要喝世卫组织欧洲办事处敦促各国继续使用阿斯利康6名美参议员反对立法保护亚裔丨每日大新闻核废水辐射值低于世卫组织的饮用水标准不意味着就安全4月13日日本政府悍然决定将福岛第一核电站核废水排放入海此举遭乌鸦校尉2021416,2021-04-16 00:00:00
垄断毒瘤必须死,明天来uc,2021-04-28 00:00:00
水鱼,张宏圣好图共欣赏查看图片Esports海涛选择性眼瞎真是小丑一只乌合麒麟任何世界性质的环保机构只要是对日本核废水不闻不问却跑来指责中国环保问题的都是打压中国的政治工具当放屁就行,2021-05-09 12:31:00
土耳其半熟蛋,九敏啊好想吃薯条三兄弟核废水应该不会影响到薯条三兄弟吧,2021-05-13 19:59:00
蓝蓝,其实我有个问题就是为什么没有一个国家出来正告日本如果这么做就是与全人类为敌威胁他纯属猜想别喷,2021-04-10 00:00:00
环球网,日本核废水入海影响到底有多大多国联合研究团队这样评估如果日本排放核废水入海后放射性物质在海洋中将通过三种方式传播乔方利告诉记者联合团队迅速建立了核污染传播的海洋数值模式对福岛核废水的,2021-05-26 22:40:00
知乎用户,你想的太简单了你一般人在这些平台发图这些平台会把你连人带画一起夹了信不信但是有国家外交撑着的赵立坚发的话平台反而投鼠忌器不能想夹就夹而且传播效果点满百利无一害,2021-04-28 00:00:00
日日就日日,愿以此两只狗命换失踪的2亿人平安,2021-02-14 17:07:00
知乎用户 (作者) ,方案都没公开我怎么知道监管审核有什么机制有没有问题,2021-04-14 00:00:00
有闲斋,所谓环保少女只是一个西方政客抹黑中国的提线木偶她的主子不发话她屁都不敢放一个,2021-04-15 00:00:00
知乎用户 (作者) ,首先要在联合国提案抵制联合俄罗斯对日本进行核弹威胁一旦核废水倒入大海就进行必要的核打击将福岛核电厂强制爆破,2021-04-12 00:00:00
ooshhh_x-light,哇唧唧哇INTO1官博Wpg皮下能不能滚去日本喝核废水中国装不下你们这种日本舔狗,2021-05-14 00:39:00
水力水力水,已经开始有意识地不买日本货了理由很简单日本要排核废水毁灭地球阿迪和耐克以前就不买家里只有一双耐克运动鞋,2021-05-06 23:09:00
Ricky,突然有个想法核污染的气溶胶结合了sarsmars病毒变异新冠病毒脑洞是不是有点大,2021-04-10 00:00:00
开心的话可以叫我圆圆,重大失误东京漏报838例新冠确诊病例日本东京都政府15日称因当地多所从事收集病例数据的卫生机构保健所出现忘记按下数据收集系统的确认键和未成功发送传真等工作失误导致东京都的疫情数据在2020年11月18日至2021年1月31日期间出现漏报累计漏报确诊达838例针对出现工作失误的原因东京都政府表示是感染者激增导致保健所工作负荷增大所致中国新闻网收起全文d,2021-02-15 20:19:00
知乎用户,我们对各种突发事件预警和监测的响应都能做到比较及时且充分,2021-04-14 00:00:00
大白兔白不白,我觉得这是个噱头最终目的是威胁国际社会出钱解决尤其是中国,2021-04-14 00:00:00
宋小咩咩Forever,嗯嗯他们忙着建罩子喝废水我们演员粉和他们吵很掉价Loveu4seasons支持过季玫瑰不打折嗯嗯她们喝她们的核废水我们搞我们的演员本质不一样捏,2021-05-08 20:28:00
Elodie,为什么要骂那种人的老婆她们最多是瞎子但是他们才是人渣,2021-04-14 00:00:00
朝暮外刊学习笔记,日本决定排放核废水经济学人但他们担心核排放会进一步损害在行业的名声这句话句子结构要注意struggletodosth努力做某事taintv败坏名声catch做名词表朝暮外刊学习笔记2021417,2021-04-17 00:00:00
维特,东京奥运会还需要抵制我总感觉他开不成,2021-04-12 00:00:00
美少女德纲_Jessica,恒河水治不了新冠但核废水可以,2021-05-15 14:09:00
爱吃辣条的小姐姐,那好吧那我就不用囤盐和水了,2021-04-13 00:00:00
用户7607347891,日本倒核废水她装死提到中国倒支棱起来了O日本倒核废水她装死提到中国倒支棱起来了,2021-05-10 14:20:00
白鲸影视,日本排放核污染水第一个倒霉的就是美国欧美媒体集体沉默不语最近一段时间有关日本核污水排放的相关话题得到了全球各界的关注因为我们知道的是日本自身由于化石燃料等能源产品的匮乏白鲸影视2021414,2021-04-14 00:00:00
知乎用户,摆数据是好事但是那些赞同答主的人真的有好好看答主发的数据吗你赞同答主只要张张嘴反驳答主就要看懂数据注意是看懂而不仅仅是看见这个门槛差异也太大了而且答主并没有对数据作出解释只是单纯地展示然后说氚是公认的弱鸡为什么呢我不是核专业的我不能理解为什么氚是弱鸡所以我提出疑问也是正常行为吧那些赞同答主的骂其他人是战狼的用户们能解说一下为什么吗我是真的不知道啊评论说什么知乎遗风结果还不是没有解答疑问一堆没有解析的数据对于一个想要知道真实情况的普通人有什么用呢数据不是目的解答问题才是目的,2021-04-11 00:00:00
LaniaKeaaa,建议日本开火箭把这东西运水星去,2021-04-14 00:00:00
浮夸200908,日本倒核废水她装死提到中国倒支棱起来了O日本倒核废水她装死提到中国倒支棱起来了,2021-05-11 10:53:00
6月的海2月的风,倭国还是去关心毛子的北方四岛吧且大东亚共荣圈rcep已经由东方巨龙实现倭奴只会痴心妄想还是八路牛啊龙国不战而屈人之兵这才是大国风范倭奴之国重小礼而缺大德最终被全亚洲和全世界人鄙视被扔核弹仍不知悔改又现福岛核泄漏更加隐瞒真相预排核污水入太平洋祸害世界,2021-03-13 22:59:00
小狗鸭哒纪念册,别和锦衣玉食的两位贴了人家有公司多丝只有核废水,2021-05-15 23:58:00
蓝领,你有大量的如果可能你觉得这样的结论可靠吗如果不可靠为什么你支持排放,2021-04-14 00:00:00
传习录LSJ,来世还在种花家感恩生于中华下午又一次地震日本啊抱歉我不该高兴的这么做不对的幸亏只是心里高兴没笑出来要不我真的太坏了又是福岛啊感恩中华来世还在种花家会不会日本趁着这次地震故意倒掉核废水啊要警惕啊,2021-02-14 15:48:00
知乎用户,这个似乎是氢弹,2021-04-14 00:00:00
淡淡烟草香LR,日本71级地震我猜鬼子过几天又该趁机甩锅说之前核电站的废水由于地震泄露到海里了这话先放这里等后续,2021-02-14 06:42:00
海雕行天下,上证近期持续性反弹后突破短期颈线但是量能萎缩反弹迹象明显而叠加当下市场高位抱团白马打压指数低位热点轮动出现退潮预期指数短线需要警惕再次走低的可能且最差情况可能是反弹的终结盘面上次新虽然出现退潮但是依旧是最大热点低位股的补涨共振叠加部分高标股的强势但是随着亏钱效应的扩散该方向需要谨慎碳中和继续炒作个股轮动电力板块个股机会较多海南板块叠加五一旅游概念关注旅游板块能否启动医美短期升温市场情绪炒作到辅助生殖和二胎关注持续性周末核废水情绪升温关注淡水鱼养殖收起全文d,2021-04-11 22:26:00
lipengfei,都是幌子,2021-04-13 00:00:00
鱼丸滚滚滚,鲁艺兵美国支持日本往海洋倒核污染废水原来他们早就做过了,2021-05-07 12:49:00
Fans1st,日本人是有史以来我见过的最卑鄙最无耻的民族富兰克林罗斯福以及我们,2021-04-14 00:00:00
韩俊杰主任,疫情此起彼伏抗疫之路任重道远这是病毒对于人类错误行为的一次巨大惩罚也是对人类提出的一个重大警醒如果我们还不能从中吸取教训未来就无法想象然而就在这样一个时间节点日本人这帮狗日的还正在向大海里面排放核废水照这样的状态下去我们的地球还能让我们生存多少年,2021-05-18 17:28:00
咸鱼一条,喝了还是得流入自然环境中还是固化做成砖发给每个日本人放在家里保存吧,2021-04-15 00:00:00
东方旭,嗯他说自己很爱福寿螺三分熟的牛排,2021-04-22 00:00:00
知乎用户,这事真的无解了吗我们只能抗议,2021-04-13 00:00:00
李奔波儿灞大喵,任豪没有人比R1SE更爱R1SE没有人比任桑更爱核废水,2021-05-02 22:21:00
华夏源干细胞,最深度丨日本将核污染水排入大海会对普通人产生什么样的影响核污染所带来的阴影从战争年代到今天一直萦绕在人们心头所以当日本政府打算将数百万吨核污染水排放到太平洋时立刻遭到华夏源干细胞2021422,2021-04-22 00:00:00
不上复旦我是狗,我靠你是同济的我更爱你了么么哒,2021-04-13 00:00:00
太阳骑士233,酸辣粉大人笑死人了一边排核废水进太平洋祸害全人类一边敦促别人承担气候问题的责任哪来的脸啊,2021-04-10 13:17:00
知乎用户,没错感觉他是个二鬼子咬文嚼字非说饮用水源,2021-05-04 00:00:00
方先觉,哪个人才走露了风声排了这么久都好端端突然上热搜,2021-04-13 00:00:00
知乎用户,企业级工匠精神,2021-04-13 00:00:00
娱乐站,陈子亦怪不得同意日本排放核废水搁这玩哥俩好呢,2021-04-27 23:56:00
fenflei0596,为啥不给日宣喝为什么不给日宣喝,2021-04-21 00:00:00
想帅帅地度过一生,对不起你的通篇回答我看的一头雾水表示这也配高赞另外我想问问为啥以前经常见的环保机构和环保少女还有什么乱七八糟的组织都哪里去了,2021-04-17 00:00:00
知否,日本鬼子十恶不赦,2021-04-13 00:00:00
carolzz-改个名儿,福岛核废水57天可废掉半个太平洋太恶心了我晕这是人类能干的出来的事国家层面上的阴险与恶心真让人无力焦虑捏妈的,2021-04-13 23:52:00
H气象万千H,战略安全与军控在线日本福岛核废水中不仅含氚而且还含62种金属放射性同位素它们存在时间长有化学毒性废水中的碳14半衰期为5700年历史上从未有如此大量的放射性核素排放到海洋里去它对海洋环境及生物链带来的影响难以预料,2021-05-03 18:59:00
武汉每日头条,竟然这么干日本正式决定排放核污水入海据央视新闻消息日本政府当地时间13日上午召开内阁会议正式决定将东京电力公司福岛第一核电站内储存的核废水排放入海多年武汉每日头条2021413,2021-04-13 00:00:00
拉瓦铀,日本的经费肯定喂到瑞典了日喂瑞一玶海岸看了一下少女继续发推支持全世界学生周五逃课对日本排核废水目前还一言不发评论里有人提示也置之不理风云sfy瑞典的环保少女呢,2021-04-10 14:27:00
伊琳er00,它就是一次次的发出坏消息让大家慢慢接受核废水早已泄露排放的事实吧,2021-05-16 23:04:00
知乎用户,要是中俄坚持喂它颗氢弹怎么办,2021-04-13 00:00:00
民间打狗棒法嫡传弟子,卧槽这地洗的真干净啊谨言慎行不删号那是因为这种事没啥好讨论啊福岛排出去的是符合世界原子协会标准处理后的核废水各项检测数据网上都有有什么好说的,2021-04-10 16:28:00
黑白无道,所以说到底就是拿它没辙,2021-04-13 00:00:00
腼腆小子,有什么果就有什么因自己早晚要承受,2021-04-14 00:00:00
世子扶墙,所以现在看什么新闻都尽可能闭嘴谁知道哪一个字说错了要被揪出来喷,2021-04-14 00:00:00
兔子,对对对真恶心,2021-04-11 00:00:00
金融技工,日本地震三个核电站未发现不寻常现象路透社引述日本NHK电视台报道日本政府发言人表示周六13日晚的地震初步导致约95万户家庭断电受影响地区似乎集中在日本东北部地区包括福岛县及周边县市福岛县的第一核电站和第二核电站以及新潟县的柏崎刈羽核电站KashiwazakiKariwa均未发现任何不寻常现象收起全文d,2021-02-14 09:51:00
晨阳财经,日本将放射性物质氚吉祥物形象改为元素符号T海报文字等没有变动你怎么看十年前日本发生了毁灭性的311地震灾害不仅引发了海啸还导致福岛第一核电站发生核泄漏2011年3月11日日本大地震引发了福岛核电站核泄漏事故图据美联社事故发生后为了冷却核反应堆东京电力向福岛第一核电站建筑物内注入了大量的冷却水这些冷却水受高浓度放射性物质污染形成核污水东京电力又利用专门设备来净化这些核污水并源源不断产生大量的核废水核废水一直被保管在众多储水罐中然而这些核废水中含有当前技术无法充分消除的放射性物质氚福岛核污水产生示意图东京电力共准备了约1000个储水罐目前9成已装满所储存的处理过的废水超过125万吨所有储水设施的总容量约为137万吨预计到2023年春季达到极限然而就在2021年4月13日日本政府召开相关阁僚会议正式决定向海洋排放福岛第一核电站含有对海洋环境有害的核废水虽然日本政府一再表示排放核污水的浓度符合国际标准但依然引发了广泛的担忧日本福岛核废水如果直接排入大海将对海洋环境食品安全和人类健康产生深远影响排污入海显然不仅仅是日本国内的问题更是影响全球海洋生态和环境安全的国际问题值得国际社会高度关注下面还是通过一幅图来了解一下日本福岛核废水排海将带来哪些危害,2021-04-24 00:00:00
yosike,此事彻底断掉了我对日本的那点浪漫幻想,2021-04-12 00:00:00
fooo,不可以醒醒台湾省是中国的一个省呀,2021-04-15 00:00:00
有爱心的小鱼,科赛斯达罗他胺DAROLUTAMIDE显著延长非转移性前列腺癌患者整体生存新英格兰医学杂志发表了达罗他胺Ⅲ期ARAMIS研究在非转移性去势抵抗性前列腺癌患者nmCRPC中预先设定的最终OS分析的全部数据这些数据部分已于2020年5月召开的美国临床肿瘤学会ASCO2020线上学术会议上公布非转移性去势抵抗性前列腺癌患者nmCRPC接受达罗他胺联合去势治疗ADT与安慰剂联合ADT相比患者的总生存期OS有显著改善HR06995CI053088p0003达罗他胺显著改善所有其他次要终点包括至首次细胞毒化疗时间和至首次症状性骨骼事件SSE时间最终分析的安全性数据与早期分析结果一致不良事件发生率与单用ADT总体相当通过正在进行的研究我们已经确定了将nmCRPC患者的治疗重点放在延长生存和减少不良反应上达罗他胺的研究结果令人鼓舞医生将更有信心应对患者的治疗需求包括改善疗效延缓死亡和提高治疗耐受性与安慰剂联合ADT组相比接受达罗他胺联合ADT治疗的患者其OS显著延长全因死亡风险降低31HR06995CI053088p0003尽管安慰剂组中超过一半55的患者554例患者中有307例在最终分析的截止期2019年11月15日时接受了达罗他胺或其他延长生命的治疗但同样观察到了OS的获益通过对总体研究人群进行中位29个月的扩展随访达罗他胺较好的安全性得以持续体现与早期分析相比因不良反应AEs停药率未增加两组患者均有9发生上述情况ARAMIS研究的更新数据也证实达罗他胺联合ADT对中枢神经系统CNS影响小发生精神和认知障碍的可能性低达罗他胺在临床前研究和健康人中的低血脑屏障透过率低可以解释这一现象日本核废水入海对中国有何影响印度特瑞收起全文d,2021-05-16 20:26:00
追寻,拿到封口费了,2021-04-14 00:00:00
温江共青团,日媒用3D影像展示福岛核电站十年变化10年前的3月11号日本发生9级强震导致福岛第一核电站严重损毁十年过去了核电站目前情况如何安全隐患是否已经排除核污水的处理何时才能完成有关福岛核电站的诸多疑问在事故发生10年之后依然存在O网页链接,2021-03-10 20:05:00
T0Tzzzzzzzz,东邪西毒日本政府正式决定福岛核废水排海印度会接受中国的善意帮助吗日本国驻华大使馆印度驻华大使馆,2021-04-24 23:59:00
ailitest-玫瑰甜酒,昨天又整理了一下存货发现神仙水还有三个多月过期我以为它早过期了没想到还没过期赶紧用起来毕竟以后么的钱买了好吧有钱也不能用了一想起来核废水的事情就想骂该死的日本政府,2021-05-20 20:39:00
会发光的小胖桃子,亮剑吧青少年是祖国的未来十几二十岁的青少年为了韩国那帮涂脂抹粉扭屁股的爱豆连抗美援朝都敢否定让中国建个罩子治理辅导核辐射废水的垃圾都还可以上台表演没有底线了吗再不治这些玩意儿孩子们就只知道丢人败家了,2021-05-12 14:59:00
李里,非常好的解答我以前在用摄像机拍摄X光源时只要很小的电压盖革实测不超过20μSvh就会有很强的噪点用Ra226紧贴手机摄像头曝30s甚至可以拍摄到某些粒子的运动径迹另外不知可否把视频直接搬运过来油管不方便直接打开,2021-04-19 00:00:00
splendor_Qyj,INTO1官博瓜吃多了小心闹肚子核废水喝多了的水平,2021-05-01 09:36:00
未言,楼下有人把期刊名字贴出来了要不然大佬你去找找,2021-05-18 00:00:00
爱命定你是注定的爱永恒心,火花石1975对她来说日本人的百万吨核废水还没有中国人放个屁污染大,2021-04-11 17:28:00
航空视界,制裁日本韩国已经动手日本坚持排放核废水中国反制或更强硬福岛第一核电站的核废水是来自于对于该电站的四座核反应堆的冷却用水在2011年311东日本大地震中福岛第一核电站的四座反应堆遭遇重创其中两座反应,2021-04-15 00:00:00
薰衣草的梦幻海,这句话还没完这种人就是遇到一个对ta好的ta会美其名曰恰是你的温和善良正义慈悲hold不住人家的呢人家喜欢的是有一点坏坏的呢就喜欢给那种非要让人家喝废水的能让我人家像核导弹一样光泽放射的那种坏坏的堪比野兽儿哦一起玩噢笑的春风拂面甘愿舔脚哦我们看你真是啊三魂七魄你缺两魂三魂七魄你少七魄呀难怪物以类聚群魔乱舞也收起全文d,2021-05-14 16:55:00
