author,content,time
Happy2010,是的这是根本性冲突所以不要幻想变色迎合我们是大国不是弹丸之地这是你死我活的斗争大国崛起必然性大家不要幻想哪怕一丝一毫,2021-04-13 00:00:00
花花,所以资本主义社会真是毒害人类资本为王的世界毁灭人类,2021-04-12 00:00:00
Makrembolitissa,这有什么好吵的楼主觉得观察者网应该把Greta对日本排水的全部表态包括转发都如实报道不应该直接定义棱模两可我觉得说的没问题啊转发明确态度指向的推特实在算不上棱模两可有些网友觉得Greta依然人设崩塌因为转发谴责力度不够我觉得说的也没问题仅是转发确实不算是特别强烈的态度而每个人对于Greta应有的态度的看法不一样也很正常,2021-04-17 00:00:00
要长肥的悟空,复制粘贴大篇废话不累么,2021-04-10 00:00:00
法语MTI考研助手,聚焦热点丨福岛日本准备向海洋排放核废水排放到海洋中2011年3月11日的海啸后产生的核废水包括雨水地下水desnappessouterraines避免核反应堆堆芯lescœ法语MTI考研助手2021415,2021-04-15 00:00:00
云羽落,大佬真是顶级理解,2021-04-14 00:00:00
点燃最后的信仰,西方国家连个P都不放没办法他们之前也是这么干的也没人敢说我就排了你能把我怎么滴日本没这么大面子得公布下,2021-04-13 00:00:00
金塔发布,美国海洋生物学家美国必须制止日本排放核废水计划O网页链接,2021-05-05 16:46:00
信主得救恩,夜半的布谷鸟美国自己就是个灯下黑难怪要为奴才日本排放核废水开绿灯,2021-05-08 00:54:00
天津广播,乐境早读日本核废水排海影响分析天津幼儿园招生安排户口和住房利好日本政府正式决定排核废水入海排放将于约2年后开始此举引发日本国内民众的不满和质疑中国韩国等周边国家表示反对各天津广播2021414,2021-04-14 00:00:00
用户7603542009,善待自己过几年日本核废水扩散就吃不上了O绿洲,2021-05-11 12:30:00
阿哩鹿芽7,东京饮用水致癌物严重超标核废水倒城市里了,2021-05-03 20:08:00
图们市检察,日本福岛核电站发现严重污染厂房或有爆炸风险据日本原子力规制委员会10日发布的调查报告福岛核电站2号3号机组厂房上方可能附着了7万万亿贝克勒尔的放射性物质污染程度远超预期厂房还有引发爆炸的可能目前核电站内还存有超120万吨的放射性污水威胁环境和居民的安全O网页链接收起全文d,2021-03-11 13:00:00
介哦草,苏联人就亏在不会鞠躬上了,2021-04-09 00:00:00
野玫瑰收藏家,任豪没有人比r1se更爱r1se没有人比你更懂核废水,2021-05-02 23:03:00
Ferro_,氟化物超标也能联想到核废水这究竟是怎样惊人的想象力,2021-05-03 23:07:00
半糖炼乳,东京饮用水致癌物严重超标你说核废水能喝饮用水致癌物都超标了我信你个鬼,2021-05-03 22:29:00
站在全泰达街做梦顶端的女人,核废水往海里倒拉莱耶就在你家里造,2021-05-04 22:17:00
辛夷之花,福岛地震首名遇难者为一名独居男性10天后被发现2月25日日本福岛市称当地发现了一具男性遗体经确认死者系在2月13日发生的73级地震中遇难消息称死者为50多岁男性长年独居地震发生后其家人因无法与他取得联系在2月23日去男子家中确认情况时发现他已被埋在家具下方后被确认已因窒息身亡日本总务省消防厅表示该男子是此次地震中的首名遇难者张奥林gtgtO日本发现福岛地震的首名遇难者系一名独居男性收起全文d,2021-02-25 15:56:00
隔壁好邻居王叔叔,罐儿就会鞠躬放屁跳跳兲虎躬犟精神月刊勇者KuMa君鞠躬鞠躬zerofabric看看这些新闻真不知道某些人相信日本核废水经过处理是达标排放的信心从哪里来的另这个最后被送回的会是个什么东西呢贫铀穿甲弹,2021-05-02 15:58:00
狗十八qwe,CestLaVie,2021-04-11 00:00:00
欢淘,有一说一我想去看看2021年还有谁会这么护,2021-04-13 00:00:00
打伞的大姐姐,梓殒不是我杞人忧天赶紧监控附近海域海水放射性元素含量这特么别到时候说核废水震漏了妈的正中下怀,2021-05-14 09:26:00
哈都别说了,东京饮用水致癌物严重超标上次看到核废水问题当时就想着以后还是不买岛国的化妆品了再好用也不敢买心想刚买的用完就算了这,2021-05-03 23:35:00
拳打偷国人脚踢二棒子,太君故乡的sakura被核废水浇变异了不回去看一下,2021-05-09 17:20:00
榆树农业农村,日本倒核废水她装死提到中国倒支棱起来了O日本倒核废水她装死提到中国倒支棱起来了,2021-05-09 18:35:00
红之澄,我的恋人是这个国家,2021-04-14 00:00:00
Pale_Blue_Dot,这么明显的有人带舆论挑起对立一次次造热点让普通网民迷失在信息海洋里而忘了关心真正的重要问题比如福岛核废水比如去美国进行病毒溯源比如中美斗争被情绪裹挟而自诩独立思考达尔文也为放弃你们而点赞金色铅笔博主最好看过他在下面的发的几条评论后再说评论配图,2021-05-11 18:48:00
董雅思,srds刘也没有侵权,2021-04-16 00:00:00
luke_kingca,内含子小孩儿能拎的这么清楚说明后面有人指点无穷的探索一玶海岸看了一下少女继续发推支持全世界学生周五逃课对日本排核废水目前还一言不发评论里有人提示也置之不理风云sfy瑞典的环保少女呢,2021-04-10 15:27:00
知乎用户,菊与刀鞠与倒,2021-04-16 00:00:00
终極龍閃,只有日本是,2021-04-14 00:00:00
edodyone,抱朴仙人中国某邻国悍然向海洋排放核废水中国某邻国发生全球最严重疫情可怜的中国呀,2021-05-01 10:49:00
寂寞的旅人,乌合麒麟任何世界性质的环保机构只要是对日本核废水不闻不问却跑来指责中国环保问题的都是打压中国的政治工具当放屁就行,2021-05-09 18:22:00
wup杜甫,评论里竟然有说苏联好的真是无语,2021-04-21 00:00:00
jojohoho,你以为真的是几亿美金吗呵呵这个就和前几年美国说缺50亿修墙两个党一直在扯一直在扯国家机构都给停摆了一个多月损失早超过50亿美金了未来战略资源是水怎么的也要把大部分淡水给懂,2021-04-13 00:00:00
断箫,敢喷西方禁言封号,2021-04-19 00:00:00
遥不可及的逍遥,每个日本人喝18公斤核废水很蓝吗,2021-04-12 00:00:00
四方游览,首先第一个问题是就算中国愿意帮忙谁来付钱难不成靠咒语念一句就行了,2021-04-15 00:00:00
机械芭蕉,反人类罪,2021-04-17 00:00:00
酒泉日报,酒泉倾力建设以马鬃山等地区为主的矿产资源开发利用产业基地全力打造两大增长极倾力培育四大增长点系列报道之五打造市域经济的重要增长极酒泉倾力建设以马鬃山等地区为主的矿产资源开发利用产业基地酒泉肃北马鬃山经济开发区成立老企业复工复产招商引资项目落地石材产业园区新投项目一个个喜讯让沉寂多年的马鬃山变得活跃起来2020年6月8日酒泉市批复肃北县关于成立马鬃山经济开发区的请示同意设立肃北马鬃山经济开发区这标志着市级马鬃山经济开发区正式成立肃北经济发展翻开了崭新的一页酒泉肃北县依托资源禀赋和产业发展优势加快马鬃山口岸复通工作推进马鬃山经济开发区筹建鼓励支持博伦矿业等骨干企业做大做强建设资源工业特色小镇着力打造百亿级产业集群以马鬃山地区为重点统筹推进煤铁铜钒黄金石墨石材石棉尾矿处理等产业积极引进国内外战略投资者大力发展黑色金属煤炭矿产资源精深加工新材料生产贵金属产品加工等产业支持传统工矿企业实施补链延链强链技术改造提高附加值增强竞争力推动全市矿产资源开采冶炼产业提质升级改造中的混凝土搅拌站针对马鬃山镇资源开发利用效率低产业链延伸不足传统增长动能失速生态环境约束加大基础设施配套滞后等问题酒泉市决定成立马鬃山经济开发区以开发区为龙头整合区域资源促进产业链延伸和产业多元化发展推动区域经济高质量发展酒泉市努力将马鬃山经济开发区建设成丝绸之路主线与草原丝路交汇的战略支点甘肃省绿色矿业发展基地和矿产资源综合利用示范区酒泉新能源产业基地的重要发展区和新能源就地消纳示范区酒泉市建设省域副中心城市和全力打造两大增长极倾力培育四大增长点新发展思路的重要支点县域乃至市域经济高质量发展的重要增长极绘就实业兴边富民图2020年8月酒泉肃北县马鬃山经济开发区挂牌成立规划总面积25万平方公里有博伦亚峰北东吐鲁等10多户规模以上企业和近10亿元以上在建项目为建好马鬃山经济开发区酒泉市抽调15名熟悉工业和矿山资源的年轻干部先后4次赴兰州对接开发区建设事宜争取将开发区列为省级园区争取兴边富民守边固边的相关政策和资金支持酒泉肃北县第一时间成立由县委县政府主要领导任组长四大班子分管领导任副组长常务副县长任筹建办主任的筹委会因地制宜将马鬃山军警民活动中心作为开发区办公场所统筹200多万元购置办公设备酒泉肃北县多次会同市发展改革财政工信四勘院规划院等部门和单位在深入调研的基础上逐步完善了一核马鬃山镇面积约14平方公里七园七角井聚集园区吐鲁红沙梁聚集园区狼娃山聚集园区饮马峡聚集园区明水聚集园区党城工业园石包城工业园多点式布局马鬃山和南山飞地建园军警民融合边贸工矿一体化发展的工作思路提出了近期5年产值超百亿中期10年产值约五百亿远期30年产值近千亿的奋斗目标项目逆水行舟2020年为增强发展后劲降低新冠肺炎疫情对经济社会发展的影响酒泉肃北县扎实做好六稳工作落实六保任务精准实施推进企业复工复产4月马鬃山片区7个重大工业项目集中开工总投资117亿元标志着马鬃山经济开发区建设正式拉开序幕5月马鬃山集中开工5个城市基础设施建设重点项目总投资667898万元城市服务功能进一步提升要高起点谋划推进把马鬃山经济开发区放在两极四点大格局中考虑认真学习借鉴全国先进经济开发区的成功经验兼容并蓄引进吸纳切实提高园区建设管理和运营水平着力打造经济开发区高质量发展的新样板酒泉市委副书记市长王立奇说2020年西部矿业西钒科技公司年产1000吨五氧化二钒部分生产线调试运行鑫磊石材项目启动生产镁弘公司年产10万吨高活性氧化镁技改项目建成投运窑街集团红沙梁年产440万吨原煤项目获环保部批复德泰公司50万吨铁精粉生产线启动生产酒泉肃北县委书记张立东说建设马鬃山经济开发区要高起点高标准做好各项工作整合包装现有资源提档升级现有产业坚持班子建设高标准运行服务高标准各项指标高标准科学有效稳步推进马鬃山经济开发区发展壮大开足马力高效率保障各项计划全面完成全力以赴加快项目建设保质保量完成建设任务处理好经济发展与生态保护的关系以最高标准最严要求最实措施驰而不息强化生态环境保护和安全生产工作经常性开展巡查人防技防相结合发动群众联防联控织密巡防网络坚决禁止偷挖盗采围绕马鬃山经济开发区产业规划和镇区总体规划建立招商项目库制定招商优惠办法创新招商方式推行以商招商以企招企精心谋划招商引资工作招商引资是发展的生命线酒泉肃北县始终把招商引资作为加快发展的生命线来抓认真审视马鬃山经济开发区的区位优势资源优势产业优势谋划引进一批事关全局的重大项目举办肃北网络直播招商推介会采取不见面云招商的方式向企业及投资人推介肃北投资环境在线签约风电光电石材开发等4个项目签约金额261亿元2020年5月上旬酒泉肃北县主要负责人带队分别赴上海厦门长沙等地招商在上海中国金融信息中心举办的甘肃酒泉招商引资推介会暨项目签约仪式上成功同南京风电科技有限公司浙江正泰新能源开发有限公司湖南腾云置业公司签约3个项目签约金额62亿元在福建厦门举行石全石美肃北草原等您来招商引资推介会上与新迪集团签订战略合作协议和酒泉全生物全降解肃北标准产业加工区协议与中国花岗石直采平台签订战略合作框架协议镁弘科技有限公司是在开发酒泉肃北县别盖林镁矿基础上建立的产品出口南非等国家和地区公司原来设计产能3万吨去年产能扩充到10万吨更好满足国内外市场需要肃北镁弘科技有限公司总经理李文胜说据了解酒泉肃北镁弘科技年产10万吨高活性轻质氧化镁技术改造项目达产达标后年可实现营业总收入35亿元年度利税总额可达9500万元成为肃北县经济发展新的增长点2020年8月14日酒泉市在中国花岗石直采平台举行石材产业项目合作座谈会暨项目签约仪式肃北县签约3个项目签约金额2218亿元地处酒泉肃北马鬃山经济开发区金庙沟园区的芨芨槽绿色矿石产业园目前正加快推进项目建设和矿区环境治理项目3期建成后将实现年处理废石料50万立方米销售利润1000多万元既可解决当地矿山开采恢复治理中的环保问题又能实现企业经济效益和社会效益双赢酒泉肃北县域经济发展主要以工业经济为支撑工业又以矿山为主体肃北县北山马鬃山片区石材资源丰富品质优良产业发展前景广阔酒泉肃北县委负责人说石材产业是马鬃山经济开发区重要的增长极正成为县域工业经济发展的重要支柱下一步在承接福建石材产业向西部转移上肃北县将为企业提供全方位保姆式服务助力企业在肃北投资兴业拓展事业绿色矿山之梦盛夏时节距离马鬃山经济开发区近200公里的亚峰矿业厂区繁茂的花草碧蓝澄澈的人工湖设施齐全的文娱广场城市公园一般的景致让人眼前一亮我们全力打造河西地区一流的现代化绿色黄金矿山企业按照以人为本的绿色环保发展理念采用先进的生产工艺和设备建设绿树成荫花草遍地绿水环绕的矿区环境目前矿区绿化总投资2000万元建成了小型公园式矿区亚峰矿业财务总监高亚龙说亚峰矿业立足绿色生态理念先后投资4000多万元建成星级员工标准公寓楼职工文体中心污水处理站供暖系统等设施按照绿色矿山建设标准把公司打造成了集节能环保数字化管理安全高效为一体的戈壁明星企业马鬃山矿区属典型的温带荒漠化干旱气候降雨量极少近年来博伦矿业公司根据绿色矿山建设要求投资500余万元对矿区环境进行优化组织全体员工在矿区内种植沙枣红柳2万余棵并安装滴灌设备努力提高植物的存活率增加矿区绿化面积委托专业园林设计公司对矿区的工业广场进行规划全力建成布局更合理环境更优美的工业广场为做到资源开发与环境保护资源保护城乡建设相协调博伦矿业公司最大程度减少对自然环境的破坏选择了资源节约型环境友好型开发方式在坚持保护和合理开发利用原则基础上因地制宜选择合理的开采顺序开采方法优先选择资源利用率高废物产生量小水重复利用率高对生态环境破坏小的工艺技术与装备符合清洁生产要求在开采主要矿产的同时博伦矿业公司对具有工业价值的共生和伴生矿产统一规划综合开采综合利用以防止浪费按照边开采边治理边恢复的原则及时治理恢复矿山地质环境复垦矿山占用土地和损毁土地通过技术创新优化工艺流程初步实现了采选冶过程对环境扰动的最小化和生态再造的最优化博伦矿业公司严格落实矿山环境恢复治理保证金制度严格按照七角井钒及铁矿矿山地质环境保护与土地复垦方案的规划进行地质灾害防治工作矿山地质环境恢复治理水平明显高于矿产资源规划确定的本区域平均水平开展针对性分阶段治理工作建设期博伦矿业公司就对基建期产生的废石采取了分级堆置整平压实集中堆置锅炉煤渣和生活垃圾在生产期将新产生的废石及时回填采空区在可能发生地面塌陷的区域设立监测点周围设置铁丝网警示标志在固体废弃物处置上采取矿山井下掘进产生废石直接回填至井下采空区将早期民营开采期间在矿山地表附近排放的废石以地貌重塑的方式进行集中整治分级堆放整平压实矿山浅地表部分矿体开采结束后对矿山井口进行封闭彻底消除对矿山地质环境的影响一系列措施实施让博伦矿业公司在合理开发矿产资源的前提下土地复垦工程取得明显成效改善了生态环境矿区恢复了本来面貌绿色矿山建设进程加快绿水青山就是金山银山我们建设绿色矿山不仅为了肃北的今天也为了更远的将来博伦矿业公司负责人说生态与经济效益并重生态与企业发展并行是矿山企业发展的根本路子肃北县制定出台了党政领导干部生态环境损害责任追究实施细则和环境保护监督管理责任规定从严实行环境保护工作问责一票否决制度对生态环保工作不作为乱作为慢作为的人和事进行严肃问责肃北县政府负责人说走绿色矿山建设之路让矿山闪耀生态文明之光在肃北县像博伦矿业亚峰矿业德泰矿业这样的企业越来越多绿色开采绿色发展已成为矿山企业的共识企业将自身发展同合理利用自然资源相结合自觉担负起尊重自然生态和保护绿水青山的社会责任在探索矿山绿色发展模式的道路上勇往直前近年来酒泉肃北县加快推进生态环保和矿山恢复治理加快自然保护区矿山生态环境问题整治全力争取矿山恢复治理资金和生态移民安置项目新增的县级财政收入基本用于矿山恢复治理和支持企业绿色技术创新在全面完成中央省级环保督察反馈意见涉及肃北的整改任务后今年肃北县将有效解决保护区外围各类环境突出问题本报记者陈思侠收起全文d,2021-01-08 12:51:00
招财猫神888,帝吧官微估计日本几年前就开始偷偷往太平洋里排核废水了,2021-04-11 19:05:00
馒头抽风了,澳大利亚我,2021-04-22 00:00:00
埃及一朵花,试想一下如果这件事情发生在中国身上西方那群老政治家们会怎么想估计开心的睡不着觉了这句话细想一下还是不妥,2021-04-13 00:00:00
用户7313157638,核污水入海对照苏联看日本人的素质和责任心O核污水入海对照苏联看日本人的素质和责任心,2021-04-10 18:42:00
想我所想,感觉答主说的不错突然好奇那大亚湾的核废水应该也能灌农田,2021-04-20 00:00:00
abuzf,不说全部吧部分拜屁政客部分拜屁团体部分拜屁资本是全世界的战乱混乱灾难痛苦的始发地本源,2021-04-18 00:00:00
知乎用户,辐世绘很核理令核的年号也很应景,2021-04-22 00:00:00
喂喂喵喵吧,水至清则无瑜自罚三杯核废水我干了你随意,2021-05-02 16:53:00
sdxgxs,日本倒核废水她装死提到中国倒支棱起来了O日本倒核废水她装死提到中国倒支棱起来了,2021-05-10 11:52:00
萵悅燿要師優錢和誰鬦優緣,日本71级地震日本真是多灾多难还有核废水,2021-02-14 04:19:00
在海一方,日本最近在台湾问题上很强硬我觉得和美国支持日本排污水不无关系,2021-04-18 00:00:00
夹夹勇士,在为什么短短时间就可以做一起视频然而为什么日本核废水排放那么久了时间这么充裕还没看到你们出一期核废水的视频回形针PaperClip这期制作周期虽然紧张但我们也尽量做了不一样的尝试,2021-05-16 13:53:00
TohsakaRinLily,内含子小孩儿能拎的这么清楚说明后面有人指点无穷的探索一玶海岸看了一下少女继续发推支持全世界学生周五逃课对日本排核废水目前还一言不发评论里有人提示也置之不理风云sfy瑞典的环保少女呢,2021-04-10 15:04:00
喷火小青蛙,不懂就问每天产生180吨核废水是怎么回事只有日本这样吗还是什么意思,2021-04-14 00:00:00
shuler,bereadyto是啥意思,2021-04-15 00:00:00
太宰·治,我觉得这种危及国家甚至世界级别的危机确实是社会主义有优势得多,2021-05-09 00:00:00
十橘川,总有一天会循环到喜马拉雅雪山顶上去,2021-04-13 00:00:00
安若素的星相馆,骂谁呢一张嘴就把整个四川全打了我们这不是正在骂它的嘛再说核废料一进海要随着水循环进入大气的吃不上一手也有二手谁逃得了夹后余生惪之翼人在四川吃不到核废水所以不需要为这些话承担任何责任呢安若素的星相馆TopGun从政府高层到突然暴富的地产商人呵呵,2021-04-11 20:28:00
rainboi,无核日本是好日本无日本是好地球,2021-04-13 00:00:00
行知无界,日本因何排放福岛核废水排放地点处于日本东海岸处于日本暖流末端初中地理课已经讲过日本暖流又名黑潮权威定义为北太平洋西部流势最强行知无界2021417,2021-04-17 00:00:00
靥之羽鹏,日本人真有工匠精神就应该把核废水接进自来水管喝掉,2021-04-10 15:17:00
叶减肥,三里岛事故就是认为搞出来的动力还在又搞回去了而已,2021-04-14 00:00:00
oldlie咧咧咧,樊建川瓜果爹爹整个太平洋来稀释是肯定没问题的问题是怎么可能整个太平洋的海水都来参与很明显这些核废水会导致部分海域的含量严重超标危害人和生物临近的国家都要遭殃所以我国说要跟周边国家商量着来一点不错,2021-04-10 21:57:00
芜湖,让我想起了电车难题,2021-04-14 00:00:00
喝绿豆冰沙,二鬼子和鬼子一起去喝核废水好吗,2021-05-16 00:33:00
知乎用户,让他们慢慢喝,2021-04-12 00:00:00
麦芽糖糖的老公 (作者) ,我赶紧去买点海苔,2021-04-14 00:00:00
鞠子陵,我国也只是表示关注要求在国际原子能委员会管辖监督若真反对发外交照会大使递交国书国际索赔了么所以相信政府不要加戏抢盐,2021-04-15 00:00:00
盛夏的果实,我不是不喜欢吃牛羊肉只是因为牛羊肉比猪肉贵,2021-04-17 00:00:00
太极猪打手,自从日本核废水事件后我斥巨资买的怡丽丝尔眼霜用着都不香了,2021-05-11 23:22:00
一碗冰糖肥甜粥,豚子说她高中班主任让她找个英语专业的学生给她外甥写篇本科学术论文我上次血压这么高还是听说日本往太平洋倾倒核废水,2021-05-19 10:18:00
清欢,他们还是逃不掉的雨水蒸发一下全世界农业污染农业污染畜牧业也跟着污染,2021-04-13 00:00:00
小太阳毛毛虫,日本首相就应该被泡在核废水里可能我们什么也做不了但是至少日本的东西都不买了,2021-04-13 23:51:00
忠犬攻yyds,南冥舟郎不要恶意揣测可能她真的就是死了而已王__喆日本排核废水的时候她为啥装死,2021-05-09 11:50:00
知乎用户,在瑞典国内宣传防疫呢,2021-04-14 00:00:00
吊儿郎当作死么骚年,我为了看看到底有啥危害有多严重可真是翻遍了回答好不容易看到一个带数据的到处都在说不好虽然确实没有肯定比有了好不过我就是想知道有多坏危害有多大多久多严重到处找也没没看到不过看你这个大长篇吧我脑子也不好使没都看明白但是好在放心一点,2021-04-14 00:00:00
好好,如果日本把储水罐运到西岸排在日本海最先遭殃是不是中韩朝,2021-04-14 00:00:00
记依呢依特爱摸诶,不用氢弹来颗战术级的中子弹就够了,2021-04-11 00:00:00
希京的希,铜墙铁壁石头更缺德的是日本政府掏了二十亿日元来做宣传美化此次排放核废水行为大家可以看一下微博里有哪些大试图淡化这次事件那他绝对是恰烂钱了,2021-04-11 21:13:00
星小倾,满塘宇那些szqzwy的麻烦她们去把核废水喝了再来说水清不清,2021-05-01 22:49:00
是六月半不是六胖,我今天看到一个最强评论ごっくん麻生,2021-04-14 00:00:00
一点橙子,日本计划先排放7万吨核废水5月13日日本河北新报报道东京电力公司称两年后将最先排放至少7万吨低浓度核污水这批核污水的放射性氚浓度低于每升30万贝克勒尔放射性活度国际单位日本排放标准为每升6万贝克勒尔东电称会将这批核污水稀释后排放L世面的微博视频,2021-05-13 15:42:00
收束者 (提问者) ,哈哈哈哈这个所谓环保少女以前骂西方骂美国的也不少啊还有绿色和平组织以前在国内都不被待见被称为绿色恐怖组织结果这次他们批评日本的发言又被拿出来当枪使了甚至有人说国际原子能委员会也是所谓的西方势力他们可能不知道中国在里面是重要话语权的说白了这次排放从科学角度来讲全世界政府都知道没啥大问题所以都没什么实质性的反对当然了中国因为最近跟日本关系不好趁机打打嘴炮骂几句也很正常所以这其实不是一个科学问题而是一个政治问题而有些人呢当然只愿意听到他想听的有些人呢就投其所好写一些他们想听的怎么惊悚怎么来比如某佛的氢弹点赞流量变现美滋滋,2021-05-15 00:00:00
