author,content,time
北京青年报,动画140万吨福岛核污水或将排进大海后果令人担忧据日本NHK电视台4月9日报道日本政府计划于4月13日召开内阁会议决定是否将现有140万吨福岛核污水排入大海据韩媒报道受洋流等因素影响一旦日本将核污水排入大海被污染的海水220天之后就会先抵达韩国济州岛400天后则会到达韩国西海岸我国外交部回应日本将核污水排入大海应慎重决策北青北京头条动画刘忠禹后期郭茂勇配音王雯雯L青流视频的秒拍视频收起全文d,2021-04-10 21:50:00
smart的奇幻之旅,盖革一响,2021-04-14 00:00:00
是只汽水熊,美国创造稀缺的水资源未来干净的水很贵所以要为水资源而战了,2021-04-14 00:00:00
可乐配生姜,任豪没有人比R1SE更爱R1SE怎么核废水喝完了没啊,2021-05-02 23:33:00
「已注销」,因为对他们也有影响啊我也纳闷了太平洋这么多国家都哑巴了,2021-04-13 00:00:00
谢三个小石头,都2021年啦老兄古墓派还存在,2021-04-14 00:00:00
一都阿叔,日本地震后64岁老人海底寻妻十年日本福岛核废水都TMD偷排到大海里了福岛都还有可能再次爆炸而这些政法帐号居然情愿做人家的应声虫,2021-03-11 19:38:00
谢立宇,深度国际20210417核废水之忧来央视影音观看更多视频L深度国际20210417核废水之忧,2021-05-16 19:31:00
超级大衰哥,是基于数据无误的前提数据无误结论不可能会变x1得出2x2前提是x就是1老师把题写错字了x1那答案就不是2就这么简单我不需要为老师的人格担保我只为x1时我的2x的答案担保,2021-04-14 00:00:00
火系魔法B-29,我们有一个误区当我们有什么决策的时候总要担心会不会遗臭万年流毒千古并且认为我们会成为历史的罪人然后想当然的认为别的国家也是如此然而美国根本就没有那种历史的罪人的说法一共就两百多年的历史哪有什么千古可以流毒哪有什么万年值得遗臭所以美国的决策是没有历史包袱的更不怕什么被写进史书这种负担和觉悟虽然可能不是我们独有的但他们一定没有,2021-04-15 00:00:00
枫丶雪_,福岛核废水57天可废掉半个太平洋地球迟早被他们玩完,2021-04-13 23:50:00
北梦明月198505,环保组织打碎汇丰总部19扇窗户这是环保组织日本倒核废水他们不理却到别的地方以保护地球的名义闹事这叫环保组织恐怖分子见了都说内行,2021-05-05 12:29:00
央视新闻,史无前例一图看懂日本核废水排海危害点蓝色字关注央视新闻13日日本政府正式决定将福岛核废水排放入海核废水一旦排海放射性物质将在57天内扩散至太平洋大半区央视新闻2021414,2021-04-14 00:00:00
吃瓜小透明Z,日本政府基本决定将福岛核污水排入大海靠以后海鲜不吃了日本真的是疯狂自私,2021-04-10 19:33:00
成半仙,实际问题是这桶子里的水越攒越多哪天再来个九级地震一次性全震漏了流海里那不完蛋了日本作为上亿人口的国家就不能每人一杯把它喝了吗退而求其次让日本挨一发氢弹这波在大气层你想到时候日本成为人类唯一个受到三次核武打击的国家这在国际上要援助你好意思不给吗到时候援助一到势必提振日本经济可谓宇宙级碰瓷,2021-04-13 00:00:00
青春科学站,小心核污染来了日本不顾国际社会的谴责甚至像海水中排放核废料这引发了周边海域的核污染问题然而一般像解决核废料这种事情都是采用在无青春科学站2021413,2021-04-13 00:00:00
让你哭的很有节奏0925,不似年少时_去help大葛格的核废水啊不要装死菜,2021-04-10 17:01:00
如子留学,简单明了,2021-04-28 00:00:00
wa丶,主要是空间问题那能不能把废水加热让里面的水蒸发留下放射物质慢慢衰弱减少储存空间,2021-04-13 00:00:00
不吃葱少女,我们国家具有很强的包容性可以接受RB成为我们的一个省份我们帮忙解决希望RB不要不识抬举,2021-04-13 00:00:00
今日俄罗斯RT,日本人不吃鱼吗韩国渔民出海抗议日本不负责任的核袭击韩国各地约有800名渔民参加集会抗议日本决定将100多万吨的核废水倾倒入海据韩国全国渔业合作社联合会称大约有800名渔民参加了周五的示威活动渔船从韩国9个港口起航在岸边抗议高喊口号高举横幅渔民们高喊着日本撤回决定谴责不负责任的核攻击等口号他们还在船上挂上了反日横幅来自永都里渔村的村长朴瑞生说他的父亲曾在这些海域捕鱼并曾希望他承袭父亲的事业他质疑日本对维护海洋健康的承诺日本为什么要这么做他们怎么能对海洋做出这样的坏事日本人不吃鱼吗日本决定在几年内将已废弃的福岛核电站的100多万吨核废水排放到海洋中韩国民众示威之际日本仍拒绝回应其邻国的广泛批评去年绿色和平组织Greenpeace报告称该核电站的废水比日本政府所说的更危险该组织的出版物声称据称经过处理的水仍然含有危险标准的碳14这种放射性物质具有破坏人类DNA的能力且已知水中仍含有放射性氚中国开始采取国际行动并呼吁日本与邻国磋商指出这绝对不是日本的家内事如果核污水没有被污染日本为什么不自己消化呢收起全文d,2021-05-01 18:41:00
多摩的狸子,评论里陈迟但到了阿里海牙科维奇余皪KrisFish内环线英语日本排核废水的时候她为啥装死,2021-05-08 23:52:00
暴力考拉,主要原因是他们自己倒的废水只比日本多不比日本少他们有什么脸跳出来阻止,2021-04-14 00:00:00
卫星与网络,宇宙人一点资讯807期东京电力公司先排放低浓度核污水钟南山自然免疫不现实不科学不人道小米获卷绕屏手机外观专利东电计划优先排放这批低浓度核污水福岛第一核电站内现有1047个核污水储存罐其中21的放射性氚浓度低于每升30万贝卫星与网络2021514,2021-05-14 00:00:00
吃掉夏天和冬天,艾回是娱乐圈HM小鬼子的公司暗搓搓搞台独港独被发现了以为删个网页就算完了要么内外网全平台承认一个中国原则要么带着你的商品滚回日本喝核废水,2021-04-02 17:16:00
双丸子变小乔,越了解日本真的是越讨厌日本有小礼而无大义毫无责任心建议精日分子每人喝一桶核电站污水感受感受日本的美好,2021-03-10 20:36:00
知乎用户,我还是很好奇日本排放这种高污核废水对他们带来的经济损失不比认真处理的成本高日本为何要损人损己,2021-04-13 00:00:00
知乎用户,我对那个南方医科大学的论据发起来源请求54这个值我只在这篇文章里看到了母乳中全氟化合物的污染水平与婴儿暴露评估httpswapcnkinettouchwebJournalArticleZGHJ201511047html但是这说的是母乳,2021-05-04 00:00:00
取名HrYeah,日本核污水57天将污染半个太平洋政府真的是昏头了百万吨核废水排放入太平洋等太平洋整个被污染了咋办海洋被污染海洋生物死亡鸟没得吃整个生态链都完蛋再者若鸟吃了被污染体更完蛋海洋被污染再经过太阳照射蒸发下雨再来一阵风飘到大陆上整块陆地都完蛋海洋是流通的这么经过时间推移这么一扩散整片海洋都完蛋再污染河流人就没水喝了这时候我相信有许多地方都环绕着污染越想越可怕人就废了啊啥也没了地球变荒星了人类文明止步了几年后海洋可能真有变异物体了收起全文d,2021-04-11 23:29:00
山外小阁楼,核子海产弯弯不是早吃上了嘛刚好免疫了,2021-04-14 00:00:00
慎独Debu易,合着日本前年就把没过滤的核废水排到韩国海域了,2021-04-11 21:41:00
croft,我看是为了怼我国外交部无所不用其极,2021-04-14 00:00:00
吃菠菜吧熊猫,抵制日货,2021-04-12 00:00:00
中华网军事,日本排放核废水污染全球中国公知却拍手叫好4月13日日本政府正式决定将把福岛第一核电站的核废水排入大海很显然日本人玩了个文字游戏把被核辐射污染的冷却水中华网军事2021414,2021-04-14 00:00:00
不延而彧,欧美不发声要不众筹往大西洋倒点,2021-04-13 00:00:00
剑涯司,这样算不算日本首先对全人类使用了核武器,2021-04-13 00:00:00
学神研究中心,取消好啊超发那么多货币核废水的问题也没解决开什么奥运会啊开得起嘛,2021-03-07 20:20:00
七里辰光,如果日本人把核废水装船往中国沿海排呢网上看到一张图说他们有这种的计划,2021-04-14 00:00:00
声之形,普通民众如何防范核污染呢过滤器,2021-04-14 00:00:00
阿玉213,福岛核废水57天可废掉半个太平洋啥b,2021-04-13 23:48:00
润龙科万巴,生意嘛挣钱很寒碜不寒碜,2021-04-22 00:00:00
李哪托,强烈谴责坚决抵制嘛我们最会发声了不是吗,2021-04-14 00:00:00
light Chinatown,不是说放颗核弹就能同时消耗里面的能量么也不差多一颗了,2021-04-09 00:00:00
沃兹基硕德,氚对人体无害,2021-04-14 00:00:00
土豆苗苗,他们可能是习惯了你看我们挨了两发都没事这点废水洒洒水啦,2021-04-16 00:00:00
新华播报肖华,日本福岛核电站发现严重污染厂房或有爆炸风险据日本原子力规制委员会10日发布的调查报告福岛核电站2号3号机组厂房上方可能附着了7万万亿贝克勒尔的放射性物质污染程度远超预期厂房还有引发爆炸的可能目前核电站内还存有超120万吨的放射性污水威胁环境和居民的安全O网页链接收起全文d,2021-03-11 13:50:00
知乎用户,哎现在怀孕了只希望能够给后人留一些净土看不得这些,2021-04-09 00:00:00
遇渣女,搜狐新闻日本不顾反对拟将核污水排入大海日本真要把核废水排入大海了韩国会被波及中国也不能幸免提出了一个条件O网页链接分享自搜狐新闻客户端搜狐新闻客户端,2021-04-10 15:06:00
松果大美妞,还有动保组织也是西方政客的工具人乌合麒麟任何世界性质的环保机构只要是对日本核废水不闻不问却跑来指责中国环保问题的都是打压中国的政治工具当放屁就行,2021-05-09 15:25:00
财金人Rogo,日本修改震级为73级希望一切安好的同时也担心福岛核废水排了多少这次地震核电站会不会又有问题L财金人Rogo的微博视频,2021-02-14 08:20:00
__保卫地球星舰,横山寺一日游日照山林春满天香风十里赏花闲永兴金龙横山寺遥看东瀛害人氚1横山寺景区略有小成一大半景观植物都是新的再过一两年会更漂亮了美好生活值得珍惜捍卫美丽地球只有一个2小日本又一次站在了全人类的对立面为了不让核燃料报废错过了关键的抢救窗口就到现在还是想着要保留核燃料其民族狭隘自私劣根性实在令人不齿3如果有可能先进的技术与重要的权力不能让像日本这样的民族获得至少得尽量提高难度并且严格监管4解决方案核废水是不是可以找一个大型油轮运到超深废油甜利用输油管送到油田深处再到最上面灌上一层原油封存大不了过个几百年再来采油日本就应该能找到这样的油田或者地质结构5说不定小日本按照灌原油封存的思路还能开发出一个大产业出来全部自动化机器人作业搞大规模煤炭加氢人工合成原油顺便你现在这些罐子还可以用作油库现在核污染无所谓反正灌倒地下过个几百年再来开采收起全文d,2021-04-11 18:21:00
张起灵隐婚妻子,任豪没有人比R1SE更爱R1SER1SE任豪豪桑故乡的樱花都谢了一轮了你什么时候才能回日本喝核废水呢记得带着你的大罩子R1SE任豪,2021-05-02 22:09:00
DC Hwang,这个可行的毛子干过,2021-04-13 00:00:00
喜闻乐见,下北泽市也被核辐射污染力悲,2021-04-28 00:00:00
菇吴吃吃_GWCC,我突然觉得不仅是我过不了23世纪的那两个春节这个世界这个地球如果继续遭遇战争核废水气候变暖物种灭绝它也看不到23世纪那两场春节,2021-05-20 17:45:00
十代目天下第一,本来就为论文焦虑看到日本排核废水的消息我他妈更焦虑了论文总会写完但核污染呢我能怎么办呢,2021-04-11 23:54:00
幽兰儿8,先管管日本要倒进海里的核废水吧,2021-04-11 23:21:00
奇迹暖暖内含光,福岛核废水57天可废掉半个太平洋好自私啊怎么阻止它海洋生物怎么办人类怎么办太平洋怎么办那拇指大的地方造的孽真多真正关系到人类人权的问题美国居然同意真有你的对新疆棉花事件却诋毁中国打着人权的旗号抵制棉花现在日本要往太平洋里倒核废水了美国你怎么又装死还同意这就是日本这就是美国越来越畜牲了收起全文d,2021-04-13 23:55:00
oddgiraffe,啵啵啵,2021-04-23 00:00:00
你家门铃响了没,梗宝你的核废水我替你喝了,2021-05-06 18:33:00
政洋爱科幻,日本核废水来了就可以进化成哥斯拉了,2021-05-06 13:36:00
一无是处,书友啊,2021-04-20 00:00:00
斯坦因的迷雾,e也没吹啊,2021-04-29 00:00:00
lau2212986962,日本福岛任何生物都靠近不了,2021-04-13 00:00:00
飓风之影,是的有这种感觉,2021-04-18 00:00:00
No one,那麼一點點就應該在地球的版圖上抹掉把海洋面積適當的擴大一點不是更好,2021-04-20 00:00:00
莫愁江湖,日本排放核废水韩国人骂得比我们还凶排放的也是日本政府缺乏第三方监督的话检测结果本来就难以让人信服何况日本人在隐瞒核泄漏事件早有前科1978年福岛莫愁江湖2021414,2021-04-14 00:00:00
秋实08,从2战到排核废水日本人不负责民族性的形成O从2战到排核废水日本人不负责民族性的形成,2021-04-18 23:55:00
Nnanan,农耕文明的民族性格没有海盗文明那么强的进攻性,2021-04-14 00:00:00
知乎用户,我记得看纪录片拯救切尔诺贝利湾湾好像翻译的是抢救车诺比里面地图头最后就说的当时耗费了180亿卢布当时1卢布1美元而且旧石棺30年寿命到了以后乌克兰还是像全世界众筹造的新石棺预计100年寿命本子才不会愿意花费那么多钱去处理,2021-04-13 00:00:00
巴蒂,氕个干净一氘两断海纳百氚,2021-04-14 00:00:00
抬杠,与题意无关,2021-05-18 00:00:00
利利,1核电站的含氚废水向河流海洋排放是常规操作中国的核电站也不例外这点就太有混淆视听的感觉了核废水和泄漏水是两个概念东电这么解释然后作为中国人也这么听就有点被带偏了,2021-04-14 00:00:00
别来烦我好吧_,小孩看到核废水要排入海洋的新闻得多难过,2021-05-04 19:14:00
Sarah_Chan___,艾回你真是不要脸啊再黑中国人我这个高贵路人也要逆反了滚回去喝核废水,2021-05-10 08:48:00
白桐祠,唉边补上个月的三笔练习指标边重刷杨颜XF最近不是你妈什么78小日本就你妈排你妈一些你妈的核废水到你妈那个海里面嘛这段M语言真的绝了要不是他说出来我也没想到一句正正常常的日本排核废水到海里可以在那么多地方加脏话,2021-05-05 20:34:00
超强幸运丸,现在才想起昨天的团魂热搜字粉现在说其他人公然唯九唯十没有团魂怪队友粉笑死之前骂rbr喝核废水骂粉丝egz的不是你现在来艹团魂除了喜欢字的谁会喜欢整个团,2021-05-18 10:51:00
灵仙羽圣,全世界几十亿人反对,2021-04-25 00:00:00
德邻科技,南冥舟郎不要恶意揣测可能她真的就是死了而已王__喆日本排核废水的时候她为啥装死,2021-05-08 23:58:00
司马南,看看吧日本核废水排入太平洋扩散图如此触目惊心日本政府已确定将把福岛第一核电站的核废水排入大海10年前日本大地震海啸震惊世界这是第一波第二波震惊是核电站泄漏现在是第三波核废水排入大海专家,2021-04-12 00:00:00
cyong是我,日本核污水排放入海影响多大卫星视角全面揭晓O日本核污水排放入海影响多大卫星视角全面揭晓地球人都知道日本核废入海的蝴蝶效应有极其严重的后果可是我们却无法彻底排除这一严重后果一方面日本不愿意和全球相关国家国际组织等共同联手应对已知的核污染风险不愿意公开自己处理核废水的技术和能力供国际社会共同探讨研究另一方面国际社会也存在不同的声音阻扰全球共同应对核污染处理所需达成的共识最关键的是联合国五常国家至今没有就这一问题达成全面或部分共识也没有提议召开日本核废入海的非常安全理事会收起全文d,2021-05-19 11:09:00
欣智囝,这个核废水想着就头疼专业戳轮胎熊律师但是他们的孩子可以夏令营步行几十公里而我们的孩子却面对4杯25度的水顿顿顿喝了下去奶粉揭秘勘误1蓝印应为雪印2漏明治放射性核素铯奶粉,2021-04-10 15:44:00
细嗅蔷薇topiii,日本71级地震日本政府高兴坏了又可以排放核废水废料了像去年夏天日本的洪水一样,2021-02-14 00:11:00
白纸盒,那所谓的可控核聚变无尽能源不是说大海里的聚变物质非常丰富me,2021-04-14 00:00:00
海外网,韩媒高度关注日本核废水排海决定批日政府信息不透明日本政府13日正式决定将福岛第一核电站核污水排入大海韩国多家主流媒体几乎和日媒日本政府正式决定将核污水排放入海韩媒高度关注日本核废水排海决定批日政府信息不透明原创海外网,2021-04-13 00:00:00
zjj-半边天家园389,日本倒核废水她装死提到中国倒支棱起来了O日本倒核废水她装死提到中国倒支棱起来了,2021-05-10 14:33:00
李哪托,什么年代了你们还在这种问题下粉红粉红的叫,2021-04-14 00:00:00
知乎用户,用菠萝换水完美解决,2021-04-09 00:00:00
元安,太平洋里的生灵应该会把日本击碎吧,2021-04-15 00:00:00
战色狼,哈哈哈增加X战警学员数量,2021-04-11 00:00:00
大田,合着是跟美国学的啊看来称美国为人类文明毒瘤也不为过啊而且这毒瘤还是辐射变异的,2021-04-10 00:00:00
法援03,发布了头条文章浙江同花顺金融大师正规吗投资亏损能追回吗能退吗老师带单合法股票房产微博日本福岛核废水排海借势炒作股票百度快照顾问追损白银超话现货交易黄金你有哪些被骗的经历O浙江同花顺金融大师正规吗投资亏损能追回吗能退吗老师带单合法,2021-05-03 09:15:00
syfsy詠竹詩溪,比起喝恒哥圣水的印度人我更反感喝核废水的日本人,2021-05-11 09:26:00
格兰,对面萌二狂怒皈依者狂热罢了,2021-04-16 00:00:00
en昊,目的看到的最理性的答案话说答主修养或者脾气是真的好评论区给看得我彷佛直接认识你了一样,2021-04-15 00:00:00
owomen937,四字网友第一张图还以为是游戏里的模型风魔无下限用这个钱治理核废水吧,2021-05-06 13:03:00
无锡市佳运安全防护设备有限公司,突发核污染别慌有它为你保驾护航车载式核生化防护应急便携箱单兵双人组套突发性核生化污染临时进入或穿越核生化污染区域有毒化学品泄露双组份防护装无锡市佳运安全防护设备有限公司2021416,2021-04-16 00:00:00
20G吃瓜哪里有瓜就有我,东京饮用水致癌物严重超标啊以前不是吹嘘冲马桶的水都能直接饮用吗核废水也都能直接喝吗怎么会超标呢,2021-05-03 22:18:00
got77,支乎,2021-05-19 00:00:00
王东来,px能被划等号面粉厂为啥不能核电站的恐怖就是在辐射上然后人自带36的热辐射所以都是辐射为啥人要对核辐射恐惧因为根据科普核辐射的辐射力度人的承受能力而人的热辐射完全在人体的接受范围内所以人不需要为了隔绝自身的热辐射而去自残,2021-04-14 00:00:00
在下小林,中国免费帮忙运到美国排放,2021-04-14 00:00:00
桃桃奇奇,乌合麒麟任何世界性质的环保机构只要是对日本核废水不闻不问却跑来指责中国环保问题的都是打压中国的政治工具当放屁就行,2021-05-13 09:32:00
微笑脸,上一个九级事故还在为加固发愁懂的都懂,2021-04-20 00:00:00
小西瓜最好吃了,风紧雁行高_吃饭睡觉看瓜赏花CPK国际专业蜜蜡脱毛中心乐于悲天悯人的多喝点核废水和恒河水吧品尝下世界的酸甜苦辣,2021-05-03 15:06:00
旗驾车服-不服斯基,其实了解这方面的人都懂真的处理好了并按照国际标准排放是允许的包括浓度排放量什么的而且在这个基础上对其他周边国家影响不大的严重的也就是福岛周边海域的生物但是这是日本啊从事故发生到现在就没有好好地对待这个问题比如硬生生拖事故等级7级事后检测结果伪造这就很难放心他们能做好处理污水并排放这个事一颗黑心污天下啊,2021-04-12 00:00:00
梁汉彬,有这个说法吗无偿提供,2021-04-14 00:00:00
一二三四,严谨点应该是核污水,2021-05-14 00:00:00
兄贵熊猫,我不是很明白这个反应堆是永远冷却不下来的吗,2021-04-13 00:00:00
我心飞扬,众说周知每个日本人都想变超人变异环境是必备的这波是等着变身,2021-04-24 00:00:00
第欧根尼,哪怕我是一只鹅也得谴责并反抗这样的行为什么时候地球的环境海洋天空一个国家或者它背后的主子就可以决定了,2021-04-14 00:00:00
Jack.Ryan,那个欧洲环保小卫士咋没声了,2021-04-14 00:00:00
波波安,打错字了人写成核了,2021-04-13 00:00:00
中电环保sz300172,中电环保sz300172投资者提问核废水的处理事关全人类的健康日本核废水的决定将导致全球海洋生点击链接查看更多O网页链接,2021-05-13 10:13:00
封寮主,你这非得这么想要真投氢弹那肯定是五大流氓一致通过决定对其爆破有了一致意见后面都好办直接共同宣称日本无力处理核泄漏鉴于将对全世界造成的深刻影响五常决定对其进行人道主义援助然后中国表面有氢弹虽然只有中国表面有氢弹这个事是不是真的不知道只能勉为其难的站出来为全人类承担这个艰巨的任务至于日本呵呵呵我们五大流氓共同决定的事情你们感恩戴德就行了,2021-04-10 00:00:00
LiuxingRockman,一般通过97式精日喝了核废水脸不知道有几张清梦压星河AC精日没有脸的不知道这样算不算打脸呢,2021-05-09 15:27:00
大良造,总算有人说出了心里话有些人敌人都磨刀霍霍了日本官员连千年一遇的机会扳倒中国都喊出来了还想着辩经,2021-04-18 00:00:00
廉政包大人,吸烟严重危害公共安全请将烟草纳入禁毒法保护最多的人每日一喊市民观察员日本政府正式决定福岛核废水排海凌迟贪官人类命运共同体人民安全是国家安全的基石建设无烟城市正能量,2021-05-15 14:38:00
Minos,大概多久之后能看到活的哥斯拉,2021-04-13 00:00:00
悠游就是我,核废水处理之困日本137万吨核废水将如何处理距离日本311大地震10周年这场日本地震记录史上震级最高的一次地震引发了继切尔诺贝利核事故之后最严重的核泄漏事件眼下核废水储存空间即将饱和137万吨核废水将何去何从尽管过去了十年时间核废水处理问题仍未得到妥善解决其间关于日本政府要将核废水排入太平洋的论调多次出现引发当地居民及周边国家对海洋污染的担忧洞见计划O日本311大地震十年核废水处理之困收起全文d,2021-03-11 13:28:00
卧龙雅轩,日本倒核废水她装死提到中国倒支棱起来了O日本倒核废水她装死提到中国倒支棱起来了,2021-05-10 15:29:00
有点忙作家,许鲍鲍鞠躬达人小日本凡事都想零成本疫苗变生理盐水健康安全核污水鸿_钧_不不不按照日本宣传文案福岛的核废水是最安全的,2021-05-17 23:04:00
「已注销」,又恰不到烂钱她才不会管,2021-04-12 00:00:00
zhang00891,你有何高见,2021-04-13 00:00:00
知乎用户,我记得轻水反应堆是用水做两层内循环散热的内层水是可以循环不需要排出来啊,2021-04-14 00:00:00
四月的风和温柔的她,核废水警告,2021-05-06 19:06:00
Luyouuuuuu,Howdareyou逆光飞行好带儿油就是个笑话张宏圣好图共欣赏查看图片Esports海涛选择性眼瞎真是小丑一只乌合麒麟任何世界性质的环保机构只要是对日本核废水不闻不问却跑来指责中国环保问题的都是打压中国的政治工具当放屁就行,2021-05-09 14:54:00
Wooooooo歆,日媒曝福岛核污水排放方案如果核污水排放不可避免则到底有没有污染只能留待时间来检验了只不过这件事的悲哀之处在于万一检验失败你无法承受Wooooooo歆2021515,2021-05-15 00:00:00
壹大碗麻辣烫,赵立坚说日本不能将福岛核废水一倒了之日本真tm不是好东西尽干缺德事,2021-04-13 23:54:00
与子同袍,哈哈哈第二条作者还要加上一个全民鞠躬道歉就完美了,2021-04-28 00:00:00
长乐未央,你以为是事故人家觉得是生意以后矿泉水都能涨价了,2021-04-12 00:00:00
T-Thump,日本核污水57天将污染半个太平洋所以呢去年有热搜说日本向全世界宣布要往太平洋排核废水我就迷惑极了这是什么光明正大的好事么日本宣布了也真的排放了我真的不想知道危害有多大我只想知道解决办法和怎么能让他们付出代价,2021-04-11 19:52:00
尹亦殸,我无所谓啊日本排放核废水不影响我吃海鲜国内建核电站行业影响受抵制我也无所谓毕竟我这里真的没有核电站我只是真的觉得蛮好笑的,2021-05-05 22:49:00
鋆帆,看笑了哈哈哈绝吧,2021-04-10 00:00:00
