author,content,time
知乎用户,真的哈要是一百多万吨福岛废水灌溉了岛子可能就没人想桶衣了菜菜由以5剧捅变为以水巨桶,2021-04-09 00:00:00
WhoIsBelly,日本将放射性物质氚吉祥物形象改为元素符号T海报文字等没有变动你怎么看对日本核废水一言不发却要求中国弃用筷子这背后究竟有什么秘密这个年仅18岁的少女仅仅凭借着声嘶力竭喊几句环保口号就成为欧美政界追捧的明星人物她不但登上了大名鼎鼎的时代封面还在联合国大会上怒斥各国高官2019年12月31日格蕾塔入选2019全球最具影响力女性榜环保理念成为了她手中的尚方宝剑拿着大杀四方就连大名鼎鼎的普京也知晓她的名字几乎是一夜之间格蕾塔成为全世界知名的环保斗士然而这次日本的行为却让格蕾塔露出了她的庐山真面目撕下环保的面纱真实的面容不堪入目01在政治炒作这件事上很多精明的政客都要在格蕾塔面前甘拜下风2018年时年15岁的格蕾塔来了个神操作身为一名中学生的她背着书包举了个大牌子到国会大楼静坐示威她要干什么用罢课的方式去宣扬环保理念环保当然是一件好事情但是一个15岁的孩子用糟蹋学业的方式来宣扬环保怎么看都像是本末倒置万分荒唐这件事要是发生在中国估计都不用政府和学校出手广大家长朋友们就会果断出手教这些熊孩子学做人可是在瑞典格蕾塔却一呼百应无数的孩子都被她号召起来走出了校园走上了街头抗议其实他们中间的很多人根本就不怎么关心环保而是趁机走出课堂逃避学校的课业她的家人也都非常支持她因为这是一桩顶好的生意欧美的一些政客注意到了格蕾塔的另类行为决定把她当成一把好用的枪他们要帮助格蕾塔出圈用环保的大旗去达到政治目的当然格蕾塔一家也会得到丰厚的报酬名望财富都不在话下在这种诱惑下格蕾塔的父母非但不阻止女儿反而摇旗助威格蕾塔的母亲甚至说我女儿可以用肉眼看到空气中的二氧化碳02她是一个被成人利用的无知青年这句话出自俄罗斯总统普京之口之所以说这句话是因为格蕾塔实在是跳得太欢了2019年8月格蕾塔为了彰显环保理念乘坐一艘帆船前往美国纽约的联合国气候行动峰会在这次大会上格蕾塔一战成名她不仅慷慨激昂地大谈环保理念还怒斥各国的官员在格蕾塔的眼中这个世界是非黑即白的之所以产生环境污染都是因为各国政府没有采用有力的措施至于她提出的对策则令人哭笑不得禁止使用小轿车号召所有人都不吃肉这些话听起来天真而不切合实际格蕾塔还指责中国人使用筷子认为这造成了亚马逊热带雨林的破坏可怜的格蕾塔连一次性筷子大多来自速生树木都不知道严重缺乏常识但是一些媒体和政客却再次开始狂欢格蕾塔被捧上了神坛一时间各种报纸疯狂报道这种反常的现象背后隐藏着西方某些政客秘而不宣的真实意图环保是假打压发展中国家的发展是真他们把环境保护摆上至高无上的位置挥舞着政治正确的大棒想要剥夺发展中国家的权益因为欧美国家已经完成了工业化而亚非拉的很多国家仍然处在工业化进程之中俗话说得好屁股决定立场就像一群人在赶公交车车上非常拥堵每个人都努力想要挤上这辆车一旦拼命挤上了车却又希望车门赶紧关上因为这样可以让自己更舒适这就是目前很多西方国家的真实心态03国际社会上曾经有一种声音如果十几亿中国人都过上美国人的生活开汽车吃牛肉那么地球的生态环境是无法承受的但是这样的心思又不能拿到明面上来说俄罗斯总统普京说出了很多人的心声如果有人为了个人利益而利用儿童和青少年就应该受到谴责成年人必须竭尽所能不要让青少年和儿童陷入极端的境地西方国家几百年的工业化进程对世界生态环境造成了无法弥补的伤害英国伦敦烟雾事件就是一个典型的例子1952年12月4日至9日长达五天的时间里伦敦的废气污染达到了顶点无数市民感到身体难受胸闷多达12000多名伦敦市民死于这次的空气污染事件这仅仅是个开始而已在此后的十几年里伦敦又发生了12次类似的烟雾事件市民伤亡数量颇多而这一切瑞典的环保少女却只字不提也许有人会认为这是因为她对过去的历史不太了解可是日本最近的核废水排放事件却把格蕾塔的面具一把扯了下来4月13日早上日本通过了决议正式决定把核废水倒入太平洋此举在国际社会引发了轩然大波一旦核废水入海将对生态环境造成不可逆的影响甚至严重危害附近几个国家国民的生命健康而对于这个震惊国际的大事件环保少女却一言不发有网友形容得非常贴切格蕾塔好像一夜之间就变成了哑巴还有人在网上问格蕾塔日本正在朝海洋排放核污染的废水为什么你不发话格蕾塔视如不见始终沉默仅仅是转发了一条相关的新闻而已事出反常必有妖格蕾塔的沉默是因为她背后的金主不允许她多说什么在此之前美国已经旗帜鲜明支持日本的行为政治上的站队不同阵营的划分让美国在环保问题上拿出了双重标准对日本美国已经决定宽宏大量环保少女自然也不好多说什么了这就是吃人嘴软拿人手短04环保少女的变脸术其实值得每一个中国人警惕曾几何时有些国人也被西方社会的话术所迷惑认为西方说的环保才是真正的环保让渡中国的碳排放权换得欧美的赞赏这样的言论竟然曾经赢得了许多国人的认可甚至还有人为了西方国家的那些说辞摇旗呐喊到了今天再回头看看柴静采访丁仲礼院士的视频心中难免五味杂陈中国人是不是人为什么中国人就应该少排丁仲礼院士的质问振聋发聩面对丁仲礼院士的愤怒柴静选择了顾左右而言他如果按照柴静所站的立场中国就应该按照西方世界所定下的规矩为本国的工业发展缴纳出一笔巨款用来购买所谓的碳排放权换而言之就是西方国家在自己上车之后企图让中国花更昂贵的价钱来购买同样的车票柴静女士也许并不像环保少女格蕾塔一样对中国怀有什么恶意毕竟她本身就是一个中国人但是我们不得不说她的言论完全站在了西方国家的立场我们要不要搞环保当然要这是一个无可争议的答案绿水青山就是金山银山在当下已经成为耳熟能详的一句话中国在环保上的持续发力是全世界有目共睹的我们从来都不抵触环保我们抵触的是其他国家强加给我们的不平等条约我们的任何问题都要用自己的思路和手段去解决而不是屈从于一个瑞典环保少女的几句呓语时至今日没有任何人任何国家有资格居高临下同中国说话中国人不吃这一套,2021-04-20 00:00:00
悠悠心所期,任豪没有人比R1SE更爱R1SE也没有人比你更会处理核废水,2021-05-02 23:32:00
杏仁榛子笑,日本政府基本决定将福岛核污水排入大海缺大德了日本人,2021-04-10 15:40:00
范仙人201604,鸡蛋懒虫林瑜璟青海草圆圆爱毛胖爱国羽此时我国媒体忙着狙中央政法委战略安全与军控在线日本政府正式决定福岛核废水排海Vs美国务卿发推感谢日方明显努力,2021-05-02 18:35:00
耗子爱八卦,其实毛子提过氢弹炸福岛中美也都很有兴趣解决环境问题和核弹摧毁现代城市演练本子没敢要而且此篇的目的是让中俄牵制美军核辐射只是一个理由前提可以替换成不使用某某措施的情况下治理核废水问题结果也是一样的,2021-04-13 00:00:00
零食,一入大海就谁也控制不了了可以扔到富士山上冻起来冻个100年要是那时候日本还在的话其实本来想说冻到南极不过还是别吭企鹅们了要不马斯克的大火箭借用一下都运到太空去,2021-04-14 00:00:00
詹记的绿豆糕,狗粮到的真快哈地域黑带节奏真厉害个个都在这黑我安徽去核废水里泡泡讲不定变异下能长出来脑子呢,2021-05-14 15:09:00
千芳悦,多么反智魔幻的现实核废水还能喝咋就是不喝5G信号传新冠特么咱没有就是玩,2021-05-12 23:20:00
厕所里的板砖020,中国当然要改变啊先达到发达国家人均水平再说吧乌合麒麟任何世界性质的环保机构只要是对日本核废水不闻不问却跑来指责中国环保问题的都是打压中国的政治工具当放屁就行,2021-05-09 17:33:00
凌熙,我们应该教他怎么负责而不是替他负责,2021-04-15 00:00:00
南方日报,帮日本核废水出招知名男艺人迷之操作让人看呆了封闭该地区为核废水处理厂更令人迷惑的是灵魂画手任豪还画了所谓的更大的罩子他贴心标出中国沿海主要城市与日本南方日报2021415,2021-04-15 00:00:00
爱笑的美男子,那除了排入海中可以怎么解决批判完你还得支支招啊,2021-04-10 00:00:00
王度,韩国那边之前发现日本人拿核废水当成压仓水然后到韩国海域之后偷偷排掉极其恶心,2021-04-15 00:00:00
叽里呱啦咕噜噜唔,不服喝核废水,2021-05-03 20:48:00
-饭饼饼-,最近有点像家族群里的老一辈总会为一些看不见摸不着的消息感到焦虑对未来充满恐慌听到日本三年后要将福岛核废水倾入海洋就担心着自己以后还能不能吃到美味的海鲜和刺身又想着自己会不会在有生之年看到汉江怪物一类的变异海洋生物亦或是吃了它们以后突变的我们的同类朋友给我看美国顶尖机器人,2021-03-31 00:19:00
倩怡qian_yi,日本要倒核废水进太平洋疯了日本要倒核废水进太平洋疯了O网页链接,2021-04-11 20:51:00
剪荷诗刊,日本基本决定排放核废水会对中国百姓造成什么样的影响呢剪荷诗刊2021519,2021-05-19 00:00:00
那些天,全部不参加奥运会,2021-04-12 00:00:00
李黎昕哦,外交部日本核污染水和正常排水有本质不同针对日本有人声称中韩两国在核电站污染水处理方面的标准比日本低外交部发言人汪文斌20日回应日本福岛核事故污染水和核电站正常运行排水有本质不同核电站正常运行排水遵循国际通行标准经处理检测达标后有组织排放不是放射性废水全球核电站多年实践证明是安全可控的而福岛核事故是最高级别的核事故其污染水来自于流经熔融损毁反应堆堆芯的冷却水地下水和雨水等含有大量核裂变产生的放射性核素这些核素在自然界中原本不存在国际上没有排放先例对海洋环境及公众健康带来的影响不容忽视人民日报记者李欣怡收起全文d,2021-05-10 22:45:00
知乎用户 (作者) ,大概是iaea里赞同方的呼声大吧博弈的结果是发表出获胜方言论,2021-04-14 00:00:00
越游山海-,R1SE演唱会应援笑死粉丝还觉得自己挺牛逼的粉违法犯罪家庭出身老赖之子脚踏两只船塌房之团没读过书脑子被核废水污染的人的人就是不一样啊粉丝骂我全部反弹,2021-05-02 14:28:00
有生之莲,岛国新冠肺炎搞得我没钱了啊做爸爸的是不是该接济我一点鹰酱滚没钱岛国那我倒核废水反正你第一个倒霉鹰酱倒吧我不怕,2021-04-14 00:00:00
fufu棒棒的,组织二号头目恰这钱真是断子绝孙铜墙铁壁石头更缺德的是日本政府掏了二十亿日元来做宣传美化此次排放核废水行为大家可以看一下微博里有哪些大试图淡化这次事件那他绝对是恰烂钱了,2021-04-11 21:30:00
沉默得路人,看看那个所谓的环保少女就知道西方国家眼里环保是一张牌而不是真正的人权需要,2021-04-14 00:00:00
驀然回首的小窝,尖叫哥教你梳中分小妹的新作我和地球有個約會請大家多多指教新冠病毒肆虐核廢水生態災難輻射變種病毒人類的未來會如何你能為地球做什麼未來由你來決定全文O网页链接O我能為地球做什麼之我和地球有個約會收起全文d,2021-05-01 10:48:00
Zzzzzzzzz,rlgl看到现在最实在的发言,2021-04-14 00:00:00
被打败的小怪兽,会不会现在癌症高发率和这些核废料辐射有关系啊,2021-04-18 00:00:00
-TinnG-,冥王星1974同样因为钱的问题本来核事故废水可以用pe桶存80年再处理达标排放核电站周边空地有的是但要2亿美元政府就决定直排但同时可以一次次拔款修复因核事故损害的日本政府世界形象,2021-05-14 21:56:00
琉璃,就光光这个风险就离谱,2021-04-18 00:00:00
营养不可缺少,看来日本又要趁此机会倒核废水进海里了,2021-05-14 09:06:00
遇见彩虹糖,美国印刷美钞不会对美国经济造成影响但是可以让其他货币贬值我们泱泱大国不是他们说不好就不好的,2021-04-13 00:00:00
独行侠,说点有用的行吗,2021-04-13 00:00:00
旅行画卷,核电面临哪些挑战长见识了日本137万吨核废水将如何处理L旅行画卷的微博视频,2021-03-12 23:14:00
vb通普用户,南方人物周刊快去喝可饮用核废水你成不了有公信力的自由媒体,2021-03-11 03:11:00
古城夏雨,日本的做法还是不太负责,2021-04-20 00:00:00
哈密瓜小哈,跳梁小丑恶心至极,2021-04-18 00:00:00
欣欣向荣,所以日本这种高素质国家不取消奥运是可以理解的,2021-04-13 00:00:00
yezizey,原本还想着去日本再读个设计类专业顺便在那儿生活个一两年没想到疫情是一波又一波再加上核废水看来是得等老了去读老年大学了,2021-05-12 20:07:00
一曲图森破,难道因为一个她十四亿人齐卸甲吗,2021-04-14 00:00:00
纵横四海的刘铖峻,今天才看懂奥特曼再过几十年就是tm纪录片小日本排完核废水过个几十年人变奥特曼鱼变大怪兽日本核废水奥特曼,2021-05-06 09:19:00
咸鱼王,您的文明产生了巨著,2021-04-24 00:00:00
桑赢·,i脚盆鸡别吹了好吗把核废水喝一下,2021-04-11 23:10:00
李月亮,日本要把核废水倒入太平洋拉着全世界一起陪葬太缺德了123万吨核废水就将倒入太平洋不是123桶不是123吨是123万吨包含了核物质的废水它们带来的核污染与核辐射究竟李月亮2021412,2021-04-12 00:00:00
TB搜三哥在印度,盐酸埃克替尼片考比替尼COTELLIC是用来治疗什么的呢考比替尼口服片是罗氏公司开发的一款口服靶向抗癌药获美国FDA及欧盟批准联合罗氏自身已上市的抗癌药威罗菲尼ZelborafVemurafenib用于BRAFV600E或V600K突变阳性不可切除性或转移性黑色素瘤患者的治疗考比替尼适应症1考比替尼是一种激酶抑制剂适用为患者有不能切除或转移黑色素瘤有一个BRAFV600E或V600K突变与威罗菲尼联用的治疗2使用限制考比替尼不适用为有野生型BRAF黑色素瘤患者的治疗考比替尼是一种口服小分子MEK抑制剂MEK是一种蛋白激酶是RASRAFMEKERK信号通路的一部分该通路可促进细胞的分裂和存活在人类癌症包括黑色素瘤中往往处于激活状态考比替尼旨在选择性阻断MEK蛋白的活性从而阻断其下游的信号通路传导数据显示与Zelboraf安慰剂治疗组相比考比替尼Zelboraf联合治疗组疾病恶化或死亡风险显着降低无进展生存期中位PFS123个月vs72个月p0001显着延长客观缓解率ORR70vs50p0001完全缓解率16vs11更高考比替尼是一种丝裂原活化蛋白激酶MAPK细胞外信号调节激酶1MEK1和MEK2的可逆抑制剂考比替尼服药指南⑴考比替尼开始治疗前确证在肿瘤标本中BRAFV600E或V600K突变的存在⑵推荐剂量是对每个28天疗程的头21天60mg口服一天1次直至疾病进展或不可接受毒性有或无食物服用考比替尼如有需要日本核废水入海对中国有何影响印度特瑞收起全文d,2021-05-21 18:15:00
TDRMST,顶一下知乎现在简直是了,2021-04-14 00:00:00
徐部长,背景图交出来,2021-04-17 00:00:00
终极较量,核污水排放入海对我国影响有多大日本政府当地时间13日上午召开内阁会议正式决定将东京电力公司福岛第一核电站内储存的核废水排放入海据悉在开始排放核废终极较量2021415,2021-04-15 00:00:00
夭夭沃沃,因为东营吗,2021-04-12 00:00:00
心安处是故乡,一个字搞,2021-04-17 00:00:00
璐LLer,战略安全与军控在线日本福岛核废水中不仅含氚而且还含62种金属放射性同位素它们存在时间长有化学毒性废水中的碳14半衰期为5700年历史上从未有如此大量的放射性核素排放到海洋里去它对海洋环境及生物链带来的影响难以预料,2021-05-03 20:43:00
lilin的腦內構想,亲戚聚餐一百一人果然不同凡响生猛海鲜上了又上我面前螃蟹皮皮虾油炸鱿鱼粉丝蒸鲍鱼刚开始很高兴吃久了倍感反胃如果福岛核废水排放到海南附近可能我就会怀念这些幸福时光吧,2021-05-02 19:50:00
风云之声,科学上的弥天大谎法律上的赤裸私心再评日本核污水排放计划抱朴仙人我评论福岛核污水排放的前一篇文章福岛核污水首先是国际公德问题里主要是揭露日本以邻为壑毫无社会责任心的卑劣行径风云之声2021425,2021-04-25 00:00:00
吊儿郎当作死么骚年,具体在94还没开始写评论太多回复不完,2021-04-14 00:00:00
九月嗦,日本排放核废水危害有多大美国为什么要支持新闻资讯实时热点分析e核废水入海研究01日本将准备排放核废水入海4月13日日本政府决定以海洋排放方式处置福岛核电站事九月嗦2021417,2021-04-17 00:00:00
徐艺哲,配合长达30年的无害化拆解流程可控排放是无害化的手段之一废水本身是有害的被海水充分稀释后是无害的,2021-04-12 00:00:00
露白绀碧檀,给大家看个豆瓣鸡乐子从99开始一路视奸我们爽不爽呀气坏了但是只能咬牙切齿视奸这样所以拳师埋在我国土地上的含有为日本核废水伸冤的条幅到底能不能降解啊O浪里赤条小粗林本质上跟全母教没什么区别小号骂举报jm的人跟反女权人士抱团,2021-05-14 12:53:00
占豪,原创丨4原因曝光美国支持日本排放核污水可能是给日本挖个大坑从排放之日57天内放射性物质将扩散至太平洋大半区域10年后蔓延至全球海域绿色和平组织核专家指出日本核废水所含碳14占豪2021413,2021-04-13 00:00:00
不啻夜宵,因为中国互联网有个墙啊真想出去喷他们,2021-04-13 00:00:00
新京报,日本计划先排放7万吨核废水5月13日日本河北新报报道东京电力公司称两年后将最先排放至少7万吨低浓度核污水这批核污水的放射性氚浓度低于每升30万贝克勒尔放射性活度国际单位日本排放标准为每升6万贝克勒尔东电称会将这批核污水稀释后排放L世面的微博视频,2021-05-13 15:32:00
绝世渣男余行钧,精日那么闲就滚去喝核废水,2021-05-19 07:23:00
王小二,棒棒,2021-04-22 00:00:00
全国党媒信息公共平台,反对一倒了之核废水还可以这样处理尽管核废水中的大多数污染物可以通过相关技术手段进行去除但是在核废水中仍会有无法被净化的放射性元素氚据相关专家预测若将此次福岛核电站积存,2021-04-14 00:00:00
我是罗伊罗伊是我,日本福岛第二核电站冷却水发生轻微泄漏这么有躬匠精神的小日本们能不能一人一口把核废水分着喝了啊不行的话切腹自尽也ok的,2021-02-14 18:42:00
栗子,以后海鲜是不是吃不得了,2021-04-11 00:00:00
Robinisoutman,昨天刷微博视频看到一段哈里斯的视频里面她说以前是warsforoil将来要forwater联想到最近日本要把核废水排大海里会不会两者有关系也许美国掌握了核废水处理技术不怕所以想通过日本发动关于水的战争但这也只是猜测去年我就发现日本有种排核废水到大海的想法于是我就开始念经来阻止这件事但是可能力度不够他们还是想这么做我觉得我有必要在从新考虑念的很的来帮助一下收起全文d,2021-04-10 12:42:00
你的镜仔没改名次数版,字字粉丝在中文社交网上让人喝核废水本质上就和任豪那条微博想法一样啊让中国人帮日本人治理核废水那任豪嘲得字字粉丝为啥嘲不得了,2021-04-29 23:54:00
jsdsh,奥利安费,2021-04-18 00:00:00
超级大衰哥,牛逼挨个点草好久没看见这么专业的回答了,2021-04-14 00:00:00
学会珍惜,两者的逻辑有什么想通的地方吗,2021-04-13 00:00:00
zaker丶,高级日料,2021-04-13 00:00:00
乌市公交萍子,福岛核事故10周年福岛核电站厂房上方发现严重污染据日本原子力规制委员会10日发布的调查报告福岛核电站2号3号机组厂房上方可能附着了7万万亿贝克勒尔的放射性物质污染程度远超预期厂房还有引发爆炸的可能目前核电站内还存有超120万吨的放射性污水威胁环境和居民的安全L央视新闻的微博视频收起全文d,2021-03-11 09:36:00
一整只盐水鹅,多地发布海虹织纹螺预警核废水以后就不敢吃了,2021-05-04 16:54:00
爱因兹贝伦RCS,注意区分针对政府机构还是针对民众那个火不妥的地方在于连带上了无辜的印度民众我们和印度民众都在遭受同一场疫情同样的核废水我们和日本民众一样上受害者出到社会的一护还不是原本该做的自媒体学者等不作为逼着官媒出马它们印度外交部长都特意感谢40多个国家以及地区帮助印度,2021-05-02 18:37:00
we战队,政治投机手段请不要拿貌似公正的科学当枪使再说科学的公信力目前还没有到人人信服的程度不要为了投机政治而让千万世人承受所谓科学的不确定性人类玩核才玩几天不把自己玩死不罢休,2021-04-16 00:00:00
helloworld,总结为一句话历史的话语权掌握在胜利者手中,2021-04-15 00:00:00
小丑和猴子,两年后日本人已经排完了非常抱歉鞠躬二十年后日本人这是前人干的事和我们有什么关系我们也是受害者五十年后日本人核废水哪里有核废水别血口喷人,2021-04-13 00:00:00
没收完,uuuuu,2021-04-09 00:00:00
毛孩儿,排核废水的时候你们可没那么讲究啊L猫侠看天下的微博视频,2021-05-07 15:03:00
爱摄影的小杰杰,精日真会吹艾玛多喝点核废水就不埋汰了尹先生999图片评论评论配图,2021-05-16 23:54:00
虞余雨丶,肖战喝光核污染废水拯救地球支持割割,2021-05-01 23:32:00
反射弧太长,为什么不威胁小日本呢比如它排核废水就把东京气化了呀反正都是一起死就让它先死,2021-04-14 00:00:00
1三哥在印度微信kk600167,唑来膦酸浓溶液我不舒服永嘉轻推了推沈邵想躲开他贝罗司他胶囊Enhertuds8201司美替尼沙妥珠单抗吡非尼酮胶囊艾思瑞环丝氨酸奥利司他Darvadstrocel恩杂鲁胺Xtandi恩杂鲁胺Enzalutamide力如太Rilutek利鲁唑片Riluzole拜瑞妥利伐沙班片莫西沙星PIQRAY阿培利司普雷西替尼普拉替尼马法兰鲁比卡丁伏立康唑威凡凡德他尼博舒替尼厄达替尼盐酸埃克替尼片凯美纳福避痛卡麦角林图卡替尼色瑞替尼瑞普替尼ripretinib印度特瑞永嘉心想待陆翊伤好要将荷包送给他日本核废水入海对中国有何影响收起全文d,2021-05-01 13:34:00
哈哈欠为你违逆,微博精选任何世界性质的环保机构只要是对日本核废水不闻不问却跑来指责中国环保问题的都是打压中国的政治工具当放屁就行乌合麒麟,2021-05-20 00:36:00
凌晨6点的闹钟-,任豪没有人比R1SE更爱R1SE这也能上热一就nm离谱互联网真的都没有记忆的吗粉丝跟着去喝核废水吧真的吐了,2021-05-02 23:16:00
春田李李,真是他娘的就无语,2021-04-21 00:00:00
大狼鲸,这十年只是在泄露没有排放吧,2021-04-17 00:00:00
岭东烈女,我千万不能失恋我要是失恋了得怎么哭把太平洋核废水冲淡,2021-05-18 22:16:00
朋Zi远方,当时的反对声音挺大的现在不也都消失了吗这种现象正常,2021-05-10 00:00:00
徽州反邪教,日本福岛县核辐射野猪泛滥福岛53个核污水罐因强震位移小央视频L安徽反邪教的微博视频,2021-02-26 18:45:00
xean,联想到之前的为水资源而战很难不怀疑这是美国授权让日本演的一出大戏,2021-04-12 00:00:00
贝壳,其实老美也不信任这还没开始排呢FDA就已经对日本海产品发警示了但我想知道的是如果开始排了以后真出现问题了咋办而且建几个罐子为什么连抗震都做不好就算一开始比较仓促现在已经过去十年了当初建核电站的工程比这简单还是建抗震的罐子太贵了,2021-04-14 00:00:00
大仔,如果将137万吨核污水倾倒进大海德国海洋科学研究院认为日本从排放之日起在57天内放射性物质就将扩散到太平洋3年后就将覆盖美国和加拿大5年后就会到达北美大陆10年后会回流到东亚和污染太平洋30年后这些放射性物质将会遍布整个世界而对邻近的韩国中国俄罗斯朝鲜这四个国家影响最大还会波及到全球的鱼类迁徙远洋渔业生态安全食品安全生物基因等成为世界性的长远灾难因为核污水中的放射性核元素在数千年内都不会彻底消失,2021-04-20 00:00:00
倬柏nazhifangGOKOD8,10年前日本为证明福岛净化的核废水让官员喝下后来怎样了,2021-05-11 21:55:00
你猜我是谁00,日本到底现在排了没有,2021-04-21 00:00:00
