author,content,time
早安种花家,我提一个方案ww日月潭正在缺水可以考虑资源有效利用一下,2021-04-13 00:00:00
韩国华人社区,原本奋战在抵制日本核废水一线的韩国一天之内放弃抵抗每天中午12点公众平台回复数字1获取最新疫情地图导语是什么原因让原本奋战在抵制日本排放核废水问题一线的韩国一天之韩国华人社区2021422,2021-04-22 00:00:00
Back,简直了怎么活啊,2021-04-15 00:00:00
Mikyo_G,福岛核废水57天可废掉半个太平洋吃货们醒醒这个节骨眼连常识都没有吗别脑子里只想着海产品能不能吃先想想自己小命还保不保吧,2021-04-13 23:49:00
青小小,外交部回应日本核废水入海据央视新闻消息今天上午日本政府召开相关阁僚会议正式决定将东京电力公司福岛第一核电站内储存的核废水排放入海消息一青小小2021413,2021-04-13 00:00:00
香港商報網,日本核污水入海引发韩国抢盐潮港府已要求日本提供核废水资料日本决定将福岛核事故污染水排放入海后相关影响仍在不断发酵韩国近期甚至引发了海盐的抢购风波海盐已经热卖到脱销据韩媒报道韩国主妇担心本国临近海域的海水会受到污染届时晾晒出的盐会含有放射性物质就提前开始疯抢海盐目前韩国市场上每公斤海盐的批发价格上涨至450韩元约合港币3元1毛报道称短短一个月内就翻了一番出现这样的涨势非常罕见香港食物及卫生局局长陈肇始今日12日在立法会会议上表示特区政府极度关注事件要求日本当局必须提供一切相关的资料再交由专家评估所谓经稀释的核废水是否仍然含有放射性物质评估食用安全视频徐麒钊L香港商報網的微博视频收起全文d,2021-05-12 16:06:00
陸上鯊魚,核废水嘿哈紧跟时事油管还有一个预告片套路嘿哈光是字也很精彩骄阳小麦继续有画面了,2021-05-08 14:59:00
Arrrrrzu_福佳白,二鬼子怎么又集体出动了外务省经费不够了这种能力的二鬼子都要买啊原来核泄漏是地震海啸造成的啊我还以为是拿小男孩炸的呢啊原来核灾难不是日本政府打死不处理核废水直接排到海里是中国网民用冷眼造成的啊,2021-03-11 20:13:00
STRIKER,累不累啊,2021-04-29 00:00:00
全国社畜代表,话说这点废水又不多每位日本国民平均一下18每人一天喝5升4天也就解决了有这么难吗,2021-04-14 00:00:00
不墨,日本副首相说核废水喝了没事建议日本人一人一口把核废水喝光这是不墨的第386次推送昨天日本决定向大海排放核废水的新闻大家都看了吗我看完只有一个感受日本人做事是真tmd恶心啊不墨2021414,2021-04-14 00:00:00
Change,骂日本什么用有空地方的国家倒是帮忙装啊自己装不下了能怎么办,2021-04-13 00:00:00
ego85,打开新闻又是新冠又是战争又是核废水又是污染横竖就是个死干脆坦然入睡,2021-04-11 19:49:00
Chocological,dvdgfhfhr,2021-04-12 00:00:00
知乎用户,环境适应性强的自由生活生物变成病原体的情况有相对少一般没事,2021-04-13 00:00:00
魏雨绸缪,我读书少但是我数学好啊咱们来算算账哈现在每天的废水产生是140吨那一年365天就是5万1100吨咱们算个100年那就是511万吨的废水现在东京电力装了137万吨也就是说只要再修4倍大小的储水罐未来一百年就不用担心了有种预感要有圣母提议在中国沿海地区建核废水储罐来容纳日本的核废水了,2021-04-10 00:00:00
小梗,拜登没料到日本还没排核废水菅义伟却先让步了韩国这招真绝日本菅义伟政府已经做出了决定将会把福岛核污水排放到大海之中国际社会高度关注世界各国纷纷反对其中韩国的反对声音小梗2021428,2021-04-28 00:00:00
热力,就事故以来东电的行为你相信他单方面公布的这个数据国际社会应该长期检测入海口的水质确保东电排放的核废水能达到你引用的图上的标准这对日本对全球其他国家对整个人类都是有益的,2021-04-26 00:00:00
幻想杀手,日本人民好客的嘛请世界人民免费喝核水此条5毛,2021-04-15 00:00:00
罗爷说法-law,罗爷睿评V光计划日本如果一意孤行将核废水排向大海那么喜欢吃海鲜的朋友为了自己及家人的健康一定要注意了目前中国是日本的主要海鲜进口国给大家列举一下日本出口中国最多的海产品1扇贝日本有七成扇贝出口到中国2金枪鱼日本出口到中国的鱼类金枪鱼占比最高3鳕鱼秋鲑鲣鱼这三类鱼也不少主要销往北京上海广州等城市建议大家以后对日本的海鲜保持距离为了自己和家人的健康必须要控制住嘴吧收起全文d,2021-04-10 13:06:00
你认错人了喔,日本政府基本决定将福岛核污水排入大海狗日的,2021-04-10 16:21:00
不要名字,思想别那么黑暗多往好处想想比如火山爆发太平洋大海啸陆沉之类的呢,2021-04-17 00:00:00
辣叶摧秋,三年前鄢烈山大言不惭表示日本追求的核污染处理是彻底处理如今日本人要把核废水直排太平洋这难道就是鄢烈山们所谓的彻底处理,2021-04-10 23:00:00
一只孤独的doge,httpswwwzhihucomquestion453841951answer1833267043看看逐段驳斥呗,2021-04-14 00:00:00
zhouyn,把日本解放了就好了,2021-04-15 00:00:00
ELEPHAS,妙啊,2021-04-17 00:00:00
咕咕咕,要说一尘不染我看还得我们中国我家这边街道上天天水车洒水环卫大姨们全天巡逻,2021-04-19 00:00:00
奎奎同学,还是扔几个氢弹过去解决吧太平洋不比日本这个弹丸小国重要多了小日小日子过得不错的日本人缺大德了海的那两边的分别是你的爹和祖宗啊,2021-04-13 00:00:00
警晓慎为,看看小鬼子素质就是高它们从来不乱扔垃圾它们只是乱排核污水滚滚说道日本福岛核污水要下海渔民怒了据日媒报道4月9日一意孤行的日本政府已基本敲定将福岛核电站废水排入大海的计划byL青蜂侠Bee的微博视频,2021-04-10 13:43:00
没有心理理论的马克西,众筹福岛核废水送给她霜叶核饮料她喝了没江宁婆婆转发微博查看图片,2021-05-09 11:49:00
太极是一种理念,进行军事经济制裁,2021-04-15 00:00:00
悠游的爱丽丝,我想问一下这些废水全排掉会很严重吗个人近期网上看来也就看见几个国家劝告日本本土人民不痛不痒的抗议,2021-04-13 00:00:00
马良只画赫小花,百万吨核污水入海多可怕日本这波操作非首次9日日本政府基本决定将福岛核污水排入大海的消息引发关注这已不是日本第一次向太平洋排放核污水自2011年至今福岛核电站上千个大型储水罐中已储存超过120万吨核污水核污水排入大海后果如何日本政府拟排放的核污水中仍残存氚放射物专家推算一旦被排入大海这些污水会随着太平洋洋流污染世界多地据了解核辐射既能杀伤细胞又有诱变的作用可能诱发细胞癌变或基因突变导致生物畸形等短时间内摄取剂量一旦超过100毫希沃特人体就会受到伤害如果超过4000毫希沃特将会直接导致死亡详情戳O图解百万吨核污水入海多可怕日本这波操作非首次L中新视频的微博视频收起全文d,2021-04-09 15:26:00
大俊之路养柴富啵,现在太多人享受一丁点服务就飘了就人上人了建议这些不尊重别人服务的都去喝核废水,2021-04-10 18:43:00
YoungTalk,如果在印度恒河水和日本核氚水中必须选一瓶喝你会选哪个日本确定核废水排入太平洋美国为什么支持俄罗斯建议用氢弹,2021-05-20 00:00:00
不可不283747007,日本140万吨核污水或将排入大海撒谎惯犯却称不会污染海鲜O网页链接,2021-04-10 18:27:00
果酱rr,明日方舟覆朝之下就是nm核废水5555笑死后面根本过不去太弱小了就是因为我没有力量,2021-05-08 20:43:00
有趣的两脚兽,我在想他们把海洋霍霍出了哥斯拉海洋航运不再安全最后会不会便宜了陆权国家,2021-04-13 00:00:00
620387,现在东电说是从日本南到北广泛排放不知道是不是想往东边两个老冤家多排一点属实的话冲绳人又要为皇国捐躯了,2021-04-14 00:00:00
糖肽腙,别排放了我们发起引民计划引日本人民来中国生活和工作成立单独的生活区当这一计划在国际上发表会给我国的形势带来至高的影响力具体内容可以百度搜索改变人类历史的中国环境引民计划,2021-04-14 00:00:00
北风不知北,福岛核电站储水罐已多次泄漏前两天看到新闻说日本海域发现变异鱼是不是和核废水泄漏有关系啊2重庆,2021-05-16 22:28:00
减肥不到90斤不发博,你们的岛底部应该是有冰层的溶化了你们岛冰层的水导致海平面上升或者就是整个世界的海洋水液体传播介质都被核辐射的污染废水中的化学物质融化了整个海洋冰层牵连到了南极或者北极的冰溶化了这个也合理,2021-04-10 19:43:00
在下小林,原来资本对媒体的掌控这么可怕,2021-04-15 00:00:00
一只鱼瑜瑜,乌合麒麟任何世界性质的环保机构只要是对日本核废水不闻不问却跑来指责中国环保问题的都是打压中国的政治工具当放屁就行,2021-05-09 15:51:00
易平,看到这些说法就知道为什么美国人打死也不戴口罩不打疫苗了就这群科学家他们说的话美国敢信才有鬼了,2021-04-14 00:00:00
wkconnor,我围观了褚明宇的回答该问题价值219800元围观仅1元快来一起围观O微博问答,2021-05-15 23:10:00
沉迷奶茶不知今夕何年,任豪没有人比R1SE更爱R1SE没有人比你更懂处理核废水,2021-05-02 22:14:00
咳咳,好家伙对付文化人才讲道理对付流氓就得用流氓的方法太对了,2021-04-30 00:00:00
摄影师WilliamYan,我参与了鍋盖頭司令发起的投票你觉得日本应该为核废水排泄赔偿么我投给了应该这个选项你也快来表态吧,2021-05-17 06:28:00
魔某人,秀儿等我用青龙偃月刀给你削个苹果,2021-04-22 00:00:00
FlowerLalala,现在知道布林肯去日本谈了什么以及日本为啥最近跳的这么欢,2021-04-09 00:00:00
削战割割,这张图片以前好像用过,2021-04-19 00:00:00
仙女,共产党万岁打到日本小人主义,2021-04-16 00:00:00
奶冻与鱼条,乌合麒麟任何世界性质的环保机构只要是对日本核废水不闻不问却跑来指责中国环保问题的都是打压中国的政治工具当放屁就行,2021-05-09 14:20:00
万物治愈2021,排核废水嘛比是疯了吗,2021-04-10 13:09:00
维特,哈哈哈哈,2021-04-13 00:00:00
胖丁的甜甜圈,战略安全与军控在线日本福岛核废水中不仅含氚而且还含62种金属放射性同位素它们存在时间长有化学毒性废水中的碳14半衰期为5700年历史上从未有如此大量的放射性核素排放到海洋里去它对海洋环境及生物链带来的影响难以预料,2021-05-03 18:45:00
四川省崇州监狱,日本计划两年后开始排污入海据日媒日本政府基本决定将福岛第一核电站的核污水排入大海以两年后开始排放为目标此计划遭到日本民众环保组织及国际社会的抗议和谴责联合国人权专家曾发表声明指出将核污水排放入海会提高危害孩子们未来健康的风险日本福岛辐射污水已达125万吨L环球资讯的微博视频张警官分享张警官说狱事儿法治四川四川监狱收起全文d,2021-04-10 20:12:00
乌力,你把角色划分民族就看懂了盎撒民族脚踩汉族香港帮拳打俄熊俄国黑帮还割犹太人的肉致敬威尼斯商人,2021-04-14 00:00:00
东街油条,任豪没有人比R1SE更爱R1SE核废水喝了没,2021-05-02 23:15:00
ysm我的超人,肖战偷喝日本核废水拉稀拉到富士山火山口导致火山喷屎肖战偷郑爽卵子给张恒代孕喝喝不愧是giegie,2021-05-04 14:56:00
知乎用户,第一早就开始少量的排了第二现在污水已经没地方装了只能往海里稀释不然你说怎么办,2021-04-09 00:00:00
花朵财经,福岛核事故10周年福岛核电站厂房上方发现严重污染据日本原子力规制委员会10日发布的调查报告福岛核电站2号3号机组厂房上方可能附着了7万万亿贝克勒尔的放射性物质污染程度远超预期厂房还有引发爆炸的可能目前核电站内还存有超120万吨的放射性污水威胁环境和居民的安全L央视新闻的微博视频收起全文d,2021-03-11 13:54:00
叫哥拽爷_,唐山提醒近期不食用野生毛蚶海虹前几天看着盘里的大虾还在想也许这是最后一顿又是疫情又是核废水的海鲜咋吃今天唐山也提醒近期不食用野生毛蚶海虹这辈子不吃海鲜比较安全但是动物要喝水人要喝水地球太难了,2021-05-17 14:09:00
桃柠,乌合麒麟任何世界性质的环保机构只要是对日本核废水不闻不问却跑来指责中国环保问题的都是打压中国的政治工具当放屁就行,2021-05-13 18:56:00
弓长志远同学,帝吧官微估计日本几年前就开始偷偷往太平洋里排核废水了,2021-04-11 18:47:00
优质美女鸭鸭,多吃海鱼沿海人经商能力强就是因为经常吃海鱼不是人工养殖鱼浅水鱼要吃深海鱼脑子不灵光的趁日本还没倒核废水之前多吃点,2021-05-11 14:09:00
·小魚夹心·,12月起海南全岛禁塑可降解塑料制品是普通塑料袋价格两倍五小小路说如果有一天基本解决了环保问题也许美人蕉更像美人所以反对日本福岛核废水排海支持海南全岛禁塑但是可降解塑好像太贵如果免费或更便宜好像更完美当今天下工业废品无处不在正在危害城市正在危害广大的农村根本原因是很多人不知情根本原因是知情也不以为然根本原因是环保成本日本政府正式决定福岛核废水排海12月起海南全岛禁塑可降解塑料制品是普通塑料袋价格两倍嗯嗯好的时候嗯嗯嗯嗯嗯O12月1日起海南全岛禁塑对此你有何看法你平时有禁塑意识吗你所住的城市有在进行垃圾分类吗收起全文d,2021-05-10 03:08:00
午饭,闭着眼睛搞科普的人应该身体力行地消化一些安全的核水不忘初心走进科学,2021-04-15 00:00:00
析修竹灬,瘦身美容燕麦蜂蜜去角质面膜奶酪1小片蜂蜜2大匙苹果半个蛋清1个水适量将燕麦片放入废水中拌匀用大火煮至糊状苹果洗净去皮去核切成小块倒入榨汁机中榨取汁液将苹果汁蛋清奶酪蜂蜜加入燕麦糊中调匀洁面后将面膜均匀地涂于脸上避开眼唇部10到15分钟后用清水洗净即可收起全文d,2021-03-19 04:21:00
深度工场,有美国撑腰日本才敢干出排放核污水这种伤天害理的勾当才会出现欧美国家以及环太平洋国家惊人地对此一致保持沉默美国为什么要支持日本排放核污水欧洲那些圣母们为什么对这种破坏地球环境的事情保持集体性沉默,2021-04-15 00:00:00
生态梦人,海洋遭遇核打击日本政府计划将福岛核污水排入大海2011年日本311大地震引发福岛核电站核泄漏之后为了避免福岛核电站堆芯熔毁核电站引入海水给反应堆降温因此持续产生核污水预计到明年秋天东京电力公司准备的约1000个污水存储罐将全部装满根据日本媒体报道日本政府计划13日召开内阁会议正式宣布将核污水排入大海的决定而这遭到了包括日本渔业协会在内的多方强烈反对日本政府目前透露的计划是以两年后开始排放核污水为目标开展准备工作其实关于怎么处理核污水日本经济产业省曾经提出蒸发释放地下掩埋等五种方案最终得到日本政府支持的是排放入海东京电力公司表示经过处理核废水当中的绝大部分放射性元素都可以清除但是氚没有办法清除他们会把废水里氚的浓度稀释到日本国家标准的140不会对海洋造成污染渔业是日本一个重要的产业渔业协会一直反对将核废水排放入海日本311大地震已过去十年福岛的农产品在日本都还没有恢复信誉如果核废水入海对日本全国的渔业来说恐怕都会是一场危机对于核污水排放入海很多福岛居民也表示不满有人认为日本政府开了很多形式上的说明会但是讨论都是基于把核污水排放入海作为前提还有家族世代是渔民的当地年轻人担心父辈们无法再捕鱼自己的学费都会成问题日本政府2020年10月曾经计划就核废水的处理作出最终决定但是打算把核污水排入大海的消息一出遭到日本国内渔民福岛当地民众和国际社会的强烈抗议和谴责随后日本政府表示暂不作出最终决定央视新闻收起全文d,2021-04-10 19:50:00
快乐金帛,日本福岛核污水罐被地震震歪了据日媒报道东京电力公司称13日福岛附近海域发生73级地震后公司对福岛第一核电站的1074个核污水储存罐进行了检查发现福岛核电站53个核污水罐因强震发生位移偏差在3厘米到19厘米之间不过该公司表示这些核污水储存罐只发生了位移未出现泄漏L人民日报的微博视频收起全文d,2021-02-27 18:45:00
过期的红卒,天杀的小鬼子,2021-04-15 00:00:00
绝情绝缘绝版绝望,东京饮用水致癌物严重超标全球村的今天人类命运共同体印度美国等不重视防疫抗疫的国家有其可悲的一面也有其可恨可恶的一面日本向海洋泄露核废水偷偷排放核废水公开表示要排放核废水等说明有小礼而无大德的日本在有一条危害自己更危害他国危害全世界的事情其他国家跟着倒霉日本真是可恨收起全文d,2021-05-03 23:15:00
Clarity,以后生物圈没有什么是健康的了大气环流降水将把辐射沾染到所有生物体上而放射性物质半衰期是8000年自己想想吧,2021-04-13 00:00:00
十个为什么,那日本过滤吗,2021-04-16 00:00:00
二百依附宿将J,不是说不去吗去哪里喝核废水吗,2021-05-13 10:10:00
日本通,从10年前说起福岛核废水的前世今生本文将会从十年前的那场灾难开始全方位解读福岛核废水的前世今生解答围绕福岛核废水的众多疑问这两天发生的事情大家都知日本通2021416,2021-04-16 00:00:00
泡泡糖的梦幻,核污水入海对照苏联看日本人的素质和责任心O核污水入海对照苏联看日本人的素质和责任心,2021-04-10 18:34:00
鹅毛似雪,向日本扔两颗原子弹,2021-04-13 00:00:00
雨滴里的鱼,想当年给中国当狗腿子的时候中国什么时候这么逼过日本,2021-04-21 00:00:00
知乎用户,那个瑞典的格里塔好像真没吱声,2021-04-14 00:00:00
错过,听说过海水提铀技术吗,2021-04-13 00:00:00
云羽落,不能陪钱么按照人口全世界每个人每年1000美金这样,2021-04-09 00:00:00
草帽小子_Maxwell,无耻垃圾日本人一生洗不清,2021-04-09 17:17:00
星球视频,福岛核事故的废水究竟是怎么回事星球视频APP发现更多你热爱的视频安卓及iOS下载地址O网页链接,2021-02-21 10:30:00
Robin,敢这么做一到公海就被截停击沉,2021-04-15 00:00:00
清水涟漪,亚圣嘛合理,2021-04-14 00:00:00
第28个小号了,我就是进来找惊喜的,2021-04-15 00:00:00
奔放di小妞,日本首相菅义伟此次地震不会引发海啸相关核设施无异常日本首相称此次地震不会引发海啸日本首相菅义伟14日凌晨在首相官邸表示日本福岛东部海域13日晚间发生的地震不会引发海啸相关核设施无异常目前没有地震造成重大人员伤亡的报告日本气象厅14日凌晨将此次地震发生的时间由最初公布的当地时间13日23时08分修正为23时07分震级由71级修正为73级震源深度由60公里修正为55公里据日本媒体报道地震发生时日本福岛县和宫城县震感强烈目前两县共有50多人受伤两处发生火灾央视新闻O日本首相菅义伟此次地震不会引发海啸相关核设施无异常L澎湃新闻的微博视频日本修改震级为73级日本地震造成大范围停电日本71级地震留学生录下日本地震惊险一幕江苏人在日本亲历地震日本福岛第二核电站冷却水发生轻微泄漏收起全文d,2021-02-14 07:56:00
小早川 (作者) ,那只是因为触及到了大家的痛点如果他们没干只是大家瞎几把编谁会看呢就跟在海外黑中国一样黑缅甸能有人看么,2021-04-13 00:00:00
萝卜头,氢弹可以解决,2021-04-12 00:00:00
我就是小圆子呀,支持日本自产自销能喝就让他们世世代代喝完,2021-04-13 00:00:00
yoy罐装奶茶,1921选角建议选角导演打包去日本喝核废水,2021-05-13 19:20:00
知乎用户,三名党员那一段前后建议改一下会造成小小的误解三位日本的哦是苏联的啊,2021-04-14 00:00:00
LDMQ20200329,央视新闻如何看待日本福岛核废水排海LLDMQ20200329的微博视频,2021-05-13 23:14:00
豺狼不吃鱼,暗搓搓的用福岛核废水洗澡,2021-04-10 23:22:00
刚下飞机,planC卖给湾湾让他们当水喝既解决了台湾缺水问题又解决了核废水还顺带解决了台独让他们无话可说,2021-04-12 00:00:00
Cathy,就算眼前危害的是邻国那些靠海岛旅游的国家以后没人敢去敢吃了难道不应该发声吗,2021-04-16 00:00:00
眉弯,世界仿佛都沉默任凭日本在作死对其他国家来说保护生态环境只是说说罢了,2021-04-14 00:00:00
兰若兮,各个国家众筹捐多点罐子给日本但就是不能排到海里,2021-04-15 00:00:00
立華結弦,人类还是早点灭绝好了巴不得全人类一起死,2021-04-14 00:00:00
现实五郎,好个躬匠精神呢国内二鬼子谁再帮这帮烂渣种说话就带着他们天天喝18吨核废水这很难吗,2021-04-11 23:09:00
光阴会为你容留最真的人Kim,多方表态反对日本核废水入海坚决反对日本政府的下作之风请保护海洋金瀚KimF,2021-05-02 21:22:00
战忽局华中局五号,中韩可以向西方国家喊话谁支持日本这么做就把核废料运送到谁家去中韩负责包邮,2021-04-13 00:00:00
雪鸿,日本人就是自私自利的坏种虽然不乏有好人但是这个民族也就这样了,2021-04-21 00:00:00
蓝铅笔快乐学,高三学生即将去日本东京留学现在面对福岛核泄漏事件该怎么办事件起因当地时间四月九日记者会上菅义伟表示将向太平洋排放污水其实日本很早就偷偷排了中日韩以及东南亚的监测机构都曾经监测出来海水放射性异常只不过这是日本政府第一次明确表示要将废水排放入太平洋在ytb用radioactivewaterJapan作为关键词搜索时间限定一周内播放量最高的是中国的两个视频但也仅仅只有3万左右的播放量1为什么在这个问题上各大媒体集体失声2ytb起到了多大的限流作用而且最近日本NGO发展组织的广告出奇的多结合美剧切尔诺贝利还真就是苏联全力抢救人类公敌日本肆意倾倒世界救星西方就是这么个玩意明白了吗以下是一篇帮我纠正的文章感谢紫炀紫炀如何看待美国对福岛排放核污水毫无表态wwwzhihucom但是我觉得日本四月九日发布的决定时间放宽并不合适摊牌了,2021-04-13 00:00:00
菏泽日报,日本福岛核污水罐被地震震歪了据日媒报道东京电力公司称13日福岛附近海域发生73级地震后公司对福岛第一核电站的1074个核污水储存罐进行了检查发现福岛核电站53个核污水罐因强震发生位移偏差在3厘米到19厘米之间不过该公司表示这些核污水储存罐只发生了位移未出现泄漏L人民日报的微博视频收起全文d,2021-02-27 19:01:00
春呐老夫子,如果有一天去海边都要担心有核污染那那片我喜欢的蓝也就只能在照片里说给孩子听了邹瑜鹏J神摄影厦门约拍日本政府正式决定福岛核废水排海2厦门,2021-05-21 19:18:00
Benny刘宗源的记忆之源,凤凰新闻遭核辐射后83天他成了世界上死的最惨的人前段时间日本单方面向全世界宣布我们做了一个非常缺德带冒烟儿的决定将福岛核废水排放入海而与此同时一个数据惊呆了所有人福岛核现有污水已超过120万吨消O手机鳳凰網来自凤凰新闻客户端,2021-05-07 11:09:00
米奇妙妙,妙蛙,2021-04-18 00:00:00
Eric Lee,出书懂,2021-05-04 00:00:00
walkalone,希望赵立坚也想到了这一点让日本人把这些水都接到自来水厂去吧,2021-04-18 00:00:00
知乎用户 (作者) ,难道还能给你没处理超标的数据,2021-04-14 00:00:00
符合兴趣的微梦创科,关你本子鬼事呢处理好你的核废水了吗,2021-04-05 21:11:00
知乎用户,谁家没点核废水啊他们来倒我们不会倒回去啊大不了地球完蛋一起拉倒,2021-04-16 00:00:00
七月半的十二,日本政府正式决定福岛核废水排海如何看待日本福岛核废水排海2021摄影毕业季丨郭月婷核污染之后食物的味道O2021摄影毕业季丨郭月婷核污染之后食物的味道,2021-05-05 14:22:00
Jsnj1,垃圾分类做那么好这个民族真是虚伪到骨子里了,2021-04-10 00:00:00
