,博主昵称,微博内容,发布时间
8642,少管我我凶,进入三次方鲨姐们最厉害的武器就是他们哥哥的图真的有话好好说想来抢超话就正经点大胆开麦骂唯九粉艾回粉不行吗不懂骂我教你们骂你鲨爹来了汉奸二鬼子艾回粉跟你们哥哥一起游过太平洋去喝核废水吧骂啥都行就别放你家哥哥的图啊啊啊啊啊啊啊太洗胃啦,05月03日 22:42
787,Naly2i_,号手就位里的引战弹幕我见一个炸一个宁们也太较真辣日本倒核废水没说去管管笑死,05月06日 13:01
7861,我的前半V带你,任豪没有人比R1SE更爱R1SE反正我是不追爱豆的你们追星也不找个好点的追刚开始约网红后面又说疫情带什么口罩然后又说帮日本核废水你说一起成长好又深夜去酒吧还跟小姐姐甜蜜双排你们为他反黑委屈受累他还找快乐消遣真的任豪的粉丝换个爱豆吧大多数学生吧等你们以后出来工作你就知道你们当初有多傻收起全文d,05月02日 22:56
4293,Renaissance__Z,哇唧唧哇INTO1官博两个贱人打包一起滚那么爱舔臭脚一起去喝核废水吧,05月14日 00:02
9447,就想瘦个十公斤吧,在教我老表的过程中也谈了不少关于日本的事情她从短视频中看到很多美化日本的东西虽然也知道核废水的事情大多数我这个年龄段的人都看清了日本是怎么坏怎么双面人对日本不应抱有过多好感但是外务省经费毒害比我小十几岁的老表这真的不可以没想到我还得教政治,05月04日 19:26
7660,Zhu-海宁change越权,瘦身美容燕麦蜂蜜去角质面膜奶酪1小片蜂蜜2大匙苹果半个蛋清1个水适量将燕麦片放入废水中拌匀用大火煮至糊状苹果洗净去皮去核切成小块倒入榨汁机中榨取汁液将苹果汁蛋清奶酪蜂蜜加入燕麦糊中调匀洁面后将面膜均匀地涂于脸上避开眼唇部10到15分钟后用清水洗净即可收起全文d,05月02日 23:45
4186,毓JTka841,日本药详解皇汉堂清肠便秘丸许久沈邵慢慢冷静他眼底神色凛冽派人去追抓到了格杀勿论血液淋巴瘤骨髓瘤常用品种艾曲格列卫尼洛替尼氟马替尼来那度胺泊马度胺维奈拓克米哚妥林索拉非尼吉列替尼安必素马针马片普乐沙福CD19单抗CD22单抗CD33单抗CD38单抗依库珠单抗颉更昔洛韦硼替佐米普纳替尼米托恩昆西多福韦cart恩西地平卡泊芬净西达苯胺去纤苷印度特瑞永嘉听着芸香的回答不过是太医们的车轱辘话十次病九次是这样的答复日本核废水入海对中国有何影响收起全文d,05月14日 08:15
7816,大婆教牌坊精快离开,任豪没有人比R1SE更爱R1SE没有人比你更懂日本和核废水,05月02日 23:06
3507,无业小网民,日本政府正式决定福岛核废水排海自创小短文望大家加以订正,05月13日 23:42
113,来者建强,来看热点敢不敢肿瘤治疗黑幕爆料者张煜医生再发声卫健委专家团敢不敢与我公开辩论浙江湖州境内高速6车追尾致6死3伤货车工字钢条散落砸死尾随两小车内人中疾控3名重庆入境回国人员疑从印度感染变异病毒印度西孟加拉邦大规模骚乱已致31死日本两年后能否如愿排核废水关键看中美关系走向,05月05日 19:46
5791,所念皆是星河光,核废水泄露后平时挺可爱的小生物都变得巨大无比了L所念皆是星河光的微博视频,05月20日 15:01
8578,汐--玦,小时候觉得死后骨灰撒进海里是一件很凄美浪漫的事现在想想死了还要喝核废水可真悲哀还不如入土为安化作春泥更护花,05月03日 23:23
6266,爱你6049529603,日本核废水倒入大海将彻底核污染东海和太平洋应该让日本赔偿鬼子还一天到晚想武力阻止我们统一台湾应该让鬼子赔偿核污染造成的损失我正在使用央视影音客户端观看日本核污水入海57天将废掉大半个太平洋邀请您一同观看L中国新闻日本政府基本决定将福岛核污水排入大海,04月11日 22:08
1299,叶伟烜,核废水排放的话你还会吃海鲜吗,05月07日 10:22
9798,吴子房_85750,日本决定把核废水排入大海给中国造成巨量伤害赵立坚立马表态据环球时报报道日本已经决定将福岛第一核电站的核污水排入大海消息一出舆论瞬间炸锅他们认为日方的行为将遭致国际社会的强烈反对O网页链接,04月10日 21:09
8231,薄丝妆,任豪没有人比R1SE更爱R1SE有被恶心到没有人比你更恨R1SE吧在团期间整出这么多破事影响团还好意思说出这话谁给你的脸啊要真这么闲就去处理你的核废水去讲这话骗谁呢不会真以为能给粉丝整泪目吧,05月02日 21:54
1261,三哥在印度微信kk600167,考比替尼白伊简略向灵茵说了一下对花淇淇的安置方法末了说花姑娘自己住在洞府里暂时不太稳妥你先去收拾好那里和她同住一段时日吧一口气跑下来相同的时间跑步机比手表多一公里卡路里也多了100多千卡畅快曲美替尼卡比替尼靶点MEK淋巴瘤Brentuximab靶点CD30依鲁替尼靶点BTKIdelalisib靶点PI3K罗米地辛伏立诺他Belinostat苯达西胺靶点HDAC硼替佐米卡非佐米伊沙佐米靶点蛋白酶体Proteasome白血病伊马替尼靶点ABLPDGFRKIT尼洛替尼达沙替尼博舒替尼靶点ABL普纳替尼靶点FGFR13VEGFR215岁少年脖子不痛不痒长肿包一查竟是癌转移印度特瑞楼歌浑身一僵退了一步日本核废水入海对中国有何影响收起全文d,05月07日 12:04
4498,海底遇水温柔,古城忆往事等日本人喝光核废水他们就叫夸父300封的柠檬神我们会有夸父吧好期待,05月15日 11:51
4116,黄瓜炸青汁,回复故国山河尽变色迪迦奥特曼有一集好像就是讲保护海洋环境的分分钟打日本政府的脸故国山河尽变色回复黄瓜炸青汁为什么听到你说日本排放福岛核废水我有一种想看迪迦奥特曼的冲动呢黄瓜炸青汁还有空操心别人,05月14日 10:32
6437,筱虞嫣然,有什么可以处理核废水的最佳办法吗,04月11日 20:50
1110,小ttian使,被震惊到要坚决反对日本无视环境污染问题往海里排核废水啊,05月07日 17:47
8566,wlbgn8888,美国点赞日本排核废水2包头总部经济园Lwlbgn8888的微博视频,05月03日 23:35
3243,Graceful谦qi,upup婷婷gabby拿孩子生命来撒谎来阴谋论能相信这话的脑子里装的是日本核废水嘛,05月12日 12:58
8449,断幺对对三杠子,父慈子孝战略安全与军控在线日本政府正式决定福岛核废水排海Vs美国务卿发推感谢日方明显努力,05月02日 16:54
405,wasabibiya,孙莉你醒了吗我醒了你凭什么还睡着求你做个人吧是想去喝核废水吗,05月05日 07:08
9904,05-D,你家紫叔叔下本书写末世题材故事的开始要从日本把核废水排进大海说起,04月10日 19:29
7234,Pluviphileeee,围观了一下搞懂了神经病的逻辑就是任何问题都是肖战的问题什么错都是肖战的错wow脑子里都是核排废水吧那么毒想滚赶紧滚,05月01日 16:31
8003,肆无忌惮得屙不出屎,任豪没有人比R1SE更爱R1SE笑死这是什么热搜啊这位哥核废水处理完了吗iPad,05月02日 22:24
8953,顺安子,疾风中青勁草地球越来越危险了我们回火星去吧战略安全与军控在线日本福岛核废水中不仅含氚而且还含62种金属放射性同位素它们存在时间长有化学毒性废水中的碳14半衰期为5700年历史上从未有如此大量的放射性核素排放到海洋里去它对海洋环境及生物链带来的影响难以预料,05月03日 19:49
3473,EramthGin_生鱼片,賣羊肉的咩咩咩早早就预言了核废水导致的海洋生物变异是神作没错,05月12日 01:07
2482,bghkjdsghkjdsghkjds,日本的可饮用核废水有着落了午后狂睡好像还真有可行性野熊大比呕泥浆用小便冲大便啊省中省,05月10日 14:16
3830,哼唱一首歌,向海洋排放核废水日本谋划近十年的阴谋终于要实现了历史历史视界L哼唱一首歌的微博视频,05月13日 04:52
3972,或林橘,笑死南方系把持的新媒体怎么可能帮着宣传核废水有害要把福岛冲下来这种朴素的爱国情他们忙着洗核废水合规和躬酱精神呢这种道德瑕疵话术也就吓唬吓唬未成年,05月14日 17:15
8983,為了米卡辦微博的修,创造营各位字姐看我说话太有道理把我的留言删了我怕伤到小学生的幼小心灵我会不会被请去喝核废水,05月03日 18:44
8804,好像蛮颓的,东京饮用水致癌物严重超标问题不大毕竟日本的马桶水核废水都能喝,05月03日 21:28
9461,西瓜葡萄2028,多地发布海虹织纹螺预警好像没吃过这种螺不过以后吃海鲜会越来越少了毕竟小日本要倾倒核废水,05月04日 18:44
6275,潜伏狂人-潜伏一切利好,上周五二胎概念再一次上演剧本老朋友高乐股份中午偷板婴童概念下午全部爆了一圈图片周五资金发动的原因就是博弈周末的人口数据消息尴尬的是消息周末没有出来图片要是本周一二消息依然没出婴童板块大跌的几率非常大不过在没出消息的情况下大跌就是机会要是大跌后消息依然没出本周四又可以再一次潜伏周五的主力预期再说海南海南本来我之前的操作只是潜伏博鳌的但是消息面上确不断超预期周四的一个会议接着又是周五盘后一系列海南的利好目前周一还有一个海南的会议利好龙头就是华闻集团其他不用看了图片接聊日本排放核废水周五盘中关于日本决定排放核废水的消息一出马上拉了不少的国产水产养殖股逻辑很简单就是海鲜不能吃利好淡水鲜货消息面上4月13日日本政府将召开内阁会议正式决定这里会有个预期事件摆在这里因此周一4月12日有一个博弈的价值在这里这块的表格满天飞了我就不累赘龙头板了就马上潜伏低位补涨票更名股上周的鹿港文化现代制药都是蛮不错的隔日套利都给了好几个点的空间看看这周有没新的更名股吧强生控股周五收的阴线很吓人吧我周五又干进去不少仓位微套一个点中逻辑就不多说了可以翻翻前面文章收起全文d,04月11日 22:04
5133,致敬了不起的老兵,核专家公开质疑日本造假核污水若真的安全为何不排入东京湾随着日本内阁正式确定将福岛核废水排向海洋日本当局正试图全面公关包括向日本民众以及全球社会各界表示日本核废水的安全性然而在环球交叉点官方账号11日发布的视频中日本原子能市民委员会会长大岛坚一更是爆料检测人员试图在检测设备上做手脚通过造假来蒙混过关为了向民众展示通过多核素去除设备处理后的核废水安全性工作人员从废水罐中取出一瓶水随后用γ射线检测设备测量水的放射性结果数值没有提升但大岛坚一表示氚是β射线工作人员却用γ射线检测设备证实氚的安全性大岛坚一表示大家都是这方面的专家怎么可能糊弄过去并表示无法相信东电公司同时对于记者表示的既然日本当局认为经过处理后的核废水是安全的为何不选择向岛内排放大岛坚一表示高度赞同既然核废水标准符合日本当局所谓的日本安全标准那么可以将其并入日本的水网经过进一步处理在日本国内消化而在日本国内大岛坚一的态度也很坚决那就是继续坚持向公众陈述真相并呼吁正确处理核废水针对日本两年后排放核废水大岛坚一表示日本当局之所以要在两年后排放核废水就是希望日本民众放弃并忘记此事降低日本国内外的压力大岛坚一表示不放弃他们就等着我们放弃事实上大岛坚一所在的原子能市民委员会曾提出过替代方案最简单的方法就是将处理后的核废水储存在废水罐中并存放一百年使得放射性物质衰减之后再做处理另一个方案就是通过砂浆固化的方式永久封存后者在美国处理核事故时被用到然而这两个方法主要基于福岛核电站不在产生核废水现实情况是东电公司依然未能拿出彻底解决受损核反应堆的方案这意味着未来一段时间里日本福岛核电站的核废水还将逐渐增加之所以向海洋排放核废水是因为日本当局认为向大海排放核废水是最省钱的方法讽刺的是在福岛核危机事故中处处体现了日本当局以及东电公司精打细算如果东电公司不为了保全核反应堆听从专家建议用海水冷却代价是反应堆报废福岛核电危机不可能升至7级福岛核废水更不会积存如此之多更讽刺的是福岛核电站事故中日本当局为其国内民众开出了总额79万亿日元的赔偿总额约合7225亿美元然而却在核废水处理方面试图让全球民众共同承担风险这种做法让人不齿甚至有外国网友表示既然核废水安全为何不排入东京湾由此可见日本当局表明处理过的核废水符合标准并十分安全简直就是谎话连篇而福岛核事故的处理也体现了东电公司的拖沓欺瞒以及不作为收起全文d,05月17日 14:57
3096,白山黑水云雾间,瑞典的环保少女没有抨击日本排核废水反而抨击中国温室排放面对这个现象我们不要去推敲这个瑞典少女的逻辑而应该深深感到一丝凉意这应该是一个被人控制的木偶对手的舆论控制能力已经强大到如此程度我们的差距还是很大的2日本埼玉市,05月12日 22:27
3171,Psychotherapist-4,拿它们宣传的是日本人放核废水害它们的也是日本人啤啤酒酒酒Bison仓鼠呼噜噜,05月12日 16:43
9634,修学中和,东方财富话题日本福岛核废水将排向大海O网页链接来自东方财富网,05月04日 13:37
3388,miyoumissyou,替莫唑胺胶囊柳余翻了个身侧对着他两人挨得极近风刮过他的脸带着清冽的如雪的芬芳传过来她用手去触碰他的睫毛非那雄胺注意事项1使用非那雄胺片期间如出现任何不良反应请咨询医生2同时使用其他药品请告知医生请放置于儿童不能触及的地方3使用非那雄胺片前应除外和良性前列腺增生类似的其他疾病如感染前列腺癌尿道狭窄膀胱低张力神经源性紊乱等4非那雄胺主要在肝脏代谢肝功能不全者慎用5女性和未成年男性禁止服用印度特瑞是的她是烂藓日本核废水入海对中国有何影响收起全文d,05月12日 09:11
6809,夏杨的时空城堡,微评日本政府正式决定福岛核废水排海全球可能受影响的国家应该联手抵制日本禁绝一切日本相关产品进口让他们卑劣的行为付出应有的代价,04月15日 23:59
1848,十八闲执,哈哈哈哈哈哈点赞喵要睡个饱为什么日本人没有这么做因为我们他妈没有往海里倒核废水,05月09日 15:19
4333,嘉93056,日本核废水如果真的排放对山东地区影响大不大啊我现在快担心死了日本核废水,05月15日 22:16
3153,残奥冠军孙药杨,孙杨喝得上核废水,05月12日 18:23
8511,可攻可受深居简出,印度外网官媒说w汉病毒圣母们没有激动外网官媒排挤新疆棉花圣母们没有激动外国官方公然说搞乱x港t湾圣母们没有激动r本要排放核废水圣母们也没有激动甚至要洗白日本排放核废水但是今天圣母们纷纷破功了这是因为什么呢,05月02日 15:38
9104,东京喰狗蛋,日本政府正式决定福岛核废水排海鬼子要是有这胆魄我也愿意称他们为好汉当然还是不给倒核废水,05月03日 14:45
5717,M44星云的ame,这一定是只喝了很多核废水的牛2杭州湖滨,05月20日 20:37
4751,BastardHater_,乐意帮鸭子搬家也乐意不顾全人类未来倒核废水2049年的世界日本傻事今日财经之日本资金日本暖心新闻在这些精心挑选的国外新闻的熏陶下中国人该是会多么对国外存在认知偏差,05月16日 12:35
7377,良木擇禽zzz,日本排放核废水影响,05月01日 11:43
2749,wangyun_77,HERO2007剧场版男主久利生公平在韩国搜查涉案车发现车子已被罪犯抛入海里不可以乱把东西丢进海里呀阿西吧14年后的今天核废水怎么说,05月11日 22:45
5044,Loha_南瓜,孙子俺是你姥姥中国女人接男宝的福报抹去记忆16830遇到橙子哈哈哈哈哈玉米粒与土豆泥日本排放核废水中国排放劣精男,05月17日 18:20
8760,迷茫的鳗鱼,草V_YQ_V哈哈哈哈哈哈哈哈哈哈哈哈哈等什么时候军费攒够了东征霓虹解决核废水问题可的松Infelice等军费攒够了沧声声声什么时候来三百个源石,05月03日 21:44
8585,溟凡885,开疆拓土蒋中正丧权辱国mzd鹰眼先知来你要的民国疆域已及前后两朝对比即使去掉当前无法控制的台湾藏南地区不算孰大孰小一目了然而且我也不知道是谁欢迎蒙古独立的还早早地和蒙古国建立了外交关系顺便这位仁兄还支持日本排放核废水建议喝点或者到里面游两圈证明核废水是安全的仁兄戴了反giong的眼镜却还自以为能客观看待问题反对民族主义呢收起全文d,05月03日 23:21
1181,塞纳河畔左岸的小草泥巴,笑死已经2021年了没等来日本对于侵华的道歉却等来核废水和一群煞笔二鬼子,05月07日 15:52
8391,出到社会的一护,爱因兹贝伦RCS注意区分针对政府机构还是针对民众那个火不妥的地方在于连带上了无辜的印度民众我们和印度民众都在遭受同一场疫情同样的核废水我们和日本民众一样上受害者,05月02日 18:52
1319,梦崎绘星海,美国到底有什么好舔的啊李满你图什么啊图疫情无作为死几十万人图种族歧视不够乱如果喝核废水就能让nct美国一炮而红你恨不在来几吨吧,05月07日 08:45
5142,大国重器套装,南方系新京澎湖凤凰财新财经三联中新界面上海报北京青年报集体对日本核废水事件禁声咋的想去日本给核废水还是说py已经被灌满了,05月17日 14:15
6050,神盾局副局长希尔,CedreYan铜墙铁壁石头更缺德的是日本政府掏了二十亿日元来做宣传美化此次排放核废水行为大家可以看一下微博里有哪些大试图淡化这次事件那他绝对是恰烂钱了,04月11日 23:56
140,瓜州融媒,美国海洋生物学家美国必须制止日本排放核废水计划O网页链接,05月05日 18:21
1167,别来偷窥Beau同学的微博,日本人环保你咋不转发他们排核污水等他们啥时候直播喝了核废水再宣传吧一群懦夫把可能只是三四级的事故作死成了七级然后还在这巴巴的号宣传环保,05月07日 16:18
3976,长猫了的山竹,疫情又有苗头了日本要排核废水房价还在涨赚的钱不够物价的上涨生活太压抑了国家还妄想我们年轻人生孩子自己都裹不住凭什么去养孩子幸福指数低到极点好希望世界毁灭吧我也就就此消失吧,05月14日 16:56
7101,兰江河,不涉及别国内政是行不通的比如日本排放核废水到海里我们不釆用政治法律手段是难以达到安全目的还有蒙古国乱砍伐树木又不植树造林导致沙尘天气到了山东还有缅甸具有非常重要的地理位置他让我们可以不通过马六甲海峡直接可以去往印度中东非洲和欧洲因为科学真理只有一个我们可以用社会主义思想去帮助他们培养政治人物和安全人员只要我们不轻易使用武力遵守国际法就可以大胆去做收起全文d,05月01日 22:18
7961,隔壁家的阿菲,没有人比任豪更爱日本没有人比任豪更爱核废水没有人比任豪更爱地球这几个话题更适合成为热搜词条吧,05月02日 22:34
5918,哈哈哈滋惹,这种人进福岛喝核废水去吧,05月21日 20:41
4394,八十八号夜会,漫画家一直宅在家里这样不好不仅容易得脂肪肝而且创作的故事难免脱节建议每个漫画家就地取材日搬地砖三千斤月饮核废水五万两,05月15日 18:04
6558,夜启白泽,美总统气候问题特使克里下周访华你日本儿子要排核废水了拐个弯先去他们家行不行,04月11日 19:31
4330,生死由恨,台湾突然大停电新闻和以前日本核废水问题说明了核电不是未来趋势核电是没有发展前途的电力日本和台湾未来的电力将是日本以及台湾的所面临的问题也正是中国大陆电力去台湾发展好时机千载难逢啊电力关乎啥我也不说了,05月15日 22:20
641,leegoTang,那些在英雄保护下还在那反咬英雄的丁圣母婊还有一些吹着排核废水要人类互助的井底之蛙是什么个狗心态身为中国人不爱国你还有什么资格站在这片土地上,05月06日 17:24
3919,TB搜三哥在印度,帕妥珠单抗艾曲博帕艾曲波帕ELTROMBOPAG是再生障碍性贫血新药艾曲博帕是一种口服血小板生成素受体激动剂TPORA通过诱导来自骨髓干细胞的巨核细胞刺激和分化来增加血小板的产生医学者表示如果不及时治疗严重的再生障碍性贫血可能是致命的当前的初始治疗方案对许多患者来说效果甚微美国FDA对艾曲博帕的批准对于患有这种具有挑战性疾病的患者来说是一个重要的进步有关此药的主要研究项目显示44IST初治无效的再生障碍性贫血患者在使用艾曲博帕联合标准IST治疗后6个月达到完全缓解这比历史上仅使用标准IST治疗观察到的完全缓解率高出了近276个月时试验患者的总体反应率为7995CI6987此次试验的新数据还显示受试者接受药物治疗后出现了持续应答对于接受6个月的艾曲博帕与马抗胸腺细胞球蛋白hATG和环孢菌素CsA随后使用CsA维持治疗的患者中位反应持续时间达到了243个月在本研究中报告最常见的不良反应发生率5是肝功能检查异常皮疹和皮肤变色包括色素沉着过度日本核废水入海对中国有何影响印度特瑞收起全文d,05月14日 20:22
6824,田田没有双马尾,赵立坚说日方一些人想碰瓷钓鱼岛核废水喝完了吗天天碰瓷大核民族真是最无耻最无下限的民族呕,04月16日 23:58
481,小狗朵比,我他妈笑的想死啊当初都以为我们闯要停录结果最后是隔壁停录不知道当初那些喊停录的国内弟弟的粉丝怎么想不说了为自己的好眼光自豪干了这杯核废水,05月05日 00:34
5105,韩雨甜a,建议日本人喝核废水和病毒决一死战大不了一亿玉碎,05月17日 16:13
1086,-gin颂-,除了道歉真果粒还能做什么当然有去阻止日本排放核废水,05月07日 18:22
2174,mj微风,伪女权为了凑数竟然把抗议福岛核废水的横幅都拉来了骗经费的吧,05月09日 21:46
5100,淘宝5三哥在印度,斯沃苏母也很高兴擦着眼泪问阿回说那么多你还没说这祛秽丹是谁那里买来的怎么会有这样的奇效非那雄胺注意事项1使用非那雄胺片期间如出现任何不良反应请咨询医生2同时使用其他药品请告知医生请放置于儿童不能触及的地方3使用非那雄胺片前应除外和良性前列腺增生类似的其他疾病如感染前列腺癌尿道狭窄膀胱低张力神经源性紊乱等4非那雄胺主要在肝脏代谢肝功能不全者慎用5女性和未成年男性禁止服用印度特瑞苏回把买祛秽丹的来龙去脉跟家人们说了一遍怕他们不信真有那么厉害的效果就提议日本核废水入海对中国有何影响收起全文d,05月17日 16:34
6090,陈欢溪Christie,宁愿拨几十亿的专项款舆论洗白都不愿好好处理核废水小鬼子真的恶毒,04月11日 23:27
4026,兰页吖,orange_奶橘日本这次是地震动的手把核废水震漏了不关我的事,05月14日 14:13
9020,阿霉莉卡小烧杯-,YuuuJ小鱼呐她是脑子里塞满了她妈gh转不过来导致她野爹追着她要把她猪脑打爆结果她一口核废水喷她野爹上让他脑子变牛子本末倒置遵循本能的想和她脑子里的那东西完成生命大和谐她还欣然接受了结果就是人全没了,05月03日 17:55
1779,平尽不平事02,毕竟它就是条狗怎么可能咬主子侠肝义胆心王__喆日本排核废水的时候她为啥装死,05月09日 17:08
845,京茵高尔夫体育,把核废水洒还太空不就是回到它该去的地方,05月06日 10:36
9610,灰色怪味豆,陈睿连夜删评搞公关一定很辛苦吧让你的日本老爹送你一杯暖暖的核废水让你为了伟大的父爱感动到变异吧,05月04日 14:05
4315,wkconnor,我围观了褚明宇的回答该问题价值219800元围观仅1元快来一起围观O微博问答,05月15日 23:10
8107,一只草率的小霜吹z,任豪没有人比R1SE更爱R1SE核废水喝饱了又出来bb你妈呢,05月02日 22:11
4220,起床就要吃晚饭,d蛙还是打核废水吧,05月14日 02:28
6411,乔四的江山永固,捕猹少年小闰土鞠躬就完事了东邪影视铜墙铁壁石头更缺德的是日本政府掏了二十亿日元来做宣传美化此次排放核废水行为大家可以看一下微博里有哪些大试图淡化这次事件那他绝对是恰烂钱了,04月11日 21:03
5584,无云表情包,排核废水的时候你们可没那么讲究啊L无云表情包的微博视频,05月19日 15:00
8844,第1123颗糖,东京饮用水致癌物严重超标可以喝点核废水以毒攻毒说不定就好了,05月03日 21:14
4584,还有比胡萝卜更难吃的吗,谏山创我真是想给你妈来一刀你自己睁大你的狗眼看看你画的什么东西当初地鸣怎么没把你踩死三笠被你毁成这个样子你还有什么脸说她是你最喜欢的角色男女主人设全被你画崩了你是喝了核废水吗还是说你暗恋岸本齐史要在已经是一坨屎的结局上在撒一泡尿我真是想给你妈来一刀,05月15日 00:49
