,博主昵称,微博内容,发布时间
6260,股海狂龙1562本尊,大盘走势预测之我见周末出了两条消息阿里被监管部门罚款182亿利空港股中的互联网巨头如美团企鹅等对A股中的科技股形成一定拖累岛国准备将福岛核废水排入大海对海水养殖捕捞形成重大利空但却利好淡水养殖核辐射检测防疫类的上市公司从股指整个的形态和结构观察这波调整的时间和空间都不会小尤其是机构抱团类个股以及前期暴炒过的碳中和类个股风险极大因为经历一波力度较大的上涨行情结束了以后调整的周期是以月来计算的既然狂龙提示了风险那么也必然会有机会从板块上看港口水运和民航机场两个板块可以下周内短线关注今年真正的机会还是在于军工股中狂龙不敢说什么翻倍之类的虚假言论但今年的牛股榜中必定会有它们的身影至于农药兽药板块一周内短期关注即可具体到明天股指的走势狂龙认为低开低走继续调整的概率较大操作上忌讳激进的追涨杀跌可以对看好的个股趁调整时逢低吸纳如果是没把握休息一下也无妨今天就说到这里各位周末愉快收起全文d,04月11日 22:10
7276,Aivrle艾芙,回返批示接上面刚发那条写上下解决上整全上一概不容对问题们一概不容第一部分问题这部分问题上下该怎么办了那便怎么办了太愚蠢可笑真的第二部分问题一面发展战略一面同以的革烬他们这类不安分搞斗恶争端的第三类问题继续去整编一类的杂乱差摧枯拉朽问题进相革新整全上一概不容,05月01日 14:50
3027,雨渁噖殸20109,日本倒核废水她装死提到中国倒支棱起来了QQ浏览器O日本倒核废水她装死提到中国倒支棱起来了,05月11日 09:31
2480,世间体验官,日本排核废水夏天防晒霜都不好买哈,05月10日 14:28
7078,奶五子,胡扯78一一一三言两语1中国有句古话有瞎的护瞎有秃的护秃美国从发明核弹的第一天开始就向大海倾倒核废水已经倒了60多年这就是美国力挺日本向海里倾倒核废水的根由2世界上什么武器能戳穿谎言答案只有一个时间3古人讲的矛盾话兔子不吃窝边草近水楼台先得月宰相肚里能撑船有仇不报l非君子瘦死骆驼比馬大脱毛凤凰不如鸡4当前的碎语医院把病人整穷股市把散户整疯教育把家长整垮网络把孩子整傻贷款把年轻人整废金钱把关系整崩5移民的四种人极少数反党反社会主义的自民分子逃避惩罚的贪官和子女向往资本主义生活的名星艺人资产来源不明的富人6专家说据不完全统计人均纯收入己达16000元试问为啥不完全统计呢他怎么敢不完全统计呢7长冮黄河两岸美丽五月十里花香百里飘扬千里芬芳8医药换换包装规格质量不变价格涨了十倍9人生是本书翻开是故事合上是回忆10什么职业最好一一当官工资不高外块不少讲话不多掌声不少外语不会出国不少饭量不大请的不少长的不行情人不少技术不行职称很高2天津和平里小区收起全文d,05月01日 23:07
3249,法鼓山上,说得很到位不是核废水是核污染水,05月12日 12:37
7045,浪费光阴的梭子,许光汉很谢谢你们现在还喜欢我不我不喜欢尤其是台独现在这么严重的时候台湾居然认可核废水的时候本人就想问有几个台湾艺人敢说台湾是大陆的不敢说能不能不要在大陆演出人民日报,04月29日 23:53
9696,未叶寒,呵呵一玶海岸看了一下少女继续发推支持全世界学生周五逃课对日本排核废水目前还一言不发评论里有人提示也置之不理风云sfy瑞典的环保少女呢,04月10日 23:04
9018,心安何处不是春,偷倒核废水垃圾中的垃圾,05月03日 17:57
3343,钢铁柴柴兽,巨人最终卷加页早上起来还是想骂谏山创就nm离谱烂尾可以但TM烂成这样你是不是故乡的核废水喝多了,05月12日 09:53
4242,ISOMSUIY,哇唧唧哇INTO1官博哇唧唧哇你知不知道自己有多恶心官博公然唯十咋了核废水把你公司冲了wgp歪到太平洋了吧断层C位的热搜一压再压远超的阅读讨论量上不去rs也是搞笑舞了五个小时你告诉我为什么上不去恶意防爆你呢你四处漏风的破公司买热搜都要倾家荡产了吧怎么带队友的就能上了做好c位商务宣发工作可能真的会让你们死吧六点的活动你第二天凌晨048发宣传大半夜的你们去阴间宣传了啊死人都比你wjjw强啊操千辛万苦打投送上来的人私生怼脸跟拍有代言不帮忙发转眼给下面几位这么折麽我们粉丝是个人都要逆反了老娘的钱凭什么给你奶团滚哇唧唧哇INTO1官博养乐多收起全文d,05月14日 01:03
10147,紫荆啼血,椟菽荫Fungi君飞蠓内含子小孩儿能拎的这么清楚说明后面有人指点无穷的探索一玶海岸看了一下少女继续发推支持全世界学生周五逃课对日本排核废水目前还一言不发评论里有人提示也置之不理风云sfy瑞典的环保少女呢,04月10日 15:45
1002,打着油纸伞的樱花少女,一勺粉下去快死的鱼又活了这种鱼你还敢买吗自从日本决定倾倒核废水事件被爆出海鲜市场的产品安全问题引起了大量讨论一勺粉下去快死的鱼又活了这种鱼我们还能吃吗O网页链接,05月07日 21:34
3098,五颜六色的子孙,Artoria天下第一美国对外入侵朝鲜越南伊拉克日本对外排放核废水美日两国完全符合小人向外的标准,05月12日 22:25
10231,战略情报菌,王菊来干了这碗核废水,04月10日 14:57
9736,想富有的栗子,和朋友讲到日本排核废水我第一反应你知道甲状腺癌重疾不报销了吗朋友所以呢我你高中没学过吗辐射对甲状腺影响可大了朋友我每天都在担心些什么,04月10日 22:25
665,hongyang2688围脖,财经韩京畿道知事致函日本抗议核水排海决定韩国京畿道知事李在明6日致函日本政府和福岛县知事敦促日方立即撤回向海洋排放福岛核废水的决定财经,05月06日 16:47
303,墨君家的狐狸酱,今天我的身边出现了一个人这个人同时有男人的JJ又有女人的BB当核废水放入海里未来未来的孩子可能奇形怪状的呃比如三个头比如六个手比如九个腿好家伙我直呼好家伙谁特么先变异去把美国给我扬了,05月05日 12:16
8345,Travel峰,海纳百氚寄给日本政府的视频12021年4月13日日本正式决定向海洋排放福岛第一核电站含有对海洋环境有害的核废水2本视频已抄送日本外务省皇居和首相官邸狗头jpg3希望日方审时度势悬崖勒马三思后行素材皆来自哔哩哔哩弹幕网及互联网2北京LTravel峰的微博视频,05月02日 20:18
8378,王多福Zzz,投海自尽稀释核废水笑死我了哈哈哈哈哈哈哈哈哈哈,05月02日 19:21
6857,橘子味西瓜甜酱,周柯宇诶怜爱了艹追选秀这么多年没见过这种皇族创造瀛真的垃圾脑子里有核废水才会剪成这种死鬼样子zgdd粉丝们都支棱起来不能躺躺就要被水刮到日本海了妈的本来说准备选的是一水有本事的漂亮男生现实是帅哥参加衍生节目脚崴了给爷整不会了这次追选秀体验太差了实在是被追着喂的感觉收起全文d,04月18日 23:59
9337,车护家CHEHUJIA,菊花牛牛哒受世界多个政府加速推行新能源汽车新能源汽车的发展不断推出禁止新能源汽车的政策据媒体报道此前日本日本日本政府正式决定福岛核废水排海政府宣布了绿色增长计划将在2035年禁售燃油车为加速电动车在日本普及政府又计划2030年禁止在东京内销售燃油车日前丰田丰田品牌近日上市了首款微型电动车但新车共推出两款配置售价为1651716万日元约合人民币104108万元相比之下国内销售的五菱宏光MINIEV五菱宏光miniev仅为288388万元人民币两车售价差距悬殊值得注意的是五菱宏光MINIEV自从在中国市场实现上市后销量频频上涨如今都已超过特斯拉特斯拉车型可见竞争力相当2南京收起全文d,05月04日 22:35
307,廉政包大人,正能量内黄市民观察员人类命运共同体每日一喊保护最多的人人民安全是国家安全的基石请将烟草纳入禁毒法政法队伍教育整顿贪官被查上百辆豪车犹如车展日本政府正式决定福岛核废水排海山东菏泽校长11岁儿子冒名顶替他人入公职,05月05日 12:11
9618,李千重,日本核废水还没来不知哪里的核玻璃先来了浮山凉秋可怕笑看七千万剩男绝后晚景凄凉卧槽这渗人的阴间绿不仅杯碗盏碟喜欢盘珠子的也小心此玻璃非彼玻璃害命光头风月等于家里放着放射源两只小船_凡士林玻璃不就是含铀玻璃吗怎么进来的海关不查吗,05月04日 13:55
36,画蓝彩溢,日本核废水我的邻居住着一个疯女人神经病我开门透气她开门抖落一下菜篮子我整理家居把闲置的健身车放在过道她把过道原来放置的椅子横叉路中间我归置了拦路的椅子不理于是她今日卡一个废物在车身不理明日套一个塑料圈在车把不理再日放一个烂苹果在座椅不理终于她突然搬走了过道角落里积满灰尘的一张破桌子不理我想只要她不往大海里倒入废水不理除非她真的疯了还是不理有上帝收起全文d,05月05日 22:45
6216,小的哒子,周围是月光海和孤独想起日本将要排放的核废水有许多惆怅,04月11日 22:28
1648,kawaichine,发质差到有点像用核废水或者恒河水洗的了,05月08日 10:15
7189,八大商人,日本防卫省为自卫队错误处理放射性废弃物道歉日本政府正式决定福岛核废水排海日本福岛鱼类因放射物质超标被禁上市据日本广播协会NHK当地时间4月30日消息位于日本茨城县的陆上自卫队于2019年错误地委托没有得到日本政府许可的企业处理超过标准的放射性废弃物目前该废弃物被送回保管在自卫队设施内日本防卫省对此表示深刻检讨深表歉意日本防卫省称2019年2月位于茨城县霞浦驻屯地中的关东补给处部队在废弃含有放射性物质的零件时错误地将其处理工作委托给了没有得到日本政府许可的企业其后由于检测出高放射性物质相关零件被送回日本防卫省表示造成这一错误的原因是部队负责人没有正确认识处理含有放射性物质的废弃物时的规则防卫省对此表示深刻检讨深表歉意并表示该错误对周边居民没有影响央视如果日本防卫省都是这副鸟样说了无数谎言的东京电力公司那就更不用说了指望他们把好核废水排放的质控关简直就是不可想象_收起全文d,05月01日 18:24
6921,图麦芽,23rr诸神之战福岛核废水排放入海日本核废水ππhTXqVqnJFh8ππ打開Dou音sδμ索2深圳东海国际公寓L图麦芽的微博视频,04月21日 23:46
4840,你是什么小饺子,早想骂力丸了电视机油腻陀螺水货回日本喝核废水尤其力丸粉丝你们贱不贱忘了被点名了奥对了说日本打过来我们要叫爸爸的也是你们改mao诗词的还是你们要我是你们我现在乖乖的你们力丸还能早点出来,05月16日 01:41
6073,流波曲,福岛怎么就不值得HBO再拍个高分神剧出来了布拉格的小猫然而参见西方对切尔诺贝利事故的前后态度人类的劣迹何止于此铜墙铁壁石头更缺德的是日本政府掏了二十亿日元来做宣传美化此次排放核废水行为大家可以看一下微博里有哪些大试图淡化这次事件那他绝对是恰烂钱了,04月11日 23:38
5124,蒙古海军2019,台湾疫情严不严重我倒不关心但请台湾人记得多吃凤梨后别忘了用爱发电因为台湾最美的风景日月潭缺水缺的快变成莱猪肉干了再不进口点福岛的核灾废水藻礁也悬817虽然可以甩锅大陆但天天的共机绕台还是苦撒撒2天津新港,05月17日 15:28
4511,库页岛萨满,最近好多平时神气活现的精日又跑回国了核废水不香甜了吗,05月15日 10:52
4460,cardiup,卢克播客tv和咔姨青莲的好意思说没镜头看看其他的外国人吧得了便宜还卖乖盛世白莲吧还有说没故事线我ztm笑死孤狼咔子和沸羊羊那么多故事线是核废水辣瞎了眼才看不到吧癌蛔营销世界的参差踩着中国弟弟上位是舔久了鬼子的脚趾发泡了才看不到吧癌洄公然td不会有人不知道吧收起全文d,05月15日 13:51
3542,不然钓个寂寞吗,用大哥哥的核废水发电用菠萝发电,05月13日 22:06
8035,TcpvSTAR,核废水一样的国娱赶紧灭掉吧免得污染祖国的花草汪海林回复zYakamoz_z就可以得到共和国勋章了吧zYakamoz_z你是要毁了国娱啊汪海林是的,05月02日 22:18
7416,努力实现被一亿人知道的小目标,来吧这碗由烂臭凤梨汁配日本核废水在撒上变异新冠的毒鸡汤彭于晏你值得拥有湾湾人民一定可以陪你熬够久,05月01日 11:02
8472,dJerryb,下午听了一群老人在说日本倒核废水以后海鱼不能吃还想在家门前挖个池塘在里边养鱼喂鹅我想补充下对于一个理科生来说它倒下去我们全世界还有救吗日本政府正式决定福岛核废水排海,05月02日 16:20
7023,极夜是夜,加州外海发现逾2万桶有毒废弃物日本政府正式决定福岛核废水排海求求了连上日本还有那些没有脑子的和人类划清界线吧,04月27日 23:51
1819,蕾欧阿帕姬,恒河水核废水干杯迷惑行為大賞士多啤怡迷惑行為大賞,05月09日 15:51
8166,顾平生烟雨而盼将5555,任豪没有人比R1SE更爱R1SE不回日本治理核废水了吗日本人民需要你搞快点,05月02日 22:03
1185,寄往二次元的情书·,两年后滚回自己国家喝核废水去吧,05月07日 15:49
252,ASongForSth,核废水后应该更少不然生的全是畸形儿,05月05日 14:05
57,豚豚-哥,日本副首相称喝处理核废水没事老图新画背景图是一个热爱学习的男孩的二次创作,05月05日 21:46
9116,文寶香港代購15,DannySummer夏韶聲核廢水外星人來幹什麼ODannySummer夏韶聲核廢水外星人來幹什麼,05月03日 14:17
4530,咨讣型匠efUD51929,力如太Rilutek永嘉摇了摇头若陛下真的出事你与我边关的将士大魏的百姓没人能真正的独善其身印度美德玛祛疤膏全球最好的祛疤膏医院都会开这个去疤膏医用级别还有其他各种男性保健产品印度特瑞陆将军不请我进去坐坐吗永嘉见愣着不动的陆翊笑了笑问日本核废水入海对中国有何影响收起全文d,05月15日 09:32
9402,龙骧P想要成为美少女魔法机娘,好活点赞喵要睡个饱为什么日本人没有这么做因为我们他妈没有往海里倒核废水,05月04日 20:46
8462,法援03,发布了头条文章九方智投正规吗投资亏损能追回吗能退吗老师带单合法吗被骗了股票房产微博日本福岛核废水排海借势炒作股票百度快照顾问追损白银超话现货交易黄金你有哪些被骗的经历O九方智投正规吗投资亏损能追回吗能退吗老师带单合法吗被骗了,05月02日 16:34
1434,兀戈,这是倒了核废水的福岛吗,05月08日 21:05
6730,十八子金名,福岛核污水或入海Japan福岛县照片有消息说日本政府已基本决定将福岛核电站的核污水排入大海英美媒体没什么报道英语社交媒体也很少讨论这大概是因为排入到太平洋离欧美所在的大西洋很远受害的主要是东亚东南亚国家这意味着世界第一大洋太平洋成了日本核污水的垃圾盆意味着世界渔业遭受毁灭性打击意味着成千上万的渔民失业意味着人类巨大的生态灾难虽然日本人说排入太平洋的核废水是安全的可日本人的话你能信吗既然是安全的日本怎么不自己留着洗菜煮饭泡澡灌溉呀你不是有很先进的海水淡化技术吗二战日本已严重祸害了人类一次这一次又来祸害人类它就是人类公敌v光新星收起全文d,04月11日 17:40
1891,起明博微,环保工具对本子核事故废水排向太平洋不发声的都是假环保分子真环保工具,05月09日 14:29
5711,艾先生是肉丸子的-,下午上地理课讲洋流这些老师突然有点激动你说美国对于日本排核废水怎么就支持了同学你们看你们看这到最后核废水会到他们家门口的呀我估计拜登不懂这个老师一个得意的表情哈哈哈哈哈,05月20日 20:51
1694,365-厦门大雨,澳大利亚5月15日将解除对印旅行禁令极思细恐关于印度疫情每天刷屏大家没有发现微博日本排核废水的新闻已经几乎看不到了吗,05月08日 06:33
3065,冰镇丶咸鱼干爹,日本政府正式决定福岛核废水排海日本考虑过把废水倒富士山火山口里么,05月12日 23:59
1224,哈利咖喱咖喱,要不是今年当了秀粉我可能也跟着骂了在内娱很容易变成花钱又当孙子资本裹挟秀粉一起发疯唯一治好的是我的玻璃心天天二鬼子警告一天三吨核废水麻了毁灭吧,05月07日 14:12
5000,禁林里的小独角兽,东京哈利波特影城2023年开业又是疫情又是核废水这可咋整,05月17日 19:09
3722,锦宓之樱,你们就喝核废水去吧去之前赶紧退国籍小亮是我鵝被爆喜歡韓國愛豆被開除一次國籍參加節目又被開除一次國籍在矮岀道了再開除一次國籍日飯都沒你們瘋逼回去要被罵佔資源不回去又要被罵背叛反正都要罵那當然選更好的呀,05月13日 12:58
2390,Eve47,旅行可以一点点安排上但是更希望可以看喜欢的演唱会或者音乐会希望今年起码能看上一场怀念17年那一年看了现场跨年演唱会看了喜欢歌手演唱会所有live美好的回忆回味了很久今天吃饭的时候妈妈提醒我不要吃太多寿司了说现在海鱼不安全我才想起日本核废水的事快乐又没了一个所有我喜欢的持续关注中希望今年愿望达成世界早日恢复正常收起全文d,05月10日 19:32
2377,晴天小猪MK23,逆光飞行好带儿油就是个笑话张宏圣好图共欣赏查看图片Esports海涛选择性眼瞎真是小丑一只乌合麒麟任何世界性质的环保机构只要是对日本核废水不闻不问却跑来指责中国环保问题的都是打压中国的政治工具当放屁就行,05月10日 20:40
2424,第七灵灾BE世界线的光呆,印度医护人员将遗体扔进河阿三的葬礼里的确是有把尸体直接往河里丢的神圣环节期待已久的节目终于开始上演了不愧是三哥敢跟乱丢核废水的太君比脏的物种三观都挺清奇的,05月10日 17:15
4859,一杯蓿子,我寻思366365不就是731两周年不就731天这不就是碰巧撞到了可以提醒她敏感一点直接上升到喝核废水程度还行你这节奏还不是引战活该好吧p3是自动回复差不多得了这帮人爱国当工具罢了,05月16日 00:13
8196,非著名划水大艺术家,任豪没有人比R1SE更爱R1SE你说这话好意思不还是天天滚回去喝核废水吧,05月02日 21:59
4787,梭哈老头李投资,切尔诺贝利核电站内或发生核裂变日本排放和废水不说现在报道这个消息来了我觉得至少切尔诺贝利处理方式相对比日本来说还是比较妥当日本简直这种是不给子孙后代留路呀,05月16日 08:52
3298,Le归璨,谏山创谏山创你核废水喝高了吧绝对不接受加页,05月12日 10:32
1010,是阿诺吖QuQ,你割割货怎么还没卖完啊要不回日本喝核废水每天都爱泡脚浪漫小张2021改啥名啊怂货,05月07日 21:02
7413,amabambou,只想请核废水喝多的贱人闭嘴是个人就不会把这种违反人伦的杀情节给放出来虽然深层的逻辑崩坏无人在意有多少人被旁观者那话所感动就有多少人想撕碎这个sb作者是他背叛了一直支持他的读者我不反对有人想要支持这种辣鸡人因为这种局面已经说明了魔怔人多的是,05月01日 11:07
756,乃伊拉一咖们祖特,福岛核废水的产物刚上海闲话额上海宁我以为lsp们会有一个想法Churros要沾香草冰淇淋吓到饭小酱酱酱我死了,05月06日 14:18
9920,宇宙的起点是逻辑,如果上百万吨核废水排入到海洋中那么地球这颗美丽的星球算是毁了其所带来的环境改变对海洋生物等深远影响乃至对人类未来的改变都是不能被重置的那时哥斯拉大战金刚将上演现实版本作为海洋国家的日本如此决定怕是千古罪人菅义伟替罪羊的命运一开始就定下了,04月10日 19:10
10157,好天凉叶,xx桑们故乡的核废水已经可以喝了,04月10日 15:38
667,指尖左右,是不是想出名想疯了悬壶问茶动保环保人权女拳从来都是双标的目的就只是为了遏制中国山大王吴彬这个女子就是双标狗悬壶问茶瑞典环保少女对日本核废水一言不发却要求中国弃用筷子欧阳中壹它以为真是公主其实真活成了小丑,05月06日 16:42
456,causeeuphoria,各圈都是一潭死水啊有感觉到都在不停地萎缩下陷可能跟疫情相关吧下一波繁盛会在疫情结束后出现么自日本排核废水和印度疫情爆炸以来总有种世界加速灭绝的感觉唉,05月05日 01:34
9908,大嘴发言人,日本政府基本决定将福岛核污水排入大海作为曾经微博大V的王志安目前生活在日本对于日本福岛核废水排入大海王桑志安君认为没问题,04月10日 19:26
3619,香港中通社,瑞典環保少女向中國碳排放問題開炮遭香港網紅怒懟對日本排放核廢水態度曖昧的瑞典環保少女卻對中國的碳排放量急眼了美國有線電視新聞網CNN等外媒近日發布了一份報告報告聲稱2019年中國的溫室氣體排放量超過所有發達國家之和這份報告很快引起了瑞典環保少女格雷塔通貝里的註意她在社交媒體推特上轉載了CNN的這篇報道並點評稱中國制造了很多產品仍被世貿視為發展中國家但這不是中國毀了現在和未來生活環境的借口如果中國不做出改變的話我們無法解決氣候危機這種無視中國龐大的人口基數武斷地將氣候危機的鍋扣到中國頭上的做法引發了很多中國網友的不滿這其中就包括了經常就時事發表評論的香港網紅帽哥basa近日帽哥就在社交媒體上載了一段英文視頻批評環保少女的言論顯示出她有多無知視頻開始沒多久帽哥就向環保少女發出靈魂質問知道中國有多少人嗎14億人如果我們一起在地上吐口水甚至能制造一個海洋這就是印度洋的起源顯然吐口水成了印度洋的起源是帽哥開的一個荒誕的玩笑但他指出這就是其在看環保少女言論時的感受胡說八道接著帽哥用印度和瑞士GDP對比的例子向環保少女證明不看人均只談總量的都是耍流氓印度的GDP是瑞士的三倍妳認為印度比瑞士富有三倍帽哥反問環保少女並秀出了人均二氧化碳的排放量表中國在這份排名中排名靠後據此他回懟環保少女道我們都排到妳姥姥家後面了這鍋我們中國不背至於環保少女所謂中國生產很多產品但不是污染環境借口的論調帽哥也以自己的親身經歷以正視聽妳知道我們為全球生產了很多必需品但我們生產的是貨物不是空氣污染他指出自己在內地開設工廠因此深知中國的環保政策有多嚴格中國政府保護環境是以制定政策和計劃作為方案而不是發推文用嘴巴說帽哥嘲諷稱視頻最後帽哥呼籲她好好讀書學點常識以及關注一下需要真正被關心的議題日本排放核廢水而不是在推特上對中國說三道四香港網紅帽哥回擊瑞典環保少女的一系列言論也在社交媒體上收獲不少網友的點贊轉發有網友在評論區內指出環保少女對中國及美日等國一直采取雙重標準美國加州和澳大利亞山火的碳排放這麽嚴重那個時候她怎麽不出來說幾句O网页链接守护香港美国瑞典环保少女态度含糊回应日本事件大二男生从上海坐公交到北京安徽六安发现一例核酸阳性者印度医生警告牛粪疗法无效收起全文d,05月13日 17:32
1443,Daniel-畲,可以让核废水流入台湾人的心田哦,05月08日 20:46
6067,襄阳rmancy,4月9日复盘及4月12日预判分享1次新依旧是最猛板块龙头顺控发展预计周三复牌最强补涨龙8板泰坦股份但由于周末收到重点监控且美邦服饰止于9板加之顺控马上复牌因此当做风向标只看不做比较好那么还是关注低位的这里看好葫芦娃小药箱海南换手三板周一走加速比较好还有国光连锁周五涨停次新最低价周末阿里巴巴被罚利好实体零售2碳中和龙头碳中和电力的长源电力大游资战场非常有气质周一继续看好涨停3日本核废水排放周末发酵最猛先于龙水产养殖的大湖股份周一大概率大单一字这里看好海天股份次新污水处理4钢铁板块有业绩有逻辑的一个板块周五短线资金砸盘但机构接盘龙头重庆钢铁安阳钢铁中军太钢不锈华菱钢铁适合低吸已出业绩爆增的几个钢铁股主要是做板材的因此主营业务板材的本钢板材可重点潜伏收起全文d,04月11日 23:46
6481,醇蓝壬璩拾,挺好看的但是可不可以不排放核废水啊立本桑,04月11日 20:30
5290,南sir亲妈,福岛核电站储水罐已多次泄漏就知道这无耻之徒会干出这种事跟没有国际军事法庭制约的海洋公约一样不会遵守人类的规章制度如果报道是真实的那么合理怀疑已经开始偷偷主动排放了而且可能利用洋流选择季节时间来让废水大部分流向别国的领海,05月17日 02:25
