,博主昵称,微博内容,发布时间
9370,Sidntishein,笑死阪急能不能别营销了暗戳戳搞小动作选一个416开业膈应国人根本不想看的东西一天到晚在抖音刷到商场营销完了营销柜哥柜姐搞得跟选秀一样真不知道柜哥柜姐还是贵哥贵姐了二鬼子在我评论里发疯又没法喝到核废水孝敬脚盆爹的样子看了真让人觉得可怜还有如果真爱阪急就去消费呀光在我这儿骂人几个意思呀收起全文d,05月04日 21:40
8466,1ppaNR3,罐儿就会鞠躬放屁跳跳兲虎躬犟精神月刊勇者KuMa君鞠躬鞠躬早说了日本政府这十年来信誉快丢光了狗屎一样的躬犟精神zerofabric看看这些新闻真不知道某些人相信日本核废水经过处理是达标排放的信心从哪里来的另这个最后被送回的会是个什么东西呢贫铀穿甲弹,05月02日 16:30
7939,惋音了了,任豪没有人比R1SE更爱R1SE不关注爱豆有点分不清人这名字是上次核废水的那位吗真心没太记住这个团,05月02日 22:38
6332,SS第二帝国装甲师,通过全球海洋洋流或许日本福岛核废水未来不仅污染整个太平洋海洋生态环境甚至核污染整个全球国际化各大洋的海洋生态环境,04月11日 21:35
7495,十里桃花酒原创剪辑,ainmosnii她们脑子里装的都是核废水吧NeXT_turbo终于有明眼人说话了粉丝真的根本不看直接说我家哥哥就是被冤枉,05月01日 09:44
8531,艾丽丝的仙镜,外星人来到地球抱怨海水里满是变异海洋生物人类长得比外星生物还恐怖一定是哪个愚蠢的人类把核废水有毒物质倒入海水了这样的国家太糟糕了结果美国日本马上把外星人逮捕了外星人抗议我根本没说是哪个国家你怎么就能抓我呢美日咆哮废话我们做过的坏事自己能不清楚吗,05月02日 14:38
8440,新天地作者杨文,一只来自种花家的小兔兔核废水中不仅含氚而且还含62种金属放射性同位素它们存在时间长有化学毒性此外废水中的碳14半衰期为5700年历史上从未有如此大量的放射性核素排放到海洋里去,05月02日 17:09
790,青春就是那么酷,别关心日本核废水了关心关心三北防护林吧,05月06日 12:58
7844,enernity永恒,任豪没有人比R1SE更爱R1SE但凡换个人说没有人比你更爱日本核废水是真的高中学校这么好怎么会读成这样子,05月02日 23:00
2061,小羊_肥啾先生和他的小鸟,用核废水对变异病毒以毒攻毒吗卡洛_Jalo真十内只要胆子大秦祎墨团灭吧朝辞夏双向奔赴感人啊黑茶伯爵双向奔赴囧兰胸华纳今天倒闭了吗好家伙老梅梅梅好家伙莫克尔_这种双向奔赴真的大可不必,05月09日 11:56
10222,人间有味是淸欢咩,东京电力公司发布的2020年12月31日为止测得的福岛核电站废水中含放射性元素的浓度O网页链接可以看到Cs137的测得含量在008926BqL之间但是还是需要考虑两个放射性元素来源Afterthe90magnitudeearthquakeandresultingtsunamioccurredonMarch11th2011significantamountsofradioactivematerialwerereleasedtotheenvironmentfromFukushimaDaiichinuclearpowerplantRadionuclidesreleasedtotheatmosphereweretransportedeastwardbyastrongjetstreamandreachedthecoastofNorthAmericainfourdaysTakemuraetal2011AportionoftheseradionuclideswasdepositedonthePacificOceansurfacebywetanddrydepositionprocessesInadditionwaterusedtocooladamagednuclearreactorleakedintotheoceanKobayashietal2013ThustworadionuclidesourcesintotheoceanfromFukushimamustbeconsidereddirectdischargeofcontaminatedwateroveraperiodofseveralmonthswithpeakreleasesattheendofMarchandbeginningApril2011anddepositionofradionuclidesontheseasurfacefromtheatmosphereO网页链接一是泄漏发生的四天内巨大的喷射引起的飞溅的核素以及冷却反应堆的废水总体来说大部分的研究虽然认可海洋对放射性物质的消化能力但我个人不为乐观的是排放总量收起全文d,04月10日 15:00
2586,幻影旅团首席美人库洛洛,我想到了几个郑爽可以光明正大复出并且会受到爱戴拥护的办法不懂一兵一卒收复台湾把核废水全灌进菅义伟肚子里暗杀拜登彻底消灭新冠最后这个可能会受到全世界的爱戴,05月10日 10:00
5477,miyoumissyou,去纤苷从没有哪一刻会像现在让她强烈地感觉到自己就是一个卑鄙的盗贼享受着不属于自己的亲情去纤苷赛普替尼塞卡替尼卡马替尼CapmatinibPuriNethol聚乙二醇化组人粒细胞刺激因子新瑞白津优力重组人血管内皮抑制素注射液恩度替莫唑胺胶囊泰道来曲挫片弗隆枸橼酸依沙佐米胶囊恩莱瑞比卡鲁胺片康士得唑来膦酸浓溶液泽泰卡培他滨片希罗达注射用醋酸卡泊芬净科赛斯盐酸多柔比星脂质体注射液多美素马来酸吡咯替尼片艾瑞妮赫赛莱印度特瑞似是不悦她的目光那雾霭似的绿眸朝她瞥来日本核废水入海对中国有何影响收起全文d,05月18日 10:53
846,蛋挞制造者,其实别人穿不穿耐克和我没啥关系但是因为日本核废水指点我看日漫不爱国转头就买耐克我觉得挺离谱,05月06日 10:31
1591,氺氺杉,真的很烦很烦很烦主动提出来要组队参加然后自己却不提前说事情然后等到最后一天才说的人你是脑子被核废水冲得只剩下脑皮层吗我明确说了好累我已经不想了结果还是还是还是你这个狗比养出来的临到最后一天说要参加然后发个报名表说起构图结构一个都说不出来定的顺序都不知道很云里雾里的在创造你很棒哦哈哈哈哈笑死个人收起全文d,05月08日 13:41
5610,淮南山南警方在线,见证日本政府正式决定福岛核废水排海无耻行为,05月19日 12:43
9223,CPK国际专业蜜蜡脱毛中心,乐于悲天悯人的多喝点核废水和恒河水吧品尝下世界的酸甜苦辣,05月03日 11:13
5836,德国特拉多姆,新闻看点当年大地震引发的海啸冲入福岛第一核电厂时东京电力拒绝海水冷却方案因为那意味着反应堆报废损失数十亿美元他们押宝福岛能挺过一劫这才有了第二天的连锁爆炸和震后十年这125万吨核废水O德国特拉多姆坚持向善的水处理技术,05月20日 11:18
8348,南风在北京,这些人满嘴仁义道德内心深处无非是想攻击中国执政党贬低新中国的成就丑化中国人民的道德贱到骨子里我翻看了复旦严锋教授的微博无一字谴责日本倾倒核废水污染海洋祸害邻国这个时候他就不提邻居论了公知都是这个德行要求中国政府道德完美外国政府烂成渣也要舔,05月02日 20:14
7084,用户5761687587,你个垃圾五岳散人回复赵大叔_操心您家的空气吧我这儿就不劳您费心了赵大叔_很快就要被核废水包围了,05月01日 22:46
4419,神予人间恩泽,差点忘了谢谢字字粉及时给我送上了今天的核废水已经是喝高了麻烦帮忙维权让艾回赶紧给我打钱谢谢,05月15日 15:57
5594,神术荼,进巨加页快把我看复发了建议东电把谏山创投入核废水桶以毒攻毒中和废水,05月19日 13:42
3421,琴南司,玉柴子jsc老子真想狠狠地办你myouyouu谏山创喝核废水扶他柠檬茶他好像有那大病得去看了真的伊谢尔伦的风是不是看到火影死神都整了子世代的事情觉得自己必须跟上潮流苏离弦我头一次见这种跟自己读者有仿佛杀全家之仇的作者,05月12日 08:05
9282,王者就得归来118,精日汉奸们赶快去把核废水喝了战略安全与军控在线日本福岛核废水中不仅含氚而且还含62种金属放射性同位素它们存在时间长有化学毒性此外废水中的碳14半衰期为5700年历史上从未有如此大量的放射性核素排放到海洋里去它对海洋环境及生物链带来的影响难以预料转起,05月03日 09:16
2130,啾咪Seiko,日本核废水福岛的问题一天没解决我就一天不买日本生产的产品,05月09日 23:15
2305,松树冠·,一想起日本倒核废水就超级无敌烦觉得人类不配毁灭吧,05月10日 23:54
2762,哈士奇也有不二的才怪,让谏山创你去喝核废水吧,05月11日 22:16
546,长寿老人的伴,只有日本把核废水喝了才能自证清白否则说什么都是扯淡,05月06日 22:25
6572,永远的永远zeq,日本核污水57天将污染半个太平洋真该死啊小日本它妈的地球的环境是人类生存的根本这个理是不懂还是怎么滴这尼玛直接排核废水到海里这干的是人事吗真该杀啊这个比国家全球都尼玛为世界环境开了多少会议付出了多少努力我他么从好早就开始垃圾分类尽量骑自行车电动车坐地铁来代替小轿车了甚至每个人都在尽自己的小小努力来保护环境它日本说破坏就破坏还拉这全球人一起受罪真尼玛沙比你快点去死吧日你大爷的莎比日本排尼玛的核废水草尼玛的臭煞币日本收起全文d,04月11日 19:23
9487,南风雾月珍,回复kwndjekxkd你追星那么牛逼和爱豆一起去日本喝核废水吧支持爱豆事业,05月04日 17:56
1649,棠棣之伤,只准倭寇倒核废水不准中国坠箭残骸,05月08日 10:15
2909,啾啾鸣鸣,日本边倒核废水边鞠躬的样子姜颜魏唐李这就是不要脸吧明天是個好天氣阿甜端橙子没有没有你误会了我没有觉得错了只是造成了别人不适会抱歉月半弯岁月短一副我知道错了但我不改的嘴脸我看你不像卖惨倒像得了便宜还卖乖,05月11日 14:45
2220,迷彩乔哥,讲真的不提疫情这一块前段时间关于核废水的事岛国的官方就没这个说喝就喝的尿性,05月09日 20:05
5022,suju蓝家妹子,INTO1谈团魂是什么给我整笑了大家都忙着喝核废水呢哪来的团魂国籍都被开除了,05月17日 18:48
9843,大国全球观,新闻看点加速核废水排入海洋联合国紧急通告别危害全人类O向大海偷排核废水联合国通告日本别危害全人类,04月10日 20:11
5647,女兼人尔月庄,MGS粉新冠恒河水流进印度洋和日本核废水融合进化出新冠哥斯拉,05月19日 08:55
8436,看上你的ID了,这是喝核废水喝的,05月02日 17:14
2362,Lincx1211,中美中欧中澳关系风雨飘摇印度疫情恶化日本准备排放核废水二战以来世界各国也许得益科技革命蛋糕做大而暂熄战火而现在呢自私站队打压抢地盘分蛋糕一切又回去了这个世界会好吗,05月10日 21:24
2769,h_不能再咸鱼下去了努力斩托,讨论者Q小日本都喝核废水吃海核鱼了难道还会担心新冠,05月11日 22:05
9477,DrJQ_想要做现充,慕名前去观赏现在还在笑阿芷今天光合作用了吗从08年开始等的凯尔希黑潮之下就是tmd核废水北斗星空leaf这白开水怎么没味儿为斯卡蒂献出心脏我永远喜欢森蚺两面包夹芝士,05月04日 18:21
5353,痕圆祥,被最右笑拉了还差一个核废水讽刺就齐了萝卜酥_挖坑不止哈哈哈真右翼看到这个结局怕不是要去暗杀创骡木木暗示立本人拜鬼导致立本再次招核,05月18日 22:36
2258,长安城里的王长安,bingo乌合麒麟任何世界性质的环保机构只要是对日本核废水不闻不问却跑来指责中国环保问题的都是打压中国的政治工具当放屁就行,05月09日 19:00
2477,永恒的狐星,Lost_in_U连骂福岛核废水的话都做条幅什么毛病,05月10日 14:34
6246,天麻自娱,海产品类股票估计要崩小鬼子居然把核废水直接排放进太平洋海产品不能吃了代替的肉类食品会分的一杯羹,04月11日 22:15
7626,一粒甜承,把塌房团粉丝喝核废水变异眼睛瞎了打在公屏上,05月02日 23:58
2965,波斯猫99,日本向太平洋排核废水一事雷声大雨点小讨论了一阵子没有任何实质进展在今年的联大会议上应该提出动议对日本进行谴责同时寻求在安理会通过决议制裁日本政府中国可以单方面出台经济政策制裁日本企业,05月11日 12:09
1801,原来原来你是我的朱大哥,正确应战方式1总量我们可比美国少得多了2人均中国人就不是人了没有发展权了乌合麒麟任何世界性质的环保机构只要是对日本核废水不闻不问却跑来指责中国环保问题的都是打压中国的政治工具当放屁就行,05月09日 16:30
3250,夜玖-Etsu,我本来6月还准备去西海岸吃海鲜来着想说趁核废水还没流过来啊这可咋整海瞰ME艾塔这个真的太恶心了人类啊绝了山人素酒七花喵_荣耀不败五星鏈君_田中今天畫明糸了嗎铃铛铛今年飞升了吗吐了反射弧超长星人影九美国自己屁股都不干净,05月12日 12:36
6967,seldom不开心,日本人和精神日本人都滚去日本喝核废水吧无语,04月24日 23:58
10274,巴枝闭闭,等我喝杯拿铁可能你核废水喝多了谨言慎行不删号那是因为这种事没啥好讨论啊福岛排出去的是符合世界原子协会标准处理后的核废水各项检测数据网上都有有什么好说的,04月10日 14:28
1925,刘丽霞1965,王葆口感不如恒河水啊xlei74然后一起喝核废水,05月09日 13:46
5771,清同甫穷困,打核废水疫苗不就可以了,05月20日 16:05
9541,吃货八叔,被核废水污染后的三文鱼L吃货八叔的微博视频,05月04日 15:43
1867,独孤无霜66,晋未渊没准印度蛊王可免疫核废水过来烤熟你_2021激光中迎好运来这俩要交流养蛊经验吗逆光飞行死国已不办可乎我不是谦哥儿好一个双向奔赴这可比言情片刺激多了,05月09日 14:52
121,小凡好摄,叛乱省有人将凤梨加入粽子里一齐包即日起开卖右图是网友评论个人觉得还应该加澳洲红酒与核废水才算完美黄媒不会说的真相,05月05日 19:33
20,ZHY卐,O网页链接这王八没十年脑血栓没喝十年核废水治疗是干不出这么迷惑的事的,05月05日 23:14
5575,真勇者之翼,刚在群看到还以为是日本倒核废水马斯克计划15年内培育恐龙十元从政世界进入真哥斯拉时间线,05月19日 15:50
5263,LOL情报局,见盘151日本核废水和恒河水你喝哪个英雄联盟2021LPLLLOL情报局的微博视频,05月17日 06:29
6186,懿笙秋,小日本向太平洋倾倒核废水这下精日狗们都不出来吠了平时有事没事就要宣扬躬匠精神把自个老祖宗都忘得干干净净了,04月11日 22:41
5718,小黑五号,肖战喝光核污染废水拯救地球这TM也太棒了大好人,05月20日 20:06
326,永远喜欢夏天dv,无语了东边一个排泄核废水西边一个病毒培养皿今天也要早睡yaya我们真倒霉这都什么阴间邻国Cowboy67那全世界都很危险啊大家不要光觉得好笑也得有点危机感咱们离印度这么近还是比较危险的,05月05日 11:16
2176,榆树市红星乡,日本倒核废水她装死提到中国倒支棱起来了O日本倒核废水她装死提到中国倒支棱起来了,05月09日 21:41
6113,阿乐Lex,是曝光度不够还是我们真的麻木了都没怎么报道这个是不是等于慢性自杀而且是带着全人类一起日本要为历史负责应该让专家学者进入调查研究而不是看怎么便宜怎么来直接倒海里日本核废水日本东电称核废水稀释后能喝福岛核废水日本核污水57天将污染半个太平洋,04月11日 23:13
9497,在路上的小沙弥,神奈川冲浪里如果原作者葛饰北斋现在还活着他也会非常关心日本核废水问题2北京,05月04日 17:28
168,老张家的红色贝斯,啊啊啊这段花絮更强了然后弹幕有个说处理核废水有这态度就好的,05月05日 17:08
3831,LDMQ20200329,青羊共青团如何看待日本福岛核废水排海L用户6495967688的微博视频,05月13日 03:38
3550,-春天的第十八个瞬间-,罗那个豪是恒河喝多了还是核废水喝多了,05月13日 21:20
5335,已读不回-ii,哇唧唧哇难怪那么多人每日问候哇唧唧哇倒闭了嘛有理由的因为你值得啊每日一每天不同的法私生你不管安保你不做物资你不放哇唧唧哇晃晃脑袋听听有没有核废水的声音福岛快乐水你值得拥有,05月17日 00:06
916,美东侨报,美日韩外长会谈韩当面对日表达核污水问题担忧当地时间5日上午为出席七国集团G7外长会议访英的韩国外长郑义溶在伦敦同美国国务卿安东尼布林肯日本外相茂木敏充举行会谈三方商定就美国对朝新政策加强合作会谈后郑义溶和茂木敏充还举行了双边会谈双方在历史遗留问题日本排放核污水决定等问题上仍存在分歧O网页链接侨报新闻速递日本福岛核废水排海收起全文d,05月06日 04:52
6258,老龙看市场,假期两个被媒体反复暴跌消息一个是阿里巴巴被罚款182亿另外一个日本向太平洋排放核污染废水对应的股市逻辑上周五都有一点异动其中抖音股上涨和阿里被罚有相关因素而淡水养殖股强势就是日本的骚操作了,04月11日 22:10
8398,玉龙雪精灵,印度人真的一言难尽我对印度人从来就没好感现在居然成了新冠最大的养蛊国然后日本的核废水也开始偷排了这两个邻居各有各的奇葩真的不能理解排放核废水这么大的事为什么全世界的其他国家都没声音了都好像默许了印度那事还是继续戴好口罩吧,05月02日 18:37
633,折桂枝枝,乃万工作室声明内真的都是什么不读书的傻比当明星啊前有建个罩子阻挡核废水的现在有一个无法追梦社会需要买房买车这都怪女的不宽容争当意见领袖挑起对立炒作谋取红利的样子像个8000,05月06日 17:38
6639,一碗初心,福岛核电站4000个废弃物集装箱信息不明一个海啸再把废水给拍回日本就不是鞠躬的事儿了,04月11日 18:49
5989,云深不知处迷途的羔羊,这是曹县最大的耻辱你们不去日本进口点核废水礼尚往来一下吗,05月21日 11:59
104,杏仁橙汁冻,疯狂赶作业时随机播放着黑塔角色歌真的是总忍不住想哭圆圆的地球转动着世界是多么美好但一想到小日本放核废水又踏马的好恨为什么,05月05日 19:55
7538,桃娘咣咣冰,团综壶c还是挺好就是粉丝洗得让我想和她们解释解释为什么入党要政审因为人可以吃屎味巧克力但不能吃巧克力味的屎在共产主义全人类解放前原谅劳动人民千百年被奴役的愤怒还不能平息我们不想连坐建议粉丝别再乱洗地就是这个理壶老三和壶老九一个赛一个的不要脸老三的脸其实不是肿了那是厚了脸皮厚了一年四个女人已经能站成四面墙还不够封闭你是不是想多来两个把上下两面封成长方体老九那副作态真想让人连夜送进警局喝个几壶鉴于是我方派出的核处理大使那几壶就上2010最浓郁核废水吧壶老四现在的处境就像是某个区域公司业绩很好的销售却被集团的监察中心处罚了天天梗着个脖子反问公司你想想是业绩重要还是这些虚头巴脑的规矩重要我做了这么多公司这点宽容都给不了这话说的集团又不缺你一个销售当然当换就换区域公司只想拿出手机催Hr新的人什么时候到岗另外查查是不是合同快到期了如期解约咱们不赔n哈小笨蛋想赚钱的这么多文艺这么主观的东西又不能整个好坏标准大家可不就指望着这点虚的东西淘汰人么这些话都回家对空气说吧收起全文d,05月01日 08:14
3926,圆塘ripre,椰姐油菜花香薰脆饼关于我作为小事儿磕壶酒吧一定要嘴遍8粉圈那档事隔壁首相秘书们太过可爱怎么办qi7椰会说多说点星球失速脱轨论核废水怎么喝不会变成哥斯拉,05月14日 20:00
83,一颗陈陈陈皮糖,核废水咕咚咕咚熊熊今天变可爱了吗免费领了一张立本居住证和100次核菲水体验券,05月05日 20:51
5173,同君阁老,小鬼子内阁把太平洋当作它家的下水道核废水到处排放即使岛国内再努力做好垃圾处理于世界又有何意,05月17日 11:50
8831,天使的城电视剧,热门电视剧剪辑剧综汇精彩奥特曼中因海洋污染而出现的怪兽强烈抗议日本政府决定将福岛核废水排入大海污染海洋是会有代价的当今的日本政府应该看看以前的日本人的认识L天使的城电视剧的微博视频,05月03日 21:21
9492,泡芙还是舒芙蕾,这是喝了多少核废水,05月04日 17:39
2581,已婚奶爸痛车男,感觉我国对外键盘输出能力真的不行要在微博已经被怼成狗real_RyosOfficial正经人谁评论时政啊菲特泰斯塔羅莎我们的火箭掉水里就危害全球他们的核废水就安全环保日本傻事大部分残骸竟然大气层里销毁了剩余也掉海里了真太可惜了没有,05月10日 10:07
2325,作家神棍局局长,反对日本政府往海里排核废料日本强排核废水将使海洋生物失去家园,05月10日 22:59
10360,薛定谔_viviani,丧心病狂日本决定把福岛核废水排入大海UP主留学生日报bilibiliO丧心病狂日本决定把福岛核废水排入大海哔哩哔哩客户端下载O网页链接你们的老婆更新好勤快啊,04月10日 13:17
5995,totclaudia,睡了一觉guojie的脑子又浆糊了核废水在睡梦中灌满了她的脑浆吗,05月21日 10:57
1963,天妒修羅,一般骑乘员副队环保批保罢了张宏圣好图共欣赏查看图片Esports海涛选择性眼瞎真是小丑一只乌合麒麟任何世界性质的环保机构只要是对日本核废水不闻不问却跑来指责中国环保问题的都是打压中国的政治工具当放屁就行,05月09日 13:03
5472,天城1668,去日本喝核废水吗日本傻事现在就在抵制苏菲大咪蜜等着瞧开完了东京奥运会鬼子立马翻脸地址北京冬奥会,05月18日 11:22
8455,holaaa21,倒也不用一起唱爱我中华任豪带着一起去喝核废水吧就不用他辛苦建罩子了,05月02日 16:43
961,小米大咖,新冠核废水奥运会坏事做多了老天都不会放过它,05月07日 23:23
955,人间清醒菜菜,众所周知蛙卵不喝奶茶喝核废水,05月07日 23:41
3037,一羽剪影,成都49中外有日本核废水内有成都49中,05月11日 08:50
9964,中二病院酱,偷国又名南抄县核废水排入大海地球至少要两万年才能降解至人体可承受范围在热搜上却存在不了24小时,04月10日 18:36
7060,每日国际视野,继赵立坚个人推特发浮世绘改图后中国驻日大使馆再讽美国死神朝日新闻等日本媒体4月30日称继中国外交部发言人赵立坚以仿浮世绘插图讽刺日本政府决定将核废水排放入海后中国驻日大使馆29日疑也在推特Twitter上发文所附插图描绘身着类似美国国旗的死神正向埃及敲门,05月01日 23:46
4688,兔兔的正版TARDIS,左图当超人阿光被关起来大海被核废水污染时雷杰多在拍照右图伽古拉在拍照对不起我不太知道这边还该有谁正反两边都没有伽古就离谱还真就应了鹤田p那句我也不知道你是那边的嘛,05月16日 18:47
9471,wzpatrick123,东邪影视可攻可受深居简出外网官媒说w汉病毒圣母们没有激动外网官媒排挤新疆棉花圣母们没有激动外国官方公然说搞乱x港t湾圣母们没有激动r本要排放核废水圣母们也没有激动但是今天圣母们纷纷破功了这是因为什么呢,05月04日 18:33
2826,H同位素,日本急不可耐两套方案进行核废水排放却是为了保护核电站人员虽然最终核废水是定在两年之后向大海排放但是日本的这一决定已经在国际上引起了巨大舆论但是面对各方的抨击日本并没有收回自己的决定O网页链接日本的做法,05月11日 19:40
10288,修修_AAA,丧心病狂日本决定把福岛核废水排入大海哔哩哔哩动画O疯了日本正式决定排福岛核废水入海美国竟支持,04月10日 14:23
4853,陈宇和喜羊羊,不是中国美女们你图又矮又丑又老又没情商的日本鬼子什么图他可以帮助世界喝太平洋的核废水吗,05月16日 00:19
9795,steedcar,应该用船运到太平洋深处倾倒远离陆地稀释浓度樊建川瓜果爹爹整个太平洋来稀释是肯定没问题的问题是怎么可能整个太平洋的海水都来参与很明显这些核废水会导致部分海域的含量严重超标危害人和生物临近的国家都要遭殃所以我国说要跟周边国家商量着来一点不错,04月10日 21:10
6009,KUN-Pluviophile,神化一个国家真的很有病而且神化的还是别人的国家更有病了听人吹日本的偶像多敬业你是没看见跟女高中生喝酒回酒店然后鞠躬道歉过了没多久又出来演剧有名的女演员不离婚还说要继续支持出轨丈夫的事业这跟你瞧不起的内娱差不了多少整天吹日本有责任心就跟没看见核废水往海里倒似的,05月21日 09:15
5411,keke哈哈笑,都是和核废水喝多罢了已经疯的神智不清了,05月18日 17:50
5001,湘潭大学环资学院,新闻茶话会日本政府做出核污染水排海决定后福岛核电站储水罐接连发生泄露自4月25日已出现两次废水泄露事故湘潭大学团委湘潭大学青年传媒中心,05月17日 19:07
6087,方阿雾,虞舜重华最先是加拿大发现日本偷排核废水应该还能搜到新闻而且去年菲律宾的科学机构从南海的珊瑚中分离出了人工放射性同位素碘129南海中同位素碘129的浓度大幅升高而同位素碘129的主要来源就是核反应堆主要是核燃料后处理或核事故扩散到环境中,04月11日 23:28
8515,syfsy詠竹詩溪,这很霉国欢迎倭奴核废水排海却禁止进口倭奴海产品一边和阿三站在一起却发出旅游禁令记得前两天阿三还加开了赴美的直达航班吧魔笛是真够魔性的,05月02日 15:26
