,博主昵称,微博内容,发布时间
875,Nos6me32132,你要做杠精麻烦先换个人杠行吧脑内摄影高级高手这个话题已经过时了啊先把你马哲毛概成绩放出来溜溜再来谈辩证法Nos6me32132所以在核电站已是既成事实的情况下日本排放泄漏核废水有没有问题我一直在和这个博主讨论这个问题博主也在强调各国都有核电站,05月06日 09:00
9687,王大丫大码女鞋,福岛核排放概念一览表大湖股份公司是国内最大的淡水养殖企业拥有长期使用权的天然湖泊面积近180万亩占我国已养殖湖泊和水库面积的49天马科技603668中国淡水鳗鱼龙头企业淡水鱼饲料龙头企业公司主营业务分为淡水鳗鱼养殖等特种淡水鱼淡水鱼各种饲料淡水鳗鱼养殖加工出口全产业链还是出口鳗鱼龙头企业相当于淡水鱼从养殖到加工全覆盖百洋股份002696公司有淡水鱼养殖业务2核污染水处理预防华金资本000532全资子公司珠海力合环保距离大海1分钟车程距离大海最近的污水处理上市公司日处理废水能力9万吨有两家净水厂叠加横琴粤交所概念南方汇通000920旗下的沃顿时代水处理膜能过滤9999的辐射污染水可以自己百度新闻贵阳时代沃顿科技公司技术副总经理吴宗策缓缓展开看似牛皮纸的反渗透膜告诉记者这款膜可以过滤掉99999的放射性物质可用于解决日本核辐射引发的海水污染净化问题津膜科技300334水处理膜龙头企业国内最早从事膜材料和膜组件生产的公司之一在国内膜法水处理技术领域处于领先水平公司的水处理膜不断拓展石油化工核工业冶金钢铁电力纺织印染等高浓度工业废水处理业务打破国外技术垄断塑造核心竞争优势北化股份002246防核辐射第一股北化股份旗下的新华公司核生化防护及活性炭专家公司全资子公司山西新华防化装备研究院有限公司生产核化生三防器材系列产品主要运用于工业防护核生化防护等际华集团601718是国内最大的核防护装具生产企业公司有生产各种核防护肤防护帽等中核科技000881公司有核污水处理技术海伦哲300201公司军品主要包括核生化应急救援和洗消设备危化品事故应急救援装备产品捷强装备300875公司产品主要应用于军用核化生防御领域装备收起全文d,04月10日 23:11
4274,咚咚咚-coming,哇唧唧哇INTO1官博哇唧唧哇原来是有公式照的呀这20多天这么多活动过去了还以为这个团是没公式照的呢你这屁股歪的咋的是想把日本海的核废水包圆了那这样也挺好为民除害姑且原谅你们去喝吧2杭州,05月14日 00:23
1519,红旗下的孩子跨世纪,哼敌敌畏和要把核废水倒进海里的是谁,05月08日 17:22
5497,刘彰和母狗粉丝死了吗,刘彰ysl刘彰ak刘彰diss爱豆刘彰辱女刘桑故乡的核废水给你送来了喝一口回忆家乡吧,05月18日 08:32
8517,海玲BL0G,快乐过五一听听这个不正经的专业类博主聊聊核反应堆和核废水究竟是怎么回事我听废了L海玲BL0G的微博视频,05月02日 15:25
9456,西安锡安山养老院,微笑背后是冷漠真棒核废水也喝点吧每天18吨为了世界冲,05月04日 19:00
1664,冷风冷雨看世界,赵立坚嘲讽美国对核废水身体很诚实O赵立坚嘲讽美国对核废水身体很诚实,05月08日 09:25
1604,阳阳7-2,闲来无事搜了一下唇珠没想到误入核废水你怎么那么爱他呀不像我只会心疼没念过书的小笨蛋,05月08日 12:49
3436,宝贝我最爱55,确实天天佑岚对比印度对比排核废水入大海给全球生态环境带来的破坏一天100人在日本政府眼中真的只是涟漪,05月12日 06:24
4717,恶人谷-絳霄,最近火起来的两面包夹芝士也是这样吧现实生活阻止不了核废水游戏世界阻止不了矿石病,05月16日 14:06
7333,今天是个好_日子1,力丸Rikimaru力丸INTO1天才全能编舞被骂改国籍喝干核废水的时候都没破防胖丫ig辣照一删伤心欲绝哭了一早上现在已经好了INTO1力丸,05月01日 12:48
693,裤衩大仙_这号冷处理,建议直接注射核废水和病毒一起变异赛跑呢斯库里一氧化二氢也是安乐死注射液中的主要成分好吧,05月06日 15:58
2139,三月的梦里,薄荷飴宓婠核辐射病毒晋未渊没准印度蛊王可免疫核废水过来烤熟你_2021激光中迎好运来这俩要交流养蛊经验吗逆光飞行死国已不办可乎我不是谦哥儿好一个双向奔赴这可比言情片刺激多了,05月09日 22:52
1356,欧皇院里的柠檬精,丑瀚这么快就露馅了买赞就买赞买到了合作方被抓现行了还死不承认不愧是体面演员野人也真的又当又立自家正主前排买赞粉丝说控评垃圾还不是觍着脸上去挨打核废水是不是就是野人吐出来的水啊买赞,05月07日 00:48
3493,娴娴娴娴娴-w-,谏山创你是不是喝了核废水啊,05月12日 00:27
636,仙贝是玄子的小棉袄,其实仔细想想新冠病毒应该搞不过核废水建议一试阿鸡鸡wjjmsg笑死へパンダ大佐太赚了一针变DIO多伦多的白金手套切了鸡一氧化二氢爆炸横山奈绪MSG歹戲拖棚ReFMSG草永遠鮮紅幼月mk8哈哈哈哈哈哈哈为啥有MSG啊發x998太可怕了,05月06日 17:35
3822,我为我的言论买单,日本推降温口罩所以日本核废水怎么处理,05月13日 07:09
3445,文学救人,谏山创你有病吗你核废水喝多了,05月12日 03:01
7891,ww-8L5,热搜第一你豪不要脸这也能偷没人比你更恨壶没人比你更多塌房没人比你更明白核废水没人比你更爱密室逃脱,05月02日 22:48
2946,我停止使用语言,但凡换个人遇到这种事就不是你婊里婊气提到的破口大骂不拿着你那臭二皮脸用马桶栓子呲在地上摩擦用完再丢回马桶冲进太平洋和你妈飞满天涯海角的骨灰作伴去喝几吨日本核废水都是轻的知道吗老畜生,05月11日 13:01
3244,p1z2h3gnimocreffo,我想给jsc上上坟爷的二次元青春就这样被恶心到了从初一下学期开始追巨人之前烂尾我还能找一些理由说服自己现在加一卷恶心人真的想寄刀片了jsc喝核废水大脑变异了是吧,05月12日 12:47
3789,鲔鲔鲔,中国新闻周刊所以核废水的事情大家都抛脑后东京饮用水核检测超标也抛脑后全球的奥运健儿都是试毒勇士,05月13日 09:53
8971,款冬mila,oceancat我真的绷不住了笑yue了帕秋莉不要了的破旧笔记_PaQ核废水他的酒里掺了核废水废络达救救蒂蒂綿飴我的脑子被烧坏了笑得我骑车出门淋雨丿乛冂十二了一oceancat给我笑吐了阳台花枝丸我把今年的份都笑完了好白的尤莉急性源石病发病现场p2看完笑一下午,05月03日 19:21
3296,为斯卡蒂献出心脏,一定是核废水干的谏山创厨妈的居然圆回来了庵野秀明厨哈哈哈哈哈哈哈哈哈哈哈,05月12日 10:34
280,oenophile_ikun,任豪回应其实我觉得他的观点没错虽然他的思想确实有点简单但是我赞同这个孩子的想法即使核废水是日本自产自排但排向的是我们共同的家园共同的海洋迟早有一天核废水会漂洋过海来到中国甚至去往更远的地方到时候我们就要跟着一起遭殃还有更多的人现在新冠疫情还没过去祸不单行只会更加添堵中国虽然没有义务帮助日本但我们有义务保护自己的家园甚至很有必要保护我们自己收起全文d,05月05日 13:15
178,空気使,捏妈的笑疯了迷惘的绵羊没提前喝30年核废水画不出这么大的头,05月05日 16:51
7500,splendor_Qyj,INTO1官博瓜吃多了小心闹肚子核废水喝多了的水平,05月01日 09:36
2963,incebdijxnr,好了解日本美国印度啊宁就是日奸美狗阿三孝顺儿三重人设Roby502是吗日本推脱责任往福岛排核废水给下一代造成什么影响美国新冠死了50万人歧视亚裔给下一代什么影响印度每天新增40万新冠街头火化给路过的孩子什么影响批评国内做的不好的地方没问题但是瞎带节奏引申到体制环境,05月11日 12:18
8818,蜡笔小芯眼紫,沉迷这类男人赵立坚说请日本官员先喝核废水,05月03日 21:25
1401,YNLYFD,真牛逼前有日本大臣喝核废水后有印度阿三饮牛尿,05月08日 22:44
1487,牡丹弄脏了,一只钢铁侠卧槽牛逼陸上鯊魚核废水嘿哈紧跟时事油管还有一个预告片套路嘿哈光是字也很精彩骄阳小麦继续有画面了,05月08日 19:10
4221,陈老三6166414148,既然核污水能够达标生活饮用水源就请日本天皇夫妇及其家庭家族成员日本政府首相副首相内阁成员各级地方政府官员及其家庭家族成员先行饮用替全亚洲乃至全世界的人们喝一喝品一品核废水啥滋味儿,05月14日 02:20
6312,紫金股哥,下周重磅题材日本核废水将排到太平洋从排放后可能会到我们南海一带必定会影响我国海洋水产和环境安全啊核污水排海概念股一览1碧水源拥有全产业链目前已形成市政污水和工业废水处理自来水处理海水淡化民用净水黑臭水体治理固废危废处理等全业务链2中环环保环境工程业务以工业废水治理工程为主致力于攻克高难度工业废水目前公司已在医疗废水高浓度有机废水等领域均取得了较好的成果3科融环境一家集水环境治理危废处理固废污染物处理等业务于一体的环境综合治理平台公司4首创股份业务范围包括固废处理黑臭水体治理等综合环境治理业务5瀚蓝环境覆盖自来水供应污水处理固废处理全产业链拥有多个污水处理项目的特许经营权建设南海固废处理环保产业园6N中金辐将辐射源用于医疗食品等领域消毒和核辐射概念沾边7辰安科技公司研制具有中国自有知识产权的创新产品水体放射性核素在线监测仪器实现水中多种放射性核素在线自动测量填补该领域国内空白8海伦哲子公司目前军品主要包括核生化应急救援和洗消装备危化品事故应急救援装备两类产品9中广核技公司目前拥有处理核电站放射性废水的无机吸附剂技术该技术于2018年获中国核能行业协会科学技术进步一等奖10捷强装备公司目前在放射性物质侦测核化污染物洗消等领域已有相应的技术储备和产品储备11北化股份子公司所生产核化生三防器材系列产品主要运用于工业防护核生化防护等12建龙微纳目前公司的核废水处理专用分子筛正处于小试阶段尚未进行大规模市场应用13普利特气凝胶项目在环保领域可广泛应用于废水处理空气净化和核废弃物处理等2宁波收起全文d,04月11日 21:47
10223,调侃王微博,日本一再鼓吹他们即将释放到太平洋的福岛核废水是处理过的安全的那为什么不把这些水接到自来水管道上呢排到日本岛上的江河湖海里不行么123万吨核污水可能会给太平洋和沿岸国家带来非常大的环境影响自己造的孽鞠一下躬就要让我们来分担日本国驻华大使馆日本政府基本决定将福岛核污水排入大海收起全文d,04月10日 15:00
630,sakiyuiiii,哟评论区喜欢日本鬼子造的纸片人的还不帮你的纸片老公把核废水舔光舔不干净让日本爸爸不高兴了说你推是个参拜jingguo神社支持大家多喝核废水长成蛆脑的二鬼子怎么办,05月06日 17:51
2829,十个馒头二斤白酒,浓痰核废水奶茶,05月11日 19:35
9792,狐仙说,简单来说日本打算倾倒核废水英美媒体一片静默仿佛这个事不存在或者根本跟他们无关说明啥说明现如今的国际舆论不取决于你做了什么而完全取决于你和对面关系如何坏事不可能是日本人做的这就是西方媒体的价值观真的挺无语的,04月10日 21:13
10000,daisy200101,艹Amy夜月firstinter哈哈你也关注了他家的小狗日本要往海里倒核废水了他也不吭声还在假装关心环保世界驰名双标果然名不虚传美国是世界上最虚伪无耻的国家,04月10日 18:01
5965,ZEALER-X,挺好的就是让我想到核废水,05月21日 15:30
8079,风行gary,任豪没有人比R1SE更爱R1SE任桑家乡开始排核废水了快回去喝点吧,05月02日 22:13
7067,Simone64ever,因为夸了一句外国人从而被顶刘粉丝单方面踢出国籍并赠送了女优核废水二鬼子三件套使得本二鬼子沉醉于顶刘的魅力无法自拔现决定把此号拿出来单独为字字用发表我对字字和字字粉丝的爱慕之情没有为什么问就是字字值得,05月01日 23:32
9333,人造幻想型伏特加,喝喝那就喝核废水和发小作文选一个吧,05月04日 22:43
1518,辰安科技sz300523,辰安科技sz300523投资者提问请问4月以来公司是否收到国内国外关于核废水监测设备及软件的询价点击链接查看更多O网页链接,05月08日 17:22
10212,时空漫游者Neo,中国这回敢不敢站起来带头猛敲日本的狗头楚钦CQ511所谓环保NGO最爱摆拍几个矿泉水瓶子现在也流行摆拍口罩声称这些东西污染了海洋对日本排放核废水视而不见,04月10日 15:06
917,喝喜酒喜上加喜,日本执意排放核废水俄罗斯果断亮剑菅义伟慌乱中向美求救日本执意排放核废水俄罗斯果断亮剑菅义伟慌乱中向美求救O网页链接,05月06日 04:06
5699,我本温柔宝宝一枚,小心核废水,05月20日 22:02
1135,常豆豆i,美国海域发现27000桶或含剧毒废料日本政府正式决定福岛核废水排海真的是父慈子孝,05月07日 17:10
9468,用户7436080759,日本副首相称喝处理核废水没事,05月04日 18:35
5189,要闻漫漫谈,我发表了头条文章日本福岛核废水事件O日本福岛核废水事件,05月17日 10:53
9853,春眠不觉晓要支愣起来,大孝子谨言慎行不删号那是因为这种事没啥好讨论啊福岛排出去的是符合世界原子协会标准处理后的核废水各项检测数据网上都有有什么好说的,04月10日 20:02
10369,兵道之魂,愤怒的石头_99939中俄朝韩就拿日本的核废水没办法了吗,04月10日 13:09
5619,日本新鲜事儿,日本日本核废水韩国渔民要求日本每天赔偿一千万韩元L日本新鲜事儿的微博视频,05月19日 12:00
6826,曾经的平头哥,没想到老金头也来了特么的一个个都变成核专家了不惑2015经济学家真的是除了捞钱其他什么都不懂把核废水说成核废料还类比到切尔洛贝利事件荒唐之极先去看看现在世界上有核电站的国家都有核废水看看他们是排了呢还是自己喝了,04月16日 23:58
3549,Slinnnnnnnie,1921侧颜海报你这选角笑死我了拍动画片吗选角谁选的脑子被核废水贯穿了就赚流量钱呗恶心透了演艺圈现在就这逼样儿真吐了,05月13日 21:33
9194,妙妙的子期,进入三次方对不起各位我家小母们来到这撒泼了我马上让老母瘤子喝点核废水让它清醒清醒让它好好管理小母们,05月03日 11:38
2470,要是能使出月牙天冲就好了,一个破列车有问题而已核废水都直接倒进太平洋要全球物种灭绝的国家列车出现问题这种小事还算是问题731细菌部队的祖国一定让你日不落帝国瑟瑟发抖颤抖吧日不落帝国让你尝尝法西斯轴心国的厉害,05月10日 14:49
1206,山口小飞侠,去年我想在有小孩之前去日本玩一圈不然几年都没法出去玩现在我觉得等我孩子上幼儿园了差不多就能去了梦幻duoyao夭寿小森盐焗鸭霓虹金毁灭吧打咩鸭坂田暮瑾有生之年我还能见到gene吗Lillion就GG加上核废水感觉好几年都不能去日本了,05月07日 14:38
710,蛋挞边边挞,任豪假唱麦都不举起来老舅妈你还记得吗算了你不记得也对应该是最近忙着喝核废水吧茉茉小姐的小猫猫很多歌他都没张嘴,05月06日 15:23
6956,繁语_,风息神泪配合今天那条福岛核废物集装箱泄漏看所以到底为什么还会有人相信他们的数据冥王星1974同样因为钱的问题本来核事故废水可以用pe桶存80年再处理达标排放核电站周边空地有的是但要2亿美元政府就决定直排但同时可以一次次拔款修复因核事故损害的日本政府世界形象,04月23日 23:57
949,魔都乡下人佩恩,前年的阴谋没有成功今年又想出来更多近距离的危害我们的阴谋比如缅甸政变日本核废水印度疫情,05月06日 00:03
989,你的白紙sama,封锁好吗小森盐焗鸭霓虹金毁灭吧打咩鸭坂田暮瑾有生之年我还能见到gene吗Lillion就GG加上核废水感觉好几年都不能去日本了詩織想騎馬闪耀的群青我靠彩津寺玲奈,05月07日 22:26
3858,98我看看,至于我为什么不能是一种海洋生物蟹也好乌贼也好我宁愿喝点核废水,05月13日 00:37
2637,WENYu_1,倒胃口乌合麒麟任何世界性质的环保机构只要是对日本核废水不闻不问却跑来指责中国环保问题的都是打压中国的政治工具当放屁就行,05月10日 06:44
4195,年度美女预备役,说累了这里是China不爱国的可以滚了250退国籍出门左拐核废水喝好不送能替1921说话的基本都有那个大病吧,05月14日 07:55
9775,典会明大,确实大眼也有洗地的钱花在刀刃上了敦煌郡公乒乒乓乓的涅瓦河一玶海岸看了一下少女继续发推支持全世界学生周五逃课对日本排核废水目前还一言不发评论里有人提示也置之不理风云sfy瑞典的环保少女呢,04月10日 21:29
2308,爱摄影的小杰杰,医疗圈那点事印度果然是只有你想不到没有它做不出来的东边的日本想要偷偷排放核废水西边的印度偷偷往河里扔新冠尸体前几天G7外长会上一群道貌岸然的人还说中国恃强凌弱恃强凌弱的中国可谓心里苦,05月10日 23:52
3877,Collapsaroche,进击的巨人加页谏人你喝核废水了是吗,05月14日 23:21
7253,Liebe_Ren,昨夜激情收拾厨房竟发现这么多瓶瓶罐罐都是去年就过期的了边听核废水处理的播客边往马桶里倒酱料啊心情复杂,05月01日 15:46
3271,·橘个莉子·,脑仁没叫车撞碎一万次尿不出来吧就这cjb东西还分析个屁不如分析谏人脑壳里面那坨屎包含多少升核废水写个论文我看能投sci,05月12日 11:23
6341,统帅凯撒,德国亥姆霍兹基尔海洋研究中心GEOMAR的模拟显示日本如果将福岛核污水排入大海我国将首当其冲受到影响三年内辐射就会扩散到整个太平洋据实韩国美国加拿大澳大利亚等太平洋周边国家都将不能幸免日本这招真够狠的这叫无声入侵不光我们要坚决抵制就连美国澳大利亚与加拿大都应该站出来对日本这种把137万吨的核废水排入太平洋内给予坚决反对才是毕竟这种行为到最后伤害的不仅仅只有我们连同太平洋周边海域其他国家都会受到不同影响这种行为坚决不能让其肆意妄为得逞想想二战那是一个让全人类悲痛的经历前期就是太过放任自流日本才有机可乘进入亚太以及西方国家就是因为当时阻拦力度不够听之任之这才助长了日本当时的侵略性嚣张气焰以至于让整个世界都处在一个战争时代现在回头想想都是血泪的教训而此时此刻再不能听之任之不能放任日本如此肆无忌惮的行为了现在又要展开无声的入侵将137万吨核污水排入大海中很可能会对全人类和地球造成无法挽回的伤害和损伤早在2011年3月11日日本发生90级地震导致福岛第一核电站发生自苏联切尔诺贝利核事故之后最严重的核事故事故发生后日方为冷却核反应堆产生的所有核污水都储存在该核电站内且以每天约140吨左右的速度持续增加预计到2022年夏天储存核污水的水箱容量将会达到极限的137万吨今年2月下旬日本东京电力公司工作人员在接受法国媒体采访时透露该核电站目前放置的核污水储存罐数量已经达到了1074个而且也没有地方能再建新的储存罐说没有地方储存这明显就是一种说辞日本真没有其它地方建立存储罐的地方了吗这明显不可能目前为止核污水中被检测出含有大量放射性物质据介绍核辐射既能杀伤细胞又有诱变的作用可能诱发细胞癌变或基因突变导致生物畸形等短时间内摄取剂量一旦超过100毫希沃特人体就会受到伤害如果超过4000毫希沃特将会直接导致死亡2011年4月4日东京电力公司就曾将内含低浓度放射性物质的115万吨污水排入大海时任内阁官房长官的枝野幸男说这样做是别无选择真的没有其它选择了吗明显就是一种推辞菅义伟明明要参加大选了为何还要如此固执呢现在的日本海洋周边渔民对此事表现出来的是极力反对菅义伟这个举动必定会遭到日本民众的抵制对其大选也会有害无助力当然日本此举动韩国尤为关注毕竟核废水投入海洋后韩国可谓是首当其冲有可能成为日本后最受伤的另一个国家收起全文d,04月11日 21:32
3118,内经爱好者,穷我一生作你侍臣这我宁愿喝核废水WYK核辐射也不过如此,05月12日 21:02
3427,Sponsor_fortyloo,和一个旅行社的朋友聊天说去年疫情游轮游凉了一年今年福岛排核废水爆出来游轮游可能就彻底凉了,05月12日 07:50
2510,一个人梦想CJ,环保是真挣钱卢克文问一下这位美少女日本宣布倒核废水时你在干什么,05月10日 12:49
5206,一般路过普通小饼干,sky光遇黑市来猜复刻吧白金红耳机公主头总有一个得猜中吧猜中了抽个幸运儿两面包夹芝士没猜中就核废水吧,05月17日 09:42
2047,一抹雨烟啊,真可怜小小年纪脑子里就装满了核废水,05月09日 12:05
9063,佩佩呸呸呸zhou,任豪没有人比R1SE更爱R1SE别设置评论权限啊某个任桑的粉丝出来对线呗我一肚子话想跟你掰扯呢小嘴不挺能叭叭的吗你们飞印度火化吧核废水都救不了你们了,05月03日 15:55
2778,ON1原始人,成都学生坠亡事件有哪些疑点成功把一个中国学生坠亡的事件制造成了中国网络第一热点新闻大大缓解了西方世界因新冠肺炎引起的百万级死亡和因此造成的舆论压力缓解了日本准备倾倒核废水的新闻压力缓解了日本因新冠肺炎反弹能否举办奥运会的压力缓解了印度烧不完的病人尸体的压力,05月11日 21:50
4366,多放点糖吧谢谢啦,吃饭时爸爸提醒不要再吃海鲜了我心里好难过又没办法日本太自私太不负责任倾倒核废水危害海洋动物的安全危害全人类再多的礼貌都掩盖不了日本是虚伪且不义之民族,05月15日 19:44
5256,执子之手愿与携老,日本人排放核废水印度排放新冠地球要毁灭啊啊啊,05月17日 07:05
4028,酒啾王,哇唧唧哇INTO1官博别装死了出来解决问题你们这样不公平对待甜c是被核废水灌死了吗,05月14日 14:11
6950,猫咕噜春夏秋冬特睏户,风息神泪配合今天那条福岛核废物集装箱泄漏看所以到底为什么还会有人相信他们的数据冥王星1974同样因为钱的问题本来核事故废水可以用pe桶存80年再处理达标排放核电站周边空地有的是但要2亿美元政府就决定直排但同时可以一次次拔款修复因核事故损害的日本政府世界形象,04月23日 23:58
8274,吃块柿饼,核废水喝完了吗我说七月散晖晨曹尼玛曹尼玛曹尼玛曹尼玛曹尼玛去死,05月02日 21:46
3509,持续沉默的少年,最近由于11区核废水的事我对这几位的爱其实越来越枯竭了暂时彻底停更,05月13日 23:28
2235,服部平次告白成功了吗,再细看了一遍结婚相关的猜测是樱井说的这个时候对家有些姐不骂他夹带私货让去喝核废水啦笑死,05月09日 19:33
9950,村西头的小伙字,樊建川地瓜_N号简单按网上查询到的数据做了个计算福岛核废水137万吨体积约合13立方公里太平洋海水估算70710万立方公里核废水按含1放射性物质计算混合均匀后太平洋中放射性物质增加131011作为参考香蕉中放射性钾的含量大约是25105,04月10日 18:52
10293,努力学习的QM,如果日本起了这个头真的把不知道到底有没有处理好的核废水倒进海里那别的有核国家也会慢慢学这样排水我记得那些直接接触核辐射的人核辐射的什么粒子直接把DNA打散没办法复制所以不能新陈代谢内脏皮肤虽然还在工作但是用不了几天就会腐烂出血皮肤更快可能只需要一天唯一的办法可能就是赶紧换个身体因为大脑皮层的新陈代谢好像说是很慢的给脑子直接换个身体的话能多活一段时间核废水里也有大量的放射性元素很多国家是把核废水净化以后深埋的日本那点地方因为没办法深埋说实话想处理办法有的是只是碍于成本问题所以排到海里之所以是预告说13号还是14号就排放估计也是想在国际上通知一下没人管的话我就排了啊是一种为了成本做出的极度不负责的事情不过如果按照日本表面上说的那些净化措施全部做到的话排入到海中以后危害微乎其微是在接受范围之内的最怕的就是日本那些处理核废水的公司表面一套背后一套只为自己谋利然后移民到一些洋流几十年漂不到的地方害了全人类然后自己独活虽然直接影响的是日本周围海域和北美那边但是用不了几年也会慢慢扩散到中国日本这操作也是没谁了摆明的无赖收起全文d,04月10日 14:21
